"","X1","pros_page1","pros_page_rating_value"
"144",19,"Work environment, learning opportunities. Reasonable salary hikes each year. (10-15%) for 5 star performers it can be more! can be even 30% on absolutely exceptional situations! Bonuses now a days upto 20%.","2.0"
"145",19,"good exposure to asset owners, investment management and asset allocation and/or risk
smart and knowledgeable colleagues","5.0"
"146",19,"Dynamic workplace. Some awesome people and culture in certain offices.","3.0"
"147",19,"Work Environment (Most people in Norman are great)
Vacation and sick leaves
Benefits
Fun Days
Location (cheap living cost thus low salary I guess)
College Town thus College Football","5.0"
"148",19,"technology but sometimes interrupted
market news when IT depts can work at once
hr sometimes ok but not everywhere","5.0"
"149",19,"Great attitude of co-workers. Managers respect your life outside the job. You can take your vacations days without your manager making any comments about it.","2.0"
"150",19,"- Some very smart people at the top of their games doing some great work.
- Very international.
- Benefits are generous.","2.0"
"151",20,"Company pays good salary to get talent from Indiian market","3.0"
"152",20,"ok for graduate as career begining","2.0"
"153",20,"Very comforble and warm working environment.  Very rich culture.  Lots of learming opportuniies.  Benifits are reasonable good.  Nice and right business models.","3.0"
"154",20,"Good work environment, team work is vert good and good initial salary.","2.0"
"155",20,"Fair and open in communication.","5.0"
"156",20,"Good atmosphere and fun colleagues. The work is not necessarily rewarding, but can be interesting. A good place to start off and learn the finance industry. Pay is competitive but not excessive. Top workers are rewarded.","3.0"
"157",20,"My career was taken to the next level at this company and I will be forever grateful for this opportunity.  In my experience, hard work and a demonstrated results will get you places.  In recent years the company has really worked hard to improve the career development of its employees -previously it was sorely lacking. There was some good training sessions that I found very valuable.","5.0"
"158",20,"None whatsoever about this company","5.0"
"159",20,"Good culture and interesting work","2.0"
"160",20,"Good salary compared to market average
Health insurance
Retirement saving account
Several round recruitment process to ensure the very high quality staff (except middle management and above)","2.0"
"161",21,"Very flexible work schedule, good pay and benefits.","3.0"
"162",21,"some interesting work being done, flexible work schedule, low stress","2.0"
"163",21,"great company in growth mode with plenty of interesting development areas","3.0"
"164",21,"Is good because you have good opportunity to learn","2.0"
"165",21,"The ever changing middle and lower level staff from all over.  More and more are leaving unfortunately,  when they realize no great advances unless connected or brilliant manipulators.
A potential for good mix of companies, but too many alienated and deceptive things.","5.0"
"166",21,"Riskmetrics was a start-up inhabiting the body of a publicly traded financial firm. It was a magnet for people who loved finance but weren't big fans of Wall Street's cultural rot. Working there was a privilege.","3.0"
"167",21,"Good salary and compensation package (Life insurance, pension fund payment, bonus, 1 month extra payment, high salary). Very nice office environment.","5.0"
"168",21,"Je zou echt genieten van het werken met MSCI als je van grote hoeveelheden data geniet, dit is een erg breed spectrum die het verzamelen, controleren en analyseren omvat. Bovendien, de werkomgeving is er ontspannen vergeleken met andere investering analytici en financiële instellingen.
Hoewel er veel druk ligt op de werk nauwkeurigheid, is het behapbaar, vooral als je erg open staat en enthousiast bent over het... leren van nieuwe dingen en processen. Een erg belangrijk onderdeel van het werken in MSCI is dat je veel inzicht moet hebben in het gebruik en impact van jouw werk op de klant.","5.0"
"169",21,"Solid research teams across Barra and Index","2.0"
"170",21,"Interesting people and industry, good products, strong ethics. Compensation is ok, but not industry leading.","2.0"
"171",22,"Pay is OK but only at the higher title levels. Domain and analytical work itself can be highly interesting and challenging, if not for the corporate bureaucracy and infighting that impedes progress. Decent benefits such as medical, vision, 401k, etc.","3.0"
"172",22,"Can maintain good work/life balance","2.0"
"173",22,"Some smart people around. 
Competitors aren't much better. 
Dynamic culture. Lots of aggressive managers, male and female. 
It's like Wall Street without the big bonuses","3.0"
"174",22,"Great working culture, smart and nice people around","2.0"
"175",22,"Array of talented junior reports
Possible career growth though very slow because of terrible team dynamics and shaky HR
A yearly Fun Day","5.0"
"176",22,"Pay is good if you negotiate well. they generally offer you a handsome amount which will satisfy most.","3.0"
"177",22,"The company seems to care a lot about morale, fun days every summer, recreational activities over lunch. liberal leave and telework policies.","5.0"
"178",22,"RiskMetrics had a culture that promoted and rewarded competence, and strong hiring practices that ensured you would be working alongside people who were good at what they did.  Senior management promoted an egalitarian culture that is uncommon in the finance industry, and put real effort into making everyone feel valued.  Risk-taking was encouraged, and failure was generally seen as a learning experience that... wouldn't necessarily cost anyone their job or seriously damage their career.  The best part for me was being surrounded by smart colleagues who were strongly committed, challenged me and helped me raise my game, no matter what the context.  It wasn't always fun, but it was always worth the effort.","5.0"
"179",22,"Great work culture and work life balance, flat organizational structure with no boundaries between senior and junior employees, casual culture.","2.0"
"180",22,"Great place to experience the inner workings and depth of Barra's data based models. Notice that positions are often heavy on the computer analysis and programming side of finance.","2.0"
"181",23,"Very good enviroment and benefits","3.0"
"182",23,"Der Markenname öffnet Türen und ermöglicht interessante Kontakte

Relative Freiheit bei der Berufsausübung, solange alles klappt

Gute theoretische Forschung, intellektuell fordernd

Besser organisierte Abläufe als manche größere Organisationen","2.0"
"183",23,"1. Hire good peoples
2. Good for learning
3. Growth Opportunity","3.0"
"184",23,"You will have many opportunities to work with people all over the world and learn from them. People are mostly responsible here. The job is good in work-life balance.","2.0"
"185",23,"You get good Work/life balance, time-office policies, and work Enviroment.","5.0"
"186",23,"The people are great. Plenty of interesting work to do so there is always a way to demonstrate skills and get ahead.","3.0"
"187",23,"On the face they seem to pay well but the salaries are kept relatively same for prolonged periods of time. Most of their benefits have a lock in for a min of 2 years.","5.0"
"188",23,"Some wonderful, talented people trying to help company grow.  Compan yitself  trying to grow but needs lot of help and organization.  Finally some of sr management waking up to challenge the more chaotic, abusive even, colleagues, some of whom are finally starting to wake up and move to companies which they can more easily handle.  Some of it all still a strange golf club of associations and laziness.","5.0"
"189",23,"There are some good people who know how to treat people decently and want to try to create a decent work environment.

Pay is good.","2.0"
"190",23,"Good Pay.Good vacations,Good benefits,Work life balance is good","2.0"
"191",25,"There exists the ability to grow your role within  the firm.  Managers within the firm recognize talent and people who think outside the box, and have the patience to teach and train which opens the door to greater responsibilities and promotion along with comparable compensation.","3.0"
"192",25,"Salary is good; culture is not bad","2.0"
"193",25,"Good work location, Best way to start career, Great managed company","3.0"
"194",25,"Used to be collegial and respectful.  Maybe it's going back to that in some areas but not very consistent.   Pay ok but not very competitive.","2.0"
"195",25,"Very good culture
Transparent decision making
Independence in working
Good knowledge sharing","5.0"
"196",25,"Lot of smart people. Average money. wide spectral of available knowledge. Good office building.","3.0"
"197",25,"Some very smart research and knowledgable consultants to work with.  Very flexible working schedule and easy access to top level management.","5.0"
"198",25,"Great benefit and fun people to work with. Not a lot of room to grow though. The product is going down hill because of poor software development life cycle.","5.0"
"199",25,"Great Salary and Benefit. Excelent Work-Life balance.
I highly recommended this company to work for. Very smart people.
Nice offices and excelente location.
Good reference for future career.
Offers interaction with international clients and colleagues.","2.0"
"200",25,"Its been 1.5 Yrs for me in MSCI. 

1) Good Leaders (Managers) - Help to explore & strengthen your capabilities.
2) Clear Goal Settings - Help to achieve your EOY tasks.
3) No unwanted pressure at work.
4) Lots of Individual contributor - Make you feel not to worry much about designations.
5) Good Pay master - Anytime better than the competitors.","2.0"
"201",26,"Challenging work environment with highly academically and technically trained people. Opportunity to extend financial knowledge.","3.0"
"202",26,"Nothing at all which can be said positive. They believe that an employee is a machine, and can be replaced anytime, which results in you sometimes feeling like a bonded blue-collar labor","2.0"
"203",26,"Work culture is great, its a place you can work for and yet have a satisfactory after-work life. It exposes you to the working on a global brand, and gives you that leverage on your resume. There are no late night assignments, or restrictions on taking leaves.","3.0"
"204",26,"Sales people have large base pay. Trips easily expensed. Easy product to sell. Brand recognition.","2.0"
"205",26,"Among the top firms of its kind, forefront of innovation and constantly referred to as excellent by clients.","5.0"
"206",26,"1. Great Pay
2. Competitive benefits
3. Free culture - can walk up to any senior management person without hesitancy
4. Decent budgets provided for team-activities every year
5. Cool Office interior","3.0"
"207",26,"Earlier great product.

Earlier great teams.","5.0"
"208",26,"Professional culture, pleasant work environment and cool people.  Innovative tech / investment tools provider listed on NYSE.","5.0"
"209",26,"There were lots of talented people, and decent work environment. Good benefits and work life balance.","2.0"
"210",26,"very friendly environment with lots of people","2.0"
"211",27,"Decent salary, bonus and benefits","3.0"
"212",27,"Very loyal company. It would be hard to have a long career there, but they appreciate their employees.","2.0"
"213",27,"Great benefits.  Great work life balance","3.0"
"214",27,"1) People may get higher salary than they deserve in market otherwise.
2) Company was initially started by Morgan Stanly but spun off in 2009.","2.0"
"215",27,"Ability to work from home when you need to, and ability to set your own hours.","5.0"
"216",27,"Benefits package and maternity pay","3.0"
"217",27,"Salary. 
Below mid-management, know-how is decent, 
Sharp and cooperative staff","5.0"
"218",27,"Lost of flexibility, interesting, challenging work. Growth opportunity for those who are persistent.","5.0"
"219",27,"Nice culture, product based, No micro management, good work life balance. Awsome people to work with","2.0"
"220",27,"Good work life balance. Friendly working environment.","2.0"
"221",28,"smart people to work with
great brand and industry recognition
global reach
decent benefits
good products and strong research focus","3.0"
"222",28,"Good company. Good Pay. Operates like a product company.","2.0"
"223",28,"The working time is casual and free. You have enough vacations as well.","3.0"
"224",28,"Working with a global team.
Good benefits.","2.0"
"225",28,"Collaborative, flexible working hours, good package, intelligent people, nice offices, global.  When I joined, my mindset was to retire at MSCI.  That's how good I perceived the Firm to be.  For majority of my stay, I was happy and contented.  With all the changes and what's happening currently, my opinion of the Firm has dramatically changed.","5.0"
"226",28,"May have changed post acquisition, but not recommended.","3.0"
"227",28,"Total compensation is good. You have to work hard and earn your promotion like any other company. Leadership is very supportive.","5.0"
"228",28,"Process driven company, strictly managed, solid index business","5.0"
"229",28,"Good work life balance in most teams...
if you are good, you get very high visibility as the peers are very lazy to put any efforts im their work","2.0"
"230",28,"Most of the late nights/all-nights can be handled from home. Vacation days are generous.","2.0"
"231",29,"Some occasional interesting innovation.  Index part strong but facing competition","3.0"
"232",29,"Benefits are better than average for a vendor and there are clear policies on what is acceptable and what isn't, for example around travel. Trying to implement the 'OneMSCI' approach which hopes to bring greater benefits to the end client.","2.0"
"233",29,"Great working environment. Friendly, fun, highly-energetic. Sharing best practices and knowledge is always welcome. Very global and diverse, everyones is very friendly and respectful, making it easier for an employee to work in teams and across functions. Senior management is reachable, and makes you feel that your position really matters in the organization.","3.0"
"234",29,"Management is smart and dynamic, leading to constant growth and new opportunities. The firm has a strong brand, which gives current and former employees credibility in the marketplace.
As a global organization there are ample opportunities for collaboration across cultures and time zones.
Local offices often develop their own entrepreneurial culture in the context of a larger organization.","2.0"
"235",29,"Products offered are top notch, excellent benefits for employees, wonderful working environment, collaborative culture, lots of subject matter expertise","5.0"
"236",29,"Fast-paced, intense, flexible, work-life balance","3.0"
"237",29,"Less Work Load. Good leaves.","5.0"
"238",29,"- Nice salary structure
- Drop facility available
- More or less fixed work hours
- Opportunity to interact across hierarchies, including senior level, and regions","5.0"
"239",29,"New products and the market is good, so easy to try things out on clients. 
Some of ineffective senior managers have left.","2.0"
"240",29,"Some flexibility but people abuse.
Was once a little more professional.","2.0"
"241",30,"Disciplined about quality of data and client service","3.0"
"242",30,"Great work enviroment, great company to work, worked with very intellectual people, make you feel to grow professionally","2.0"
"243",30,"Very good environment, excellent atmosphere","3.0"
"244",30,"Great Office, Good Salary, Lots of learning","2.0"
"245",30,"Co-workers are nice to work with.","5.0"
"246",30,"Friendly people, supportive, nice building","3.0"
"247",30,"Good perks, bonuses, relaxed work atmosphere.","5.0"
"248",30,"Some managers are great to work for and very helpful. There is not a lot of day to day management of employees, but there sure are high expectations which they hold you accountable for.","5.0"
"249",30,"good work life balance
people are friendly, flat structure","2.0"
"250",30,"Excellent benefits and quality of work; never let go of a chance to join MSCI when you have reporting boss sitting outside India","2.0"
"251",31,"Supportive and open work environment. Get to interact with colleagues across the globe on a regular basis.","3.0"
"252",31,"Great colleagues, Opportunity to learn, Multicultural","2.0"
"253",31,"Great benefits, people are great to work with","3.0"
"254",31,"Good work life balance, Good Benefits","2.0"
"255",31,"Decent benefits package, good location, impressive name.","5.0"
"256",31,"Very (too) stable, People are generally collegial.","3.0"
"257",31,"Great company work environment and collegues. Good work life balance.","5.0"
"258",31,"Work/Life balance is amazing. I almost never worked long hours. The company overall is very accommodating about working from home. 
Benefits, i.e. health insurance was good. Comp (for New York) wasn't spectacular, but decent.","5.0"
"259",31,"You work with great people.  Most of the people are nice to work with, and the offices are really nice.  It is interesting work at a company that is driven for success.  Great benefits.","2.0"
"260",31,"MSCI is a nice place to work. The benefits are great.. so are the hours.","2.0"
"261",32,"Colleagues,decent benefits package, good work life balance, location.","3.0"
"262",32,"Mostly nice, smart people. Good benefits, relaxed atmosphere,  job security, great people.","2.0"
"263",32,"Not much.  If you're in sales you have an easier time.  Used to be fair promotions.  Now it's all just from weird connections.
Working to keep things in pipeline used to be an efficient process.
And there were easier sales until recently.","3.0"
"264",32,"Great it company that serves financial companies with data, analysis and market pulse through their indexes, risk models and portfolio analytics. It offers high degree of freedom during your work and the organization is relatively flat.","2.0"
"265",32,"job growth possibilities if you live in mumbai or manila; if based in dev market will gain exposure to other cultures when you train your eventual replacement","5.0"
"266",32,"The people are nice and friendly. The team is young. The office is very nice and the staff was generally very friendly.","3.0"
"267",32,"Smart people to work with. But unfortunately the bright ones are leaving","5.0"
"268",32,"Great Team and talent
Good Infrastructure and Benefits","5.0"
"269",32,"Awesome colleagues, high class professionals, great benefits and superb work environment.","2.0"
"270",32,"Competetive salary.
Starts to develop a new platform.","2.0"
"271",33,"Strong products, a good and well-known name makes it easier being a salesperson, good benefits package (but no work from home).","3.0"
"272",33,"Good culture and work environment. Flexible work timings with work from home option. Provides options for mentoring, skill development, along with various other workshops.","2.0"
"273",33,"Bright people, good benefits, reasonable work life balance, good location and offices, global company. Doesn't suffer fools.","3.0"
"274",33,"Culture and Work Life balance","2.0"
"275",33,"Excellent work environment - great client base, good opportunity for career progression, great management.","5.0"
"276",33,"Nice people and learn alot","3.0"
"277",33,"Nice working environment at MSCI","5.0"
"278",33,"exposure to senior level clients for junior workers, good work life balance","5.0"
"279",33,"Structure jeune et dynamique, qui réussit bien et récompense bien les plus ambitieux. Bonne ambiance mais il faut beaucoup (trop?) s'investir. Absence de réflexion de fond sur le sens de la mission de MSCI.","2.0"
"280",33,"Earlier strong brand.    
Earlier humane and fair place.
Some incompetent and abusive management has taken their act elsewhere.","2.0"
"281",34,"Good work life balance, senior people are accessible and easy to talk to, regular pay check, flexible with regards to relocation.","3.0"
"282",34,"Well recognized brand and market leader in benchmark indexing.  Decent lateral and geographic mobility especially with more experience.  Global presence and strong, diverse client base facilitate the educational process.","2.0"
"283",34,"Great work environment, high quality of people, market leading product, strong market positioning, very experienced management.","3.0"
"284",34,"* Nice Manila Building. In general, nice people in Manila","2.0"
"285",34,"* Good pay masters.
* 360 review.
* Good work life balance.","5.0"
"286",34,"Not many.  Depending on your team you might have a better work life balance than some places, but this is only a temporary illusion as the ax is probably coming for you soon.","3.0"
"287",34,"The job position is very interesting, there are opportunities to grow in the company and compensation is nice","5.0"
"288",34,"Good colleagues and a brand name that is recognised in the industry","5.0"
"289",34,"some great people to work with","2.0"
"290",34,"MSCI is a cutting-edge financial services company. Leading provide indexes, analytics, real estate data and Environment, Social and Governance reports. Smart, savvy employees in a global operation.","2.0"
"291",35,"Some of the most interesting work in asset management. You are on the forefront of trends and get to experience first-hand how the industry manages money. You can get exposure to everyone from hedge funds, asset managers, pensions. A very broad view, with lots of large, great clients. You are not just dealing with a product, many times you are selling and discussing new ideas. Some of which are disruptive (which are... interesting). Lots of models, data, and analytics work.","3.0"
"292",35,"Relatively non demanding work hours.","2.0"
"293",35,"Working hours are not excessive.","3.0"
"294",35,"Work life balance, good brand","2.0"
"295",35,"Challenging daily work with friendly colleagues","5.0"
"296",35,"In Analytics group. Good Variety of work, Very smart team","3.0"
"297",35,"Good environment, nice people around, decent office building.","5.0"
"298",35,"Mid size company, small enough so that you can have an impact, large enough to be able to work on different things, to have multiple products. Very good staff, slightly mismanaged.","5.0"
"299",35,"A great place to learn","2.0"
"300",35,"All the people at MSCI are passionate about their work and clearly know the road ahead. Its a company with its heart at the right place.","2.0"
"301",36,"Nice Salary, nice workplace and colleagues","3.0"
"302",36,"Great people, and great chance to learn for a beginner","2.0"
"303",36,"Intellectually engaging. Great place to work. Good quality of work. Excellent people. Great Global Leadership. Very demanding. Rewarding.","3.0"
"304",36,"good paymasters, great work-life balance","2.0"
"305",36,"Good work life balance here.","5.0"
"306",36,"Decent work/life balance with four weeks of vacation standard. There's some really talented people. Benefits were decent but going downhill quickly.","3.0"
"307",36,"Very smart people. Great products and strong presence in the marketplace.","5.0"
"308",36,"Average work-life balance.
Employee friendly policies.
Good technology stack.
Lots of opportunities to explore in your work area.
No too much of restrictions at work.
Support  and appreciates innovative ideas at work","5.0"
"309",36,"Some new technology.  And a yearly fun day, which you will need to job search.","2.0"
"310",36,"The company has a truly global footprint and is at the cutting edge in terms of some of the services it offers","2.0"
"311",37,"Good working environment, Positive work culture","3.0"
"312",37,"Work life Balance
Good Work Culture
Less politics compared to other companies in similar doamin","2.0"
"313",37,"Good place to gain finance experience","3.0"
"314",37,"Good pay. Work life balance. Learning opportunities","2.0"
"315",37,"nice environment, nice people, chance to work overboard","5.0"
"316",37,"I enjoyed ESG reserach internship.","3.0"
"317",37,"There are not a whole lot ... Well, decent work/life balance, however, that depends on which team you're on.  20 days of paid vacation was nice ... and the perks pretty much end there.","5.0"
"318",37,"Great dynamic environment, in some teams flexible and open management with good work culture.
Very good place to learn and develop in technology/data/finance areas, recommended for people with little to no professional experience. 
Benefits are well above average.","5.0"
"319",37,"Strong analytical product offering and great opportunity to learn and grow","2.0"
"320",37,"Great subject matter, smart people, interesting projects.","2.0"
"321",38,"Intelligent and professional people. Good IT resources.","3.0"
"322",38,"High focus on employee engagement. If you are in APPDEV, then there is lot to learn. 24x7x365 functional cafeteria(literally). Also, with the new review system things are good","2.0"
"323",38,"Its a Really good company to work for with good pay structure and good work life balance.","3.0"
"324",38,"As the firm is in a good shape to have a bright future, jobs are really meaningful, you can relate to the goals set.","2.0"
"325",38,"nice colleges
Middle level package
Nice work env","5.0"
"326",38,"Good working environment with talented people.","3.0"
"327",38,"Competitive salary
Additional VL per year of tenure (max of 5)
Annual Performance bonus
Christmas bonus is in cash (not the usual Christmas packages)
Retirement benefit","5.0"
