,X1,pros_page1,pros_page_rating_value
1,2,"Great colleagues
Good opportunities for growth and career advancement
Warm corporate culture 
High-level support for entrepreneurial initiatives, new ideas
Good benefits package",3
2,2,Flexible times and work-life balance.,2
3,2,Great work life balance. You can quickly get new responsibilities since teams are small and talent is appreciated.,3
4,2,Good for a very short-term early career move. Moving most support jobs to low-cost employment countries so no reason to stay.,2
5,2,"Great coworkers
Flexible schedule
Fun environment, very informal",5
6,2,Casual atmosphere - jeans and t-shirts are permitted.  Very intelligent co-workers.  Interesting work.,3
7,2,"- 4 weeks paid vacation plus 10 sick days
- very smart people",5
8,2,Great structure and a high amount of communication between all levels.,5
9,2,"* Learn directly how the backoffice IT systems of financial companies work.
* Learn indirectly how financial risk management software works.
* Work with people from around the world, in your office as well as the other offices around the world.
* Decent salary and benefits.",2
10,2," Great equity index business. index products are highly respected in the investment management industry and MSCI generates impressive margins. Check out their investor relations site and you know what I mean. A very profitable business means that, in pri",2
11,3,Riskmetrics Group has a very laid back atmosphere yet everyone is productive and takes responsibility for their work.  I have never worked at a company that was so interested in my success as an individual and so willing to recognized me for my accomplishments.,3
12,3,"Senior management is keen on cost cutting. If you are working in emerging markets, e.g. india, china. The center you are working at still have opportunity to grow. Your promotion ladder is still there.

In general, Work/Life balance is good. However, it also depends on which team you join, and which leader you report to.",2
13,3,"Intelligent people. Collegiate, challenging environment. Interesting client base.",3
14,3,"- Relaxed and open atmosphere
- Smart and motivated colleagues
- Great for software developers wanting to build ambitious systems",2
15,3,"access to senior management
growth opportunities if in it for the long run
fast growing company
morgan stanley background",5
16,3,"- casual dress code;
- ability to telecommute;
- app. 20 days of annual leave;",3
17,3,The opp to interact with very smart people,5
18,3,"MSCI Barra has wonderful products, talented people, and a great client list.  You will learn a lot.",5
19,3,"Great global footprint.
Smart people in all departments and at all levels.
Strong strategic focus.
People who know how to deliver strong results.",2
20,3,"Network with clients (potential employesrs)
Simple business model (either Risk or Indices)
Good office locations
Basic salary is competitive (but bonus poor)",2
21,4,"Small company environment, with opportunities to excel with hardwork.",3
22,4,"good work life balance, friendly people, good reputation in the risk management industry, pretty good pay and compensation, good management, relaxed culture",2
23,4,"Great Culture, Smart people who are approachable, mutual respect. Not Bureaucratic.",3
24,4,"I work at RMG because of the people, culture, growth (personal & professional) and opportunities.  I know I could make more money elsewhere but I'm doing what I love with people I really like.  One of the cool things is that RiskMetrics encourages us to focus on our strengths to guide our careers.",2
25,4,"challenging environment; friendly, intellectually curious and knowledgable coworkers; family-friendly company; feedback is respected by management",5
26,4,"Relaxed environment.
Good hours
Family-centric
Non-manager are nice people",3
27,4,"Great people and the chance to work with global offices
Decent pay and decent benefit
Opportunities for transferring to different locations",5
28,4,"There's flexibility at work, people are smart, projects are challenging, Work place and environment is fun, overall comensation is satisfactory",5
29,4,(true)RiskMetrics people is probably the biggest reason you would work for RiskMetrics. You will learn a lot from lots of smart people who are willing to share what they know.,2
30,4,It's good to learn the Barra models if you are interested in the risk management analytics since the Barra methodology and products are industry leaders; good flexibility in term of days off and personal leaves; most people are hard working and competent,2
31,5,"Good work and life balance
Nice people",3
32,5,"Fairness and kindness atmosphere as well as open working space.
People here respect each other no matter they are senior or entry level.",2
33,5,Dirección buena y competente en general. Buen equilibrio entre el trabajo y la vida privada.  Buena comunicación en la empresa.  La presión no es tan alta como la de sus compañeros.  Ambiente divertido y en general un lugar relajado para trabajar.  Bajo índice de rotación de personal,3
34,5,"RiskMetrics culture is one that allows employees to develop through collaboration with other teams.  There is no division between groups, but more of a group effort to deliver a product.  All offices have an open office layout, making management of all levels completely accessible.",2
35,5,"Good benefits, fairly base salary. Good environment.",5
36,5,"Great people, great atmosphere (for now), ability to work on projects not related to your area of expertise.",3
37,5,"RiskMetrics was a fun place to work.  Open collaboration between groups from the CEO to Fianance to Managers to Sales, etc.  Everyone has a say and managers listen.",5
38,5,"Name Recognition
Big Footprint
The work is sometimes interesting, challenging, and engaging.
Lower level staff is intelligent, generous, and kind.",5
39,5,"The people are extremely smart, dedicated, curious, and humble and relaxed.  That is changing with MSCI merger, but that legacy won't die too easily.  

You are given the opportunity to run with your ideas.

Th culture is flat, and fun and relaxed, even thought it's Wall St.",2
40,5,RiskMetrics has a very diverse group of employees from different cultural and professional background which makes for interesting conversations and interactions.,2
41,6,Still working with some of my friends who are smart and still make it a somewhat fun environment,3
42,6,"great team, good and learned people around and a very collaborative environment",2
43,6,"Plenty of vacation days. 
Ability to network with clients and issuers (read: potential employers).
Interesting co-workers.",3
44,6,"if you wanna be professional, this is a good place to learn.",2
45,6,They pay very well.  Many people do not have enough to do.  Benefit policies are good.  It is a company that makes money.,5
46,6,"treat people relatively fairly, small but truely global; indexing business is well positioned to further grow quickly, many smart people around",3
47,6,"Good pay, intelligent people, plenty of exciting projects and work, heaps of potential.",5
48,6,you get a salary at the end of the month you get health insurance. may be there are the best reasons? if you have a good manager you will have a decent employee life if not then too bad.,5
49,6,Good company culture and many talented people.  One of the leaders in the index and risk analytics service provider in the market.,2
50,6,"great work-life balance & flextime
great colleagues
ambitious firm-- focuses on exciting growth areas and apparently willing to invest in those businesses
CEO is energetic and candid
global presence",2
51,7,ability to work from home. flex hours. nice + friendly colleagues.,3
52,7,"4 weeks paid vacation
flexibility to telecommute when needed
good work/life balance
work can be challenging
opportunity to work with smart people",2
53,7,"- Generally, your office mates are good people.
- It's a job... In today's job market, that's saying something.
- Unfortunately, there isn't much else positive to say about the company.",3
54,7,"Global office presence. Strong brand in Indices and Risk. In general nice people, talented people will not stay for long.",2
55,7,MSCI is a challenging place to work at and is growing.  It is poised to become a world leader in risk management products.,5
56,7,"Great People, very talented.
Great office",3
57,7,"Access to Franchise Risk Models and Software used professionaly in Asset management..
Collegiate environement.
Develop knowledge of requirements for supporting Financial Quant Research.
Starting Entry level salary good with decent benefit package.
It had franchise value on the resume but not so much anymore.",5
58,7,"Good place for an early career professional to pick up skills and get exposure in a brand name global company 
Very intense, fast pace work that teaches you to think on your feet 
The opportunity to work with some very hard working, dedicated people",5
59,7,"MSCI pays well to those who do exactly what they are told. If you are happy with well defined job, where you invest your energy energy into obeying those above you, MSCI will treat you well.",2
60,7,You can learn a lot in MSCI. The diversity of the workshop is also good. You work with people from different countries and cultures in MSCI.,2
61,8,Salary and benefits package were pretty good.  Co-workers were very helpful and liked to share knowledge.,3
62,8,"Environnement de travail international

Industrie solide

Potentiel de développement",2
63,8,"Work life balance, freedom to explore other areas, generous vacation, good benefits, offices in downtown new york, reasonable working hours.",3
64,8,"Fair work/life balance at lower levels, though I understand more senior levels have less flexibility.  Collegial with fellow analysts, systems that provide for some efficiencies of scale.  Opportunity for my work product to have some vast impacts on products.",2
65,8,"I think the best thing is the compensation however if you compare the load of task and compensation, you will see that it is not good.",5
66,8,Great financial serives company with a great brand,3
67,8,"Compensation, Work culture, People, Overall aptitude of the technical team",5
68,8,"Benefits package
Flexibility at times
Opportunity to learn the financial services industry
Compensation
Bonuses (a good bonus if it's been a profitable year)",5
69,8,"It still have a reputation in the industry, a well-known firm",2
70,8,Good brand and work experience. Nice people to work with. Good salary which is comparable to the industry and good benefits.,2
71,9,Adequate vacation time to help you forget how miserable your job is.,3
72,9,"MSCI is a high growth, execution focused firm.
A very positive experience for those who can work hard and achieve something over time.
Collegues at MSCI are smart, hard working, motivated and talented individuals.",2
73,9,"Smart, talented, and hard working colleagues
Strong platform of products and well positioned to continue growth
Products add value and bring transparency into the investment process",3
74,9,"Good brand, decent at work life balance, plenty of holidays,",2
75,9,"The benefits are good, with a solid retirement contribution match.  Also, everyone gets 4 weeks of vacation (though that is a negative for those working there for many years).",5
76,9,"The employees in many of the departments are good people and are a joy to work with, but this excludes nearly all management.",3
77,9,"Pleasant team, mostly challenging problems.",5
78,9,"The people I worked with, from many different offices globally, were all absolutely wonderful. I can't say enough about the great people I had the privilege of working with each day. 

4 weeks vacation (although not great if you have been there a long time)

401 (k) matching is good, although its too ironic for words that they are promoting ESG/have an ESG division and do not offer a ESG OPTION for the 401(k).... Very disappointing and disingenuous. There are also no real internal ESG policies or programs. 

Opportunities to take on significant responsibility, which gives you great experience and keeps you growing professionally (although there is no, and I mean no, financial compensation tied to taking on more responsibility. So if you do, please note that this is for your own growth and to build your resume.).",5
79,9,The work life balance is pretty good since I was not micromanaged and could come and go as I wanted.,2
80,9,"- Wages above average, if you don’t count the 30+% overtime you will be asked to put on it
- Decent year-end bonuses
- Offices are usually in prime locations in the financial capitals (although relocation and travels are discouraged)
- Attractive he",2
81,10,Very good benefits and 401k company match.,3
82,10,The people I worked with were great and it was a pretty stress-free environment,2
83,10,"Cutting edge financial and statistical research
Great team and leadership in my office
Good knowledge sharing in my office
Nice fundays",3
84,10,People are friendly and nice,2
85,10,"Excellent place to start your career; state-of-the-art technology, better than average in terms of professional approach. Self-starters would love this place who know what they want to get from a position.",5
86,10,"Just like living in a small town, working for a small organization provides employees with a chance to get to know and interact with all their coworkers",3
87,10,"- reasonable pay (not comparable to the banking industry)
- opportunities to get promoted (due to high turnover)
- good work-life balance",5
88,10,"Good office locations, good benefits, access to leading edge financial research, access to clients where you can network.   Indices business is a cash cow.",5
89,10,"1. The Morgan Stanley DNA
2. Extremely profitable and scalable business model
3. Encouraging regulatory landscape and changing preferences in institutional investment towards increased sophistication in investment process and risk management makes MSCI's future a compelling story",2
90,10,"management, ceo, diversity, risk experts",2
91,12,"Some colleagues are great people, lots to learn from them, most people are smart and qualified to do jobs, if not manage others
Generally, non-comp benefits are competitive and fair",3
92,12,Hard working individuals supporting solid products.  Competitive benefits and salaries offer great balance.,2
93,12,"Good environment
Amazing people
amazing live/work balance
salary",3
94,12,"Challenging job and worked with a group of very smart individuals.  Company planned some fun team building events such as ""Fun Day"" and ""Friday drinks""",2
95,12,"MSCI is a leader in the risk management and index business.
The company has been growing steadily via strategic acquisitions.
Management is very approachable and open.
Benefits are attractive.",5
96,12,Very Causal and cool and relaxing,3
97,12,New technology to learn deal with.  Hmm having a really hard time comming up with pros for this company after working for them for 8 years.,5
98,12,"Great people, good place to learn finance basics, recognized brands, networking (tip: stay in touch with people leaving the company for future career opportunities).",5
99,12,"People, Work environment, Learn a lot, systems and technology, movility",2
100,12,"It's a place with excellent teamwork / collaboration, and excellent work environment, ranging from local duties to global responsibilites. There are several interesting projects in development all the time, and they take your collaboration and opinions seriously.
There are also some good career development opportunities along the way, and they care about their employees.",2
101,13,"Smart and talented people you can learn from everyday.
A high growth company that allows you to see your own achievement and make a difference.
A company that encourages career development and growth.
Good leaders who listen and supports you.",3
102,13,"High growth company, can be an exciting place to work, nice culture where everyone gets on yet is still personally ambitious without being backstabbing",2
103,13,"Easy people, very laid back.",3
104,13,"Highly skilled associates

Average to decent salary

Resources from the hybrid of organizations

interesting projects",2
105,13,Good compensation and benefits Large bonus they say..,5
106,13,"Good pay and benefits, they even pay bonuses",3
107,13,"Good work environment many activites.
Good salary.",5
108,13,"Some really smart people who are the top of their field.
Fairly flexible approach to working
Good Technology Infrastructure internally to enable the above.",5
109,13,"Good Team Culture, exciting projects, good way to broaden your horizon and learn about various investment tools",2
110,13,Intelligent people at just about every level.  High degree of technology though the environment is locked down a bit. Indexing business makes money without trying and is thus the prized group.  A sales company disguised as a financial tech company.,2
111,14,Salary and working environment are both look fine but not less and unfortunately not more. Can improve skills such as how to follow up continously.,3
112,14,Lot of opportunities to grow and learn,2
113,14,good work good exposure good work life balance,3
114,14,"MSCI has a value driven culture and a lot of intelligent, motivated individuals who know how to work as a team.",2
115,14,"Can work 9-5
High compensation
Great benefits",5
116,14,"You will have an opportunity to meet people from all over the world, especially people from India and the Phillipines, as you train them to do your job.",3
117,14,"Competitive package...., Good work environment..Global Presence, lot of training..",5
118,14,"Lots of young professionals, like a summer camp",5
119,14,Creative environment. Flexible working hours. Lots of independence. Lots of potential to grow.,2
120,14,"Interesting work
Some Very Smart People",2
121,15,Lots of work u need to do.,3
122,15,"Friendly senior management, 
good work culture",2
123,15,"comfortable and easy job, you have enough time to improve yourself.",3
124,15,Index products are good and are righty labeled as industry standard.,2
125,15,"Good package, good profiles, Good reviews from collegues",5
126,15,Training was a priority by management,3
127,15,"My four year stint with the company provided me a training ground for further jobs in the field of financial research.  I enjoyed the training they provided including the trip to the headquarters. Almost all employees are like-minded and enjoyed each others company even outside the workplace.  Furthermore, there were bonuses commensurate to performance so everyone is motivated to do their best.",5
128,15,People doing the actual work are very smart.,5
129,15,"Opportunity to work closely with people in different countries, employees are well compensated and management is very good at watching the bottom line",2
130,15,"- There are great benefits at MSCI.  Women get 16 weeks of maternity leave and men get 2 weeks of paternity leave.  There are discounts to local gyms, yoga in the office, etc...
- Office has amazing views.",2
131,16,"Interesting Industry, High Exposure to portfolio management.",3
132,16,The company is great to learn as far as you want to. There are very smart and highly academical and technical trained people but they are not located in Emerging Markets.,2
133,16,"you could touch many different fields, such as portfolio management and risk management, both local and global market, equity and fixed income.",3
134,16,"Flexible work time;
Good work life balance;
Compensation is on par with industry average;",2
135,16,"good benefits.
Can be a good place to start career",5
136,16,"time flexibility: you can arrive late once in a while, and for a doctor appointment, you can leave early
Nice colleagues: not very smart but yes, good at work and very professional",3
137,16,The company has moved a new location which is close to metro,5
138,16,"A good place to start your career, nice atmosphere, felxible working hours and some experienced collegaues to learn from. International operation is also a plus (fun to work with Berkeley and Beijing at the same time)",5
139,16,"Great learning experience, got to work on current technologies.",2
140,16,"Absolute supportive company, no matter what your special situation a solution is found. Good wage in comparisation to other companies in the branch, Christmas money, Bonus if the company did have profit, so everybody is keen on making sure it does! Quality office environment, centralized location, super cooperative colleges, all fully set on making your work be successful.",2
141,17,Good Learning EXp and also friendly atmosphere,3
142,17,"interesting domain, friendly people, lose structure allowing you to take things in your hands, if you have initiative and proved yourself you can easily pick up new tasks and grow,
fresh wave of energized executives from GS pushing for improvement and changes in personnel",2
143,17,"Great technical knowledge
Good work environment
Leaders, executives are mostly friendly and helpful",3
144,17,"Flexible work schedule, casual, and friendly environment.  Atmosphere sometimes a little too casual.",2
145,17,Good quality of life and nice place to work,5
146,17,"Independent work, diverse, highly motivated and creative people, a long career for top talent. Good vacation and holiday time. Really values clients.",3
147,17,"- Capable, smart, driven, and nice people
- At times can contribute to cutting edge research
- Good benefits",5
148,17,"Good work life balance, easy working hours",5
149,17,"Great people.  The benefits are not bad, but the stress you go through to get them is not worth it.  Single people discrimination is rampant here.  If you have a kid you get leave early every day.  If you don't, keep working.",2
150,17,"Very good learning and development opportunities, good atmosphere, a lot of talented and nice people. Strong products, market leader in many segments.",2
151,18,"Dynamic, international, client focused organization that rewards hard work and holds employees to high standards.",3
152,18,"Some seriously smart people occasionally allowed to bloom.
Great benefits.
Very international.",2
153,18,only few and they can be pretty temporary...,3
154,18,"Highly focused on knowledge dissemination and facilitates learning 
Values good work
Top mgt across the world have an entrepreneurial culture
Everyone from CEO onwards work very hard
Good values and serious about delivering value to clients
Pays better than peers but also expects top work from staff
No ego at most levels",2
155,18,Easy hours;  Reasonable comp; Pleasant office / environment;  Friendly people;  Get exposure to many investment organizations using indices and analytics tools,5
156,18,"Everyday is different, very pleasant working environment",3
157,18,"Good compensation and benefits.  Very interesting domain, at the intersection of finance, analytics, software, and data.  Opportunity to work with some of the biggest names in the finance industry.",5
158,18,"Variety, from the many companies it keeps buying.
Some decent benefits.
Mixed products, even if the labor to make them is all over the place.
Interesting history. But with shaky potential, since competition started catching up.",5
159,18,"Flexible schedule, casual dress, great people, stock options, decent pay, great bonuses, fun work.",2
160,18,A lot of exposure to financial markets and across all client segments,2
162,20,ok for graduate as career begining,2
163,20,Very comforble and warm working environment.  Very rich culture.  Lots of learming opportuniies.  Benifits are reasonable good.  Nice and right business models.,3
164,20,"Good work environment, team work is vert good and good initial salary.",2
165,20,Fair and open in communication.,5
166,20,"Good atmosphere and fun colleagues. The work is not necessarily rewarding, but can be interesting. A good place to start off and learn the finance industry. Pay is competitive but not excessive. Top workers are rewarded.",3
167,20,"My career was taken to the next level at this company and I will be forever grateful for this opportunity.  In my experience, hard work and a demonstrated results will get you places.  In recent years the company has really worked hard to improve the career development of its employees -previously it was sorely lacking. There was some good training sessions that I found very valuable.",5
168,20,None whatsoever about this company,5
169,20,Good culture and interesting work,2
170,20,"Good salary compared to market average
Health insurance
Retirement saving account
Several round recruitment process to ensure the very high quality staff (except middle management and above)",2
171,21,"Very flexible work schedule, good pay and benefits.",3
172,21,"some interesting work being done, flexible work schedule, low stress",2
173,21,great company in growth mode with plenty of interesting development areas,3
174,21,Is good because you have good opportunity to learn,2
175,21,"The ever changing middle and lower level staff from all over.  More and more are leaving unfortunately,  when they realize no great advances unless connected or brilliant manipulators.
A potential for good mix of companies, but too many alienated and deceptive things.",5
176,21,Riskmetrics was a start-up inhabiting the body of a publicly traded financial firm. It was a magnet for people who loved finance but weren't big fans of Wall Street's cultural rot. Working there was a privilege.,3
