,Unnamed: 0,X1,pros_page1,pros_page_rating_value,answer_re,answer_re_oth,answer_re_n
215,216,27,Benefits package and maternity pay,3,Benefits package and maternity pay,benefits package and maternity pay,pay
216,217,27,"Salary. Below mid-management, know-how is decent, Sharp and cooperative staff",5,"Salary. Below mid-management, know-how is decent, Sharp and cooperative staff",salary below mid management know how is decent sharp and cooperative staff,
217,218,27,"Lost of flexibility, interesting, challenging work. Growth opportunity for those who are persistent.",5,"Lost of flexibility, interesting, challenging work. Growth opportunity for those who are persistent.",lost of flexibility interesting challenging work growth opportunity for those who are persistent ,
218,219,27,"Nice culture, product based, No micro management, good work life balance. Awsome people to work with",2,"Nice culture, product based, No micro management, good work life balance. Awsome people to work with",nice culture product based no micro management good work life balance awsome people to work with,"work, people"
219,220,27,Good work life balance. Friendly working environment.,2,Good work life balance. Friendly working environment.,good work life balance friendly working environment ,"work, working"
220,221,28,smart people to work with great brand and industry recognition global reach decent benefits good products and strong research focus,3,smart people to work with great brand and industry recognition global reach decent benefits good products and strong research focus,smart people to work with great brand and industry recognition global reach decent benefits good products and strong research focus,"people, smart, work, benefits, great"
221,222,28,Good company. Good Pay. Operates like a product company.,2,Good company. Good Pay. Operates like a product company.,good company good pay operates like a product company ,
222,223,28,The working time is casual and free. You have enough vacations as well.,3,The working time is casual and free. You have enough vacations as well.,the working time is casual and free you have enough vacations as well ,working
223,224,28,Working with a global team. Good benefits.,2,Working with a global team. Good benefits.,working with a global team good benefits ,
224,225,28,"Collaborative, flexible working hours, good package, intelligent people, nice offices, global. When I joined, my mindset was to retire at MSCI. That's how good I perceived the Firm to be. For majority of my stay, I was happy and contented. With all the changes and what's happening currently, my opinion of the Firm has dramatically changed.",5,"Collaborative, flexible working hours, good package, intelligent people, nice offices, global. When I joined, my mindset was to retire at MSCI. That's how good I perceived the Firm to be. For majority of my stay, I was happy and contented. With all the changes and what's happening currently, my opinion of the Firm has dramatically changed.",collaborative flexible working hours good package intelligent people nice offices global when i joined my mindset was to retire at msci that s how good i perceived the firm to be for majority of my stay i was happy and contented with all the changes and what s happening currently my opinion of the firm has dramatically changed ,"flexible, working"
225,226,28,"May have changed post acquisition, but not recommended.",3,"May have changed post acquisition, but not recommended.",may have changed post acquisition but not recommended ,
226,227,28,Total compensation is good. You have to work hard and earn your promotion like any other company. Leadership is very supportive.,5,Total compensation is good. You have to work hard and earn your promotion like any other company. Leadership is very supportive.,total compensation is good you have to work hard and earn your promotion like any other company leadership is very supportive ,"compensation, work"
227,228,28,"Process driven company, strictly managed, solid index business",5,"Process driven company, strictly managed, solid index business",process driven company strictly managed solid index business,
228,229,28,"Good work life balance in most teams... if you are good, you get very high visibility as the peers are very lazy to put any efforts im their work",2,"Good work life balance in most teams... if you are good, you get very high visibility as the peers are very lazy to put any efforts im their work",good work life balance in most teams if you are good you get very high visibility as the peers are very lazy to put any efforts im their work,"work, balance"
229,230,28,Most of the late nights/all-nights can be handled from home. Vacation days are generous.,2,Most of the late nights/all-nights can be handled from home. Vacation days are generous.,most of the late nights all nights can be handled from home vacation days are generous ,
230,231,29,Some occasional interesting innovation. Index part strong but facing competition,3,Some occasional interesting innovation. Index part strong but facing competition,some occasional interesting innovation index part strong but facing competition,
231,232,29,"Benefits are better than average for a vendor and there are clear policies on what is acceptable and what isn't, for example around travel. Trying to implement the 'OneMSCI' approach which hopes to bring greater benefits to the end client.",2,"Benefits are better than average for a vendor and there are clear policies on what is acceptable and what isn't, for example around travel. Trying to implement the 'OneMSCI' approach which hopes to bring greater benefits to the end client.",benefits are better than average for a vendor and there are clear policies on what is acceptable and what isn t for example around travel trying to implement the onemsci approach which hopes to bring greater benefits to the end client ,benefits
232,233,29,"Great working environment. Friendly, fun, highly-energetic. Sharing best practices and knowledge is always welcome. Very global and diverse, everyones is very friendly and respectful, making it easier for an employee to work in teams and across functions. Senior management is reachable, and makes you feel that your position really matters in the organization.",3,"Great working environment. Friendly, fun, highly-energetic. Sharing best practices and knowledge is always welcome. Very global and diverse, everyones is very friendly and respectful, making it easier for an employee to work in teams and across functions. Senior management is reachable, and makes you feel that your position really matters in the organization.",great working environment friendly fun highly energetic sharing best practices and knowledge is always welcome very global and diverse everyones is very friendly and respectful making it easier for an employee to work in teams and across functions senior management is reachable and makes you feel that your position really matters in the organization ,"friendly, work, management, working"
233,234,29,"Management is smart and dynamic, leading to constant growth and new opportunities. The firm has a strong brand, which gives current and former employees credibility in the marketplace. As a global organization there are ample opportunities for collaboration across cultures and time zones. Local offices often develop their own entrepreneurial culture in the context of a larger organization.",2,"Management is smart and dynamic, leading to constant growth and new opportunities. The firm has a strong brand, which gives current and former employees credibility in the marketplace. As a global organization there are ample opportunities for collaboration across cultures and time zones. Local offices often develop their own entrepreneurial culture in the context of a larger organization.",management is smart and dynamic leading to constant growth and new opportunities the firm has a strong brand which gives current and former employees credibility in the marketplace as a global organization there are ample opportunities for collaboration across cultures and time zones local offices often develop their own entrepreneurial culture in the context of a larger organization ,"smart, culture"
234,235,29,"Products offered are top notch, excellent benefits for employees, wonderful working environment, collaborative culture, lots of subject matter expertise",5,"Products offered are top notch, excellent benefits for employees, wonderful working environment, collaborative culture, lots of subject matter expertise",products offered are top notch excellent benefits for employees wonderful working environment collaborative culture lots of subject matter expertise,"benefits, working"
235,236,29,"Fast-paced, intense, flexible, work-life balance",3,"Fast-paced, intense, flexible, work-life balance",fast paced intense flexible work life balance,balance
236,237,29,Less Work Load. Good leaves.,5,Less Work Load. Good leaves.,less work load good leaves ,
237,238,29,"- Nice salary structure - Drop facility available - More or less fixed work hours - Opportunity to interact across hierarchies, including senior level, and regions",5,"- Nice salary structure - Drop facility available - More or less fixed work hours - Opportunity to interact across hierarchies, including senior level, and regions", nice salary structure drop facility available more or less fixed work hours opportunity to interact across hierarchies including senior level and regions,"work, salary, senior, hours"
238,239,29,"New products and the market is good, so easy to try things out on clients. Some of ineffective senior managers have left.",2,"New products and the market is good, so easy to try things out on clients. Some of ineffective senior managers have left.",new products and the market is good so easy to try things out on clients some of ineffective senior managers have left ,senior
239,240,29,Some flexibility but people abuse. Was once a little more professional.,2,Some flexibility but people abuse. Was once a little more professional.,some flexibility but people abuse was once a little more professional ,people
240,241,30,Disciplined about quality of data and client service,3,Disciplined about quality of data and client service,disciplined about quality of data and client service,
241,242,30,"Great work enviroment, great company to work, worked with very intellectual people, make you feel to grow professionally",2,"Great work enviroment, great company to work, worked with very intellectual people, make you feel to grow professionally",great work enviroment great company to work worked with very intellectual people make you feel to grow professionally,"great, work, company"
242,243,30,"Very good environment, excellent atmosphere",3,"Very good environment, excellent atmosphere",very good environment excellent atmosphere,
243,244,30,"Great Office, Good Salary, Lots of learning",2,"Great Office, Good Salary, Lots of learning",great office good salary lots of learning,
244,245,30,Co-workers are nice to work with.,5,Co-workers are nice to work with.,co workers are nice to work with ,work
245,246,30,"Friendly people, supportive, nice building",3,"Friendly people, supportive, nice building",friendly people supportive nice building,
246,247,30,"Good perks, bonuses, relaxed work atmosphere.",5,"Good perks, bonuses, relaxed work atmosphere.",good perks bonuses relaxed work atmosphere ,work
247,248,30,"Some managers are great to work for and very helpful. There is not a lot of day to day management of employees, but there sure are high expectations which they hold you accountable for.",5,"Some managers are great to work for and very helpful. There is not a lot of day to day management of employees, but there sure are high expectations which they hold you accountable for.",some managers are great to work for and very helpful there is not a lot of day to day management of employees but there sure are high expectations which they hold you accountable for ,"work, management, great"
248,249,30,"good work life balance people are friendly, flat structure",2,"good work life balance people are friendly, flat structure",good work life balance people are friendly flat structure,"work, balance, people"
249,250,30,Excellent benefits and quality of work; never let go of a chance to join MSCI when you have reporting boss sitting outside India,2,Excellent benefits and quality of work; never let go of a chance to join MSCI when you have reporting boss sitting outside India,excellent benefits and quality of work never let go of a chance to join msci when you have reporting boss sitting outside india,benefits
250,251,31,Supportive and open work environment. Get to interact with colleagues across the globe on a regular basis.,3,Supportive and open work environment. Get to interact with colleagues across the globe on a regular basis.,supportive and open work environment get to interact with colleagues across the globe on a regular basis ,work
251,252,31,"Great colleagues, Opportunity to learn, Multicultural",2,"Great colleagues, Opportunity to learn, Multicultural",great colleagues opportunity to learn multicultural,
252,253,31,"Great benefits, people are great to work with",3,"Great benefits, people are great to work with",great benefits people are great to work with,"great, work, people"
253,254,31,"Good work life balance, Good Benefits",2,"Good work life balance, Good Benefits",good work life balance good benefits,work
254,255,31,"Decent benefits package, good location, impressive name.",5,"Decent benefits package, good location, impressive name.",decent benefits package good location impressive name ,benefits
255,256,31,"Very (too) stable, People are generally collegial.",3,"Very (too) stable, People are generally collegial.",very too stable people are generally collegial ,
256,257,31,Great company work environment and collegues. Good work life balance.,5,Great company work environment and collegues. Good work life balance.,great company work environment and collegues good work life balance ,"work, environment, company"
257,258,31,"Work/Life balance is amazing. I almost never worked long hours. The company overall is very accommodating about working from home. Benefits, i.e. health insurance was good. Comp (for New York) wasn't spectacular, but decent.",5,"Work/Life balance is amazing. I almost never worked long hours. The company overall is very accommodating about working from home. Benefits, i.e. health insurance was good. Comp (for New York) wasn't spectacular, but decent.",work life balance is amazing i almost never worked long hours the company overall is very accommodating about working from home benefits i e health insurance was good comp for new york wasn t spectacular but decent ,"balance, company, insurance, health, working"
258,259,31,"You work with great people. Most of the people are nice to work with, and the offices are really nice. It is interesting work at a company that is driven for success. Great benefits.",2,"You work with great people. Most of the people are nice to work with, and the offices are really nice. It is interesting work at a company that is driven for success. Great benefits.",you work with great people most of the people are nice to work with and the offices are really nice it is interesting work at a company that is driven for success great benefits ,"great, company, work, people"
259,260,31,MSCI is a nice place to work. The benefits are great.. so are the hours.,2,MSCI is a nice place to work. The benefits are great.. so are the hours.,msci is a nice place to work the benefits are great so are the hours ,"place, benefits"
260,261,32,"Colleagues,decent benefits package, good work life balance, location.",3,"Colleagues,decent benefits package, good work life balance, location.",colleagues decent benefits package good work life balance location ,"work, benefits"
261,262,32,"Mostly nice, smart people. Good benefits, relaxed atmosphere, job security, great people.",2,"Mostly nice, smart people. Good benefits, relaxed atmosphere, job security, great people.",mostly nice smart people good benefits relaxed atmosphere job security great people ,"smart, great"
262,263,32,Not much. If you're in sales you have an easier time. Used to be fair promotions. Now it's all just from weird connections. Working to keep things in pipeline used to be an efficient process. And there were easier sales until recently.,3,Not much. If you're in sales you have an easier time. Used to be fair promotions. Now it's all just from weird connections. Working to keep things in pipeline used to be an efficient process. And there were easier sales until recently.,not much if you re in sales you have an easier time used to be fair promotions now it s all just from weird connections working to keep things in pipeline used to be an efficient process and there were easier sales until recently ,
263,264,32,"Great it company that serves financial companies with data, analysis and market pulse through their indexes, risk models and portfolio analytics. It offers high degree of freedom during your work and the organization is relatively flat.",2,"Great it company that serves financial companies with data, analysis and market pulse through their indexes, risk models and portfolio analytics. It offers high degree of freedom during your work and the organization is relatively flat.",great it company that serves financial companies with data analysis and market pulse through their indexes risk models and portfolio analytics it offers high degree of freedom during your work and the organization is relatively flat ,"work, company"
264,265,32,job growth possibilities if you live in mumbai or manila; if based in dev market will gain exposure to other cultures when you train your eventual replacement,5,job growth possibilities if you live in mumbai or manila; if based in dev market will gain exposure to other cultures when you train your eventual replacement,job growth possibilities if you live in mumbai or manila if based in dev market will gain exposure to other cultures when you train your eventual replacement,
265,266,32,The people are nice and friendly. The team is young. The office is very nice and the staff was generally very friendly.,3,The people are nice and friendly. The team is young. The office is very nice and the staff was generally very friendly.,the people are nice and friendly the team is young the office is very nice and the staff was generally very friendly ,people
266,267,32,Smart people to work with. But unfortunately the bright ones are leaving,5,Smart people to work with. But unfortunately the bright ones are leaving,smart people to work with but unfortunately the bright ones are leaving,"work, people"
267,268,32,Great Team and talent Good Infrastructure and Benefits,5,Great Team and talent Good Infrastructure and Benefits,great team and talent good infrastructure and benefits,
268,269,32,"Awesome colleagues, high class professionals, great benefits and superb work environment.",2,"Awesome colleagues, high class professionals, great benefits and superb work environment.",awesome colleagues high class professionals great benefits and superb work environment ,"work, benefits, great"
269,270,32,Competetive salary. Starts to develop a new platform.,2,Competetive salary. Starts to develop a new platform.,competetive salary starts to develop a new platform ,
270,271,33,"Strong products, a good and well-known name makes it easier being a salesperson, good benefits package (but no work from home).",3,"Strong products, a good and well-known name makes it easier being a salesperson, good benefits package (but no work from home).",strong products a good and well known name makes it easier being a salesperson good benefits package but no work from home ,"work, benefits"
271,272,33,"Good culture and work environment. Flexible work timings with work from home option. Provides options for mentoring, skill development, along with various other workshops.",2,"Good culture and work environment. Flexible work timings with work from home option. Provides options for mentoring, skill development, along with various other workshops.",good culture and work environment flexible work timings with work from home option provides options for mentoring skill development along with various other workshops ,"options, culture, work, home"
272,273,33,"Bright people, good benefits, reasonable work life balance, good location and offices, global company. Doesn't suffer fools.",3,"Bright people, good benefits, reasonable work life balance, good location and offices, global company. Doesn't suffer fools.",bright people good benefits reasonable work life balance good location and offices global company doesn t suffer fools ,work
273,274,33,Culture and Work Life balance,2,Culture and Work Life balance,culture and work life balance,balance
274,275,33,"Excellent work environment - great client base, good opportunity for career progression, great management.",5,"Excellent work environment - great client base, good opportunity for career progression, great management.",excellent work environment great client base good opportunity for career progression great management ,"work, environment, great"
275,276,33,Nice people and learn alot,3,Nice people and learn alot,nice people and learn alot,people
276,277,33,Nice working environment at MSCI,5,Nice working environment at MSCI,nice working environment at msci,"environment, working"
277,278,33,"exposure to senior level clients for junior workers, good work life balance",5,"exposure to senior level clients for junior workers, good work life balance",exposure to senior level clients for junior workers good work life balance,"senior, work, balance"
278,279,33,"Structure jeune et dynamique, qui réussit bien et récompense bien les plus ambitieux. Bonne ambiance mais il faut beaucoup (trop?) s'investir. Absence de réflexion de fond sur le sens de la mission de MSCI.",2,"Structure jeune et dynamique, qui réussit bien et récompense bien les plus ambitieux. Bonne ambiance mais il faut beaucoup (trop?) s'investir. Absence de réflexion de fond sur le sens de la mission de MSCI.",structure jeune et dynamique qui réussit bien et récompense bien les plus ambitieux bonne ambiance mais il faut beaucoup trop s investir absence de réflexion de fond sur le sens de la mission de msci ,
279,280,33,Earlier strong brand. Earlier humane and fair place. Some incompetent and abusive management has taken their act elsewhere.,2,Earlier strong brand. Earlier humane and fair place. Some incompetent and abusive management has taken their act elsewhere.,earlier strong brand earlier humane and fair place some incompetent and abusive management has taken their act elsewhere ,management
280,281,34,"Good work life balance, senior people are accessible and easy to talk to, regular pay check, flexible with regards to relocation.",3,"Good work life balance, senior people are accessible and easy to talk to, regular pay check, flexible with regards to relocation.",good work life balance senior people are accessible and easy to talk to regular pay check flexible with regards to relocation ,"flexible, people, pay, senior, work"
281,282,34,"Well recognized brand and market leader in benchmark indexing. Decent lateral and geographic mobility especially with more experience. Global presence and strong, diverse client base facilitate the educational process.",2,"Well recognized brand and market leader in benchmark indexing. Decent lateral and geographic mobility especially with more experience. Global presence and strong, diverse client base facilitate the educational process.",well recognized brand and market leader in benchmark indexing decent lateral and geographic mobility especially with more experience global presence and strong diverse client base facilitate the educational process ,
282,283,34,"Great work environment, high quality of people, market leading product, strong market positioning, very experienced management.",3,"Great work environment, high quality of people, market leading product, strong market positioning, very experienced management.",great work environment high quality of people market leading product strong market positioning very experienced management ,work
283,284,34,"* Nice Manila Building. In general, nice people in Manila",2,"* Nice Manila Building. In general, nice people in Manila", nice manila building in general nice people in manila,people
284,285,34,* Good pay masters. * 360 review. * Good work life balance.,5,* Good pay masters. * review. * Good work life balance., good pay masters review good work life balance ,"work, pay"
285,286,34,"Not many. Depending on your team you might have a better work life balance than some places, but this is only a temporary illusion as the ax is probably coming for you soon.",3,"Not many. Depending on your team you might have a better work life balance than some places, but this is only a temporary illusion as the ax is probably coming for you soon.",not many depending on your team you might have a better work life balance than some places but this is only a temporary illusion as the ax is probably coming for you soon ,"work, balance"
286,287,34,"The job position is very interesting, there are opportunities to grow in the company and compensation is nice",5,"The job position is very interesting, there are opportunities to grow in the company and compensation is nice",the job position is very interesting there are opportunities to grow in the company and compensation is nice,"compensation, company"
287,288,34,Good colleagues and a brand name that is recognised in the industry,5,Good colleagues and a brand name that is recognised in the industry,good colleagues and a brand name that is recognised in the industry,
