,X1,pros_page1,pros_page_rating_value
177,21,"Good salary and compensation package (Life insurance, pension fund payment, bonus, 1 month extra payment, high salary). Very nice office environment.",5
178,21,"Je zou echt genieten van het werken met MSCI als je van grote hoeveelheden data geniet, dit is een erg breed spectrum die het verzamelen, controleren en analyseren omvat. Bovendien, de werkomgeving is er ontspannen vergeleken met andere investering analytici en financiële instellingen.
Hoewel er veel druk ligt op de werk nauwkeurigheid, is het behapbaar, vooral als je erg open staat en enthousiast bent over het... leren van nieuwe dingen en processen. Een erg belangrijk onderdeel van het werken in MSCI is dat je veel inzicht moet hebben in het gebruik en impact van jouw werk op de klant.",5
179,21,Solid research teams across Barra and Index,2
180,21,"Interesting people and industry, good products, strong ethics. Compensation is ok, but not industry leading.",2
181,23,Very good enviroment and benefits,3
182,23,"Der Markenname öffnet Türen und ermöglicht interessante Kontakte

Relative Freiheit bei der Berufsausübung, solange alles klappt

Gute theoretische Forschung, intellektuell fordernd

Besser organisierte Abläufe als manche größere Organisationen",2
183,23,"1. Hire good peoples
2. Good for learning
3. Growth Opportunity",3
184,23,You will have many opportunities to work with people all over the world and learn from them. People are mostly responsible here. The job is good in work-life balance.,2
185,23,"You get good Work/life balance, time-office policies, and work Enviroment.",5
186,23,The people are great. Plenty of interesting work to do so there is always a way to demonstrate skills and get ahead.,3
187,23,On the face they seem to pay well but the salaries are kept relatively same for prolonged periods of time. Most of their benefits have a lock in for a min of 2 years.,5
188,23,"Some wonderful, talented people trying to help company grow.  Compan yitself  trying to grow but needs lot of help and organization.  Finally some of sr management waking up to challenge the more chaotic, abusive even, colleagues, some of whom are finally starting to wake up and move to companies which they can more easily handle.  Some of it all still a strange golf club of associations and laziness.",5
189,23,"There are some good people who know how to treat people decently and want to try to create a decent work environment.

Pay is good.",2
190,23,"Good Pay.Good vacations,Good benefits,Work life balance is good",2
191,24,"Good Salaries, Lots of Work, If you are always an individual contributor this is the company for you.
Lots of Technical work. In MSCI Work never finishes.",3
192,24,"1. Good money: the general perception is that salaries are higher than what other, similar companies can offer, especially in Emerging Market offices;
2. The company is abundant in learning opportunities, thanks to the available internal training programs. The company also supports the education of employees by giving them substantial support to sign up for the CFA exam. Also, MSCI has very high profile clients and... if you have the chance to work with them, you get richer every day with important experience;
3. The company provides a professional, well equipped and modern office environment.;
4. The competitve environment of MSCI forces you to learn to promote yourself and to build your brand internally - in my view, this is a pro;
5. Great work-life balance - all-nighters are uncommon;
6. Some team leaders are exceptional and great to work with. MSCI selects its employees carefully, so you can work with some really smart people;
7. If you like working in an international environment with many teams all around the globe, MSCI is your place.",2
193,24,"Leader in ESG investing, great place for ESG training; strong employee engagement",3
194,24,"Nice Company, Pay Scale is good. Depends on project on which you are working.",2
195,24,"Very few that I can think of.  As a former employee of ISS, I was concerned when RMG purchased the company.   It turns out that concern was more than justified.",5
196,24,"The people were brilliant, the opportunities open to all employees who were willing to put in the work to make it happen. The company had a good vacation policy, an emphasis on importance of the family in an employee's life.",3
197,24,"Friendly environment, great benefits. Excellent work-life balance.",5
198,24,"-Great place to start your career, a lot of learning of financial analytics
-Good work-life balance
-Excellent brand value",5
199,24,"Good place to work.
Good environment.
Good compensation",2
200,24,"Best reasons to join include continual strategic growth of company through acquisition, and worldwide reach and resources.",2
201,26,Challenging work environment with highly academically and technically trained people. Opportunity to extend financial knowledge.,3
203,26,"Work culture is great, its a place you can work for and yet have a satisfactory after-work life. It exposes you to the working on a global brand, and gives you that leverage on your resume. There are no late night assignments, or restrictions on taking leaves.",3
204,26,Sales people have large base pay. Trips easily expensed. Easy product to sell. Brand recognition.,2
205,26,"Among the top firms of its kind, forefront of innovation and constantly referred to as excellent by clients.",5
206,26,"1. Great Pay
2. Competitive benefits
3. Free culture - can walk up to any senior management person without hesitancy
4. Decent budgets provided for team-activities every year
5. Cool Office interior",3
207,26,"Earlier great product.

Earlier great teams.",5
208,26,"Professional culture, pleasant work environment and cool people.  Innovative tech / investment tools provider listed on NYSE.",5
209,26,"There were lots of talented people, and decent work environment. Good benefits and work life balance.",2
210,26,very friendly environment with lots of people,2
211,27,"Decent salary, bonus and benefits",3
212,27,"Very loyal company. It would be hard to have a long career there, but they appreciate their employees.",2
213,27,Great benefits.  Great work life balance,3
214,27,"1) People may get higher salary than they deserve in market otherwise.
2) Company was initially started by Morgan Stanly but spun off in 2009.",2
215,27,"Ability to work from home when you need to, and ability to set your own hours.",5
216,27,Benefits package and maternity pay,3
217,27,"Salary. 
Below mid-management, know-how is decent, 
Sharp and cooperative staff",5
218,27,"Lost of flexibility, interesting, challenging work. Growth opportunity for those who are persistent.",5
219,27,"Nice culture, product based, No micro management, good work life balance. Awsome people to work with",2
220,27,Good work life balance. Friendly working environment.,2
221,28,"smart people to work with
great brand and industry recognition
global reach
decent benefits
good products and strong research focus",3
222,28,Good company. Good Pay. Operates like a product company.,2
223,28,The working time is casual and free. You have enough vacations as well.,3
224,28,"Working with a global team.
Good benefits.",2
225,28,"Collaborative, flexible working hours, good package, intelligent people, nice offices, global.  When I joined, my mindset was to retire at MSCI.  That's how good I perceived the Firm to be.  For majority of my stay, I was happy and contented.  With all the changes and what's happening currently, my opinion of the Firm has dramatically changed.",5
226,28,"May have changed post acquisition, but not recommended.",3
227,28,Total compensation is good. You have to work hard and earn your promotion like any other company. Leadership is very supportive.,5
228,28,"Process driven company, strictly managed, solid index business",5
229,28,"Good work life balance in most teams...
if you are good, you get very high visibility as the peers are very lazy to put any efforts im their work",2
230,28,Most of the late nights/all-nights can be handled from home. Vacation days are generous.,2
231,29,Some occasional interesting innovation.  Index part strong but facing competition,3
232,29,"Benefits are better than average for a vendor and there are clear policies on what is acceptable and what isn't, for example around travel. Trying to implement the 'OneMSCI' approach which hopes to bring greater benefits to the end client.",2
233,29,"Great working environment. Friendly, fun, highly-energetic. Sharing best practices and knowledge is always welcome. Very global and diverse, everyones is very friendly and respectful, making it easier for an employee to work in teams and across functions. Senior management is reachable, and makes you feel that your position really matters in the organization.",3
234,29,"Management is smart and dynamic, leading to constant growth and new opportunities. The firm has a strong brand, which gives current and former employees credibility in the marketplace.
As a global organization there are ample opportunities for collaboration across cultures and time zones.
Local offices often develop their own entrepreneurial culture in the context of a larger organization.",2
235,29,"Products offered are top notch, excellent benefits for employees, wonderful working environment, collaborative culture, lots of subject matter expertise",5
236,29,"Fast-paced, intense, flexible, work-life balance",3
237,29,Less Work Load. Good leaves.,5
238,29,"- Nice salary structure
- Drop facility available
- More or less fixed work hours
- Opportunity to interact across hierarchies, including senior level, and regions",5
239,29,"New products and the market is good, so easy to try things out on clients. 
Some of ineffective senior managers have left.",2
240,29,"Some flexibility but people abuse.
Was once a little more professional.",2
241,30,Disciplined about quality of data and client service,3
242,30,"Great work enviroment, great company to work, worked with very intellectual people, make you feel to grow professionally",2
243,30,"Very good environment, excellent atmosphere",3
244,30,"Great Office, Good Salary, Lots of learning",2
245,30,Co-workers are nice to work with.,5
246,30,"Friendly people, supportive, nice building",3
247,30,"Good perks, bonuses, relaxed work atmosphere.",5
248,30,"Some managers are great to work for and very helpful. There is not a lot of day to day management of employees, but there sure are high expectations which they hold you accountable for.",5
249,30,"good work life balance
people are friendly, flat structure",2
250,30,Excellent benefits and quality of work; never let go of a chance to join MSCI when you have reporting boss sitting outside India,2
251,31,Supportive and open work environment. Get to interact with colleagues across the globe on a regular basis.,3
252,31,"Great colleagues, Opportunity to learn, Multicultural",2
253,31,"Great benefits, people are great to work with",3
254,31,"Good work life balance, Good Benefits",2
255,31,"Decent benefits package, good location, impressive name.",5
256,31,"Very (too) stable, People are generally collegial.",3
257,31,Great company work environment and collegues. Good work life balance.,5
258,31,"Work/Life balance is amazing. I almost never worked long hours. The company overall is very accommodating about working from home. 
Benefits, i.e. health insurance was good. Comp (for New York) wasn't spectacular, but decent.",5
259,31,"You work with great people.  Most of the people are nice to work with, and the offices are really nice.  It is interesting work at a company that is driven for success.  Great benefits.",2
260,31,MSCI is a nice place to work. The benefits are great.. so are the hours.,2
261,32,"Colleagues,decent benefits package, good work life balance, location.",3
262,32,"Mostly nice, smart people. Good benefits, relaxed atmosphere,  job security, great people.",2
263,32,"Not much.  If you're in sales you have an easier time.  Used to be fair promotions.  Now it's all just from weird connections.
Working to keep things in pipeline used to be an efficient process.
And there were easier sales until recently.",3
264,32,"Great it company that serves financial companies with data, analysis and market pulse through their indexes, risk models and portfolio analytics. It offers high degree of freedom during your work and the organization is relatively flat.",2
265,32,job growth possibilities if you live in mumbai or manila; if based in dev market will gain exposure to other cultures when you train your eventual replacement,5
266,32,The people are nice and friendly. The team is young. The office is very nice and the staff was generally very friendly.,3
267,32,Smart people to work with. But unfortunately the bright ones are leaving,5
268,32,"Great Team and talent
Good Infrastructure and Benefits",5
269,32,"Awesome colleagues, high class professionals, great benefits and superb work environment.",2
270,32,"Competetive salary.
Starts to develop a new platform.",2
271,33,"Strong products, a good and well-known name makes it easier being a salesperson, good benefits package (but no work from home).",3
272,33,"Good culture and work environment. Flexible work timings with work from home option. Provides options for mentoring, skill development, along with various other workshops.",2
273,33,"Bright people, good benefits, reasonable work life balance, good location and offices, global company. Doesn't suffer fools.",3
274,33,Culture and Work Life balance,2
275,33,"Excellent work environment - great client base, good opportunity for career progression, great management.",5
276,33,Nice people and learn alot,3
277,33,Nice working environment at MSCI,5
278,33,"exposure to senior level clients for junior workers, good work life balance",5
279,33,"Structure jeune et dynamique, qui réussit bien et récompense bien les plus ambitieux. Bonne ambiance mais il faut beaucoup (trop?) s'investir. Absence de réflexion de fond sur le sens de la mission de MSCI.",2
280,33,"Earlier strong brand.    
Earlier humane and fair place.
Some incompetent and abusive management has taken their act elsewhere.",2
281,34,"Good work life balance, senior people are accessible and easy to talk to, regular pay check, flexible with regards to relocation.",3
282,34,"Well recognized brand and market leader in benchmark indexing.  Decent lateral and geographic mobility especially with more experience.  Global presence and strong, diverse client base facilitate the educational process.",2
283,34,"Great work environment, high quality of people, market leading product, strong market positioning, very experienced management.",3
284,34,"* Nice Manila Building. In general, nice people in Manila",2
285,34,"* Good pay masters.
* 360 review.
* Good work life balance.",5
286,34,"Not many.  Depending on your team you might have a better work life balance than some places, but this is only a temporary illusion as the ax is probably coming for you soon.",3
287,34,"The job position is very interesting, there are opportunities to grow in the company and compensation is nice",5
288,34,Good colleagues and a brand name that is recognised in the industry,5
289,34,some great people to work with,2
290,34,"MSCI is a cutting-edge financial services company. Leading provide indexes, analytics, real estate data and Environment, Social and Governance reports. Smart, savvy employees in a global operation.",2
291,35,"Some of the most interesting work in asset management. You are on the forefront of trends and get to experience first-hand how the industry manages money. You can get exposure to everyone from hedge funds, asset managers, pensions. A very broad view, with lots of large, great clients. You are not just dealing with a product, many times you are selling and discussing new ideas. Some of which are disruptive (which are... interesting). Lots of models, data, and analytics work.",3
292,35,Relatively non demanding work hours.,2
293,35,Working hours are not excessive.,3
294,35,"Work life balance, good brand",2
295,35,Challenging daily work with friendly colleagues,5
296,35,"In Analytics group. Good Variety of work, Very smart team",3
297,35,"Good environment, nice people around, decent office building.",5
298,35,"Mid size company, small enough so that you can have an impact, large enough to be able to work on different things, to have multiple products. Very good staff, slightly mismanaged.",5
299,35,A great place to learn,2
300,35,All the people at MSCI are passionate about their work and clearly know the road ahead. Its a company with its heart at the right place.,2
301,36,"Nice Salary, nice workplace and colleagues",3
302,36,"Great people, and great chance to learn for a beginner",2
303,36,Intellectually engaging. Great place to work. Good quality of work. Excellent people. Great Global Leadership. Very demanding. Rewarding.,3
304,36,"good paymasters, great work-life balance",2
305,36,Good work life balance here.,5
306,36,Decent work/life balance with four weeks of vacation standard. There's some really talented people. Benefits were decent but going downhill quickly.,3
307,36,Very smart people. Great products and strong presence in the marketplace.,5
308,36,"Average work-life balance.
Employee friendly policies.
Good technology stack.
Lots of opportunities to explore in your work area.
No too much of restrictions at work.
Support  and appreciates innovative ideas at work",5
309,36,"Some new technology.  And a yearly fun day, which you will need to job search.",2
310,36,The company has a truly global footprint and is at the cutting edge in terms of some of the services it offers,2
311,37,"Good working environment, Positive work culture",3
312,37,"Work life Balance
Good Work Culture
Less politics compared to other companies in similar doamin",2
313,37,Good place to gain finance experience,3
315,37,"nice environment, nice people, chance to work overboard",5
316,37,I enjoyed ESG reserach internship.,3
317,37,"There are not a whole lot ... Well, decent work/life balance, however, that depends on which team you're on.  20 days of paid vacation was nice ... and the perks pretty much end there.",5
318,37,"Great dynamic environment, in some teams flexible and open management with good work culture.
Very good place to learn and develop in technology/data/finance areas, recommended for people with little to no professional experience. 
Benefits are well above average.",5
319,37,Strong analytical product offering and great opportunity to learn and grow,2
320,37,"Great subject matter, smart people, interesting projects.",2
321,39,"Friendly atmosphere, good learning and career opportunities",3
322,39,"Great place to start your career, get good experience of a fast-paced company.",2
323,39,"Great Envt , Good team,",3
324,39,"Good working hours, work-life balance, decent cafeteria, decent technology support, works well if your boss is not in your location",2
325,39,A lot of personal time,5
326,39,good work environment. felxability for kids,3
327,39,"Good learning opportunity, global clients and employees",5
328,39,"location, manager, team members, environment, peers",5
329,39,"Great culture, great people, great ambient...",2
330,39,"Work life balance , insurance , flexible hours , leaves all types sick leave paternity as well as maternity . Good cafeteria",2
331,40,"Salary Best in the business . Awsome facilities ,Great Work . Great Growth and career oppotunities",3
332,40,Decent work life balance and flexible work timings,2
333,40,"They have great benefits and remuneration package. They are flexible when it comes to work, they allow you to work from home if needed. Job promotion is easy as long as you are a performer.",3
334,40,Index business is really strong and dominates the market.,2
335,40,"Comprehensive benefits, great learning opportunities. Career path is highly dependent on how good your immediate supervisor is (or how invested they are in your growth).",5
336,40,"a lot of room for growth, lots of holidays, vacation time, and excellent benefits. very talented group of individuals.",3
337,40,Travaux de recherche et BD intéressants.,5
338,40,good place to work and learn about various stuff - some new age technology and project management. comp is competitive,5
339,40,"International and smart people, flexibility, ethical",2
340,40,"MSCI is a lifestyle firm that offers a collegiate environment. Employees are hard-working but also enjoy benefits such as company-sponsored sports, events and other perks that make the workplace a good one. Work-life balance is also good.",2
341,41,"Well known brand, nice working environment, flexible working hours, good balance of life and work. Desirable benefits, particular fit to the staff has younger children.",3
342,41,Smart people.  You can advance if you want to work all hours.,2
343,41,"Good benefits, a bit above average wage, high standard office, smart and dedicated colleges.",3
344,41,A great work life balance,2
345,41,"When I was there, there were many opportunities to move around within the organization, and I was able to work in different positions in different locations, which was excited as I was in my twenty's.",5
346,41,learn indices and risk models. quite useful.,3
347,41,I like work culture at MSCI,5
348,41,"Good work/life balance
Great atmosphere/coworkers
Access to upper management",5
349,41,Learning about portfolio risk management and indices.,2
350,41,"casual work environment, very relaxed, free games, coffee, fun events",2
351,42,The NYC location is pretty good,3
352,42,Excellent team; possibility to explore various areas of finance; competitive salary (on the Hungarian job market);,2
353,42,"Flexibility is there, Work Life balance is there, Good Salary.",3
354,42,"Hard to find anymore.  Can maybe get to work with new resources every now and then.  Management doesn't like to buy anything new.  Especially in California offices.
Some of the severely abusive and untrained managers have migrated to other fields. Of sorts.",2
355,42,renommée à exploiter dans le monde de la finance,5
356,42,"Strong franchise
Large research team
Good parts to make a great company
Employees
Teamwork",3
357,42,"Nice office, interesting work, good salary",5
358,42,A company that cares about employees,5
359,42,Caring employer. Decent work life balance. Good work environment. Work content is also good if you like investment strategy research. Well respected name,2
360,42,"Great learning particularly with regards to markets ( Risk , Portfolio Analytics , Index). Merit based culture , overseas travel , transparent culture and good work home balance",2
361,43,"Good Company to start of your career. 
MSCI rarely hire freshers. So if you are one of them. Feel proud of that.",3
362,43,"1.  Great work culture
2.  Opportunity to work with people from multiple countries is gained
3.  Good work life balance
4.  Decent compensation",2
363,43,"Very talented people and good team
Flexible on working hours",3
364,43,"good exposure, good for freshers, good pay",2
365,43,"Good benefits
Decent salary
Attempts are being made to possibly fix some internal issues",5
366,43,good reputation and open evironment,3
367,43,"Good Company to work 
Nice renemuration ( Bonus and Increment)",5
368,43,Work/life balance was good. Nice people.,5
369,43,"good work life balance
fair pay",2
370,43,Good work life balance can still be achieved if you're hitting targets. Friendly and smart people work here.,2
371,44,"Flexible work time
Free drinks
Free fruits
Team building events
Xbox
International Environment
Lot to learn",3
372,44,"Working hours are decent, office views in NY are excellent",2
373,44,"As an employee of MSCI for over three years, I think the best thing about the firm is the varied experiences our environment offers. I have been given the opportunities to own projects from start to finish and to work in areas/functions I had not previously had experience. I feel my opinion is valued and matters because I am converse with senior leaders every day as a NY employee.

I also appreciate the... opportunity I have to interact with peers around the global who are leading minds in the index and analytics space. Our products win awards and are valued by our clients and I am proud to continue to play a part in this.",3
374,44,It has some intelligent people working for it.,2
375,44,"Not many anymore.

Sometimes great sales meetings.",5
376,44,It is a very established firm and has many mature products. The client base is huge. There are a lot of opportunities to learn and to grow.,3
377,44,"Interesting work tasks, high calibre of people.",5
378,44,"Strong Index business. 
Good client list. 
Dedicated people. 
Good office location and environs (London)
Good benefits package (London)
Here and there, some talented people.",5
379,44,"Learning is good for freshers.
Can pay well ONLY when joining.
Internal career mobility is there, but it comes only as a cost arbitrage opportunity for company.
Good HR practice/engagement level.",2
380,44,Smart motivated people and solid mtmgt team,2
381,45,"great working experience
good pay
friendly staff",3
382,45,"Established Brand
Highly recurring subscription business
Well known data and analytics
Some smart people
Some innovation
Engagement surveys",2
