"","X1","pros_page1","pros_page_rating_value"
"328",38,"Work Life balance, easy transfer policy within different departments, Good leave policy, better other benefits like Mediclaim, insurance, topsline service","5.0"
"329",38,"Global reach.  Very profitable. Entrenched monopolistic position. Long term clients are largest international investors","2.0"
"330",38,"Good benefits, excellent 401k match 
Company is making progress on career development and employee engagement. 
Management is starting to listen to underlings and change is starting to happen.","2.0"
"331",39,"Friendly atmosphere, good learning and career opportunities","3.0"
"332",39,"Great place to start your career, get good experience of a fast-paced company.","2.0"
"333",39,"Great Envt , Good team,","3.0"
"334",39,"Good working hours, work-life balance, decent cafeteria, decent technology support, works well if your boss is not in your location","2.0"
"335",39,"A lot of personal time","5.0"
"336",39,"good work environment. felxability for kids","3.0"
"337",39,"Good learning opportunity, global clients and employees","5.0"
"338",39,"location, manager, team members, environment, peers","5.0"
"339",39,"Great culture, great people, great ambient...","2.0"
"340",39,"Work life balance , insurance , flexible hours , leaves all types sick leave paternity as well as maternity . Good cafeteria","2.0"
"341",40,"Salary Best in the business . Awsome facilities ,Great Work . Great Growth and career oppotunities","3.0"
"342",40,"Decent work life balance and flexible work timings","2.0"
"343",40,"They have great benefits and remuneration package. They are flexible when it comes to work, they allow you to work from home if needed. Job promotion is easy as long as you are a performer.","3.0"
"344",40,"Index business is really strong and dominates the market.","2.0"
"345",40,"Comprehensive benefits, great learning opportunities. Career path is highly dependent on how good your immediate supervisor is (or how invested they are in your growth).","5.0"
"346",40,"a lot of room for growth, lots of holidays, vacation time, and excellent benefits. very talented group of individuals.","3.0"
"347",40,"Travaux de recherche et BD intéressants.","5.0"
"348",40,"good place to work and learn about various stuff - some new age technology and project management. comp is competitive","5.0"
"349",40,"International and smart people, flexibility, ethical","2.0"
"350",40,"MSCI is a lifestyle firm that offers a collegiate environment. Employees are hard-working but also enjoy benefits such as company-sponsored sports, events and other perks that make the workplace a good one. Work-life balance is also good.","2.0"
"351",41,"Well known brand, nice working environment, flexible working hours, good balance of life and work. Desirable benefits, particular fit to the staff has younger children.","3.0"
"352",41,"Smart people.  You can advance if you want to work all hours.","2.0"
"353",41,"Good benefits, a bit above average wage, high standard office, smart and dedicated colleges.","3.0"
"354",41,"A great work life balance","2.0"
"355",41,"When I was there, there were many opportunities to move around within the organization, and I was able to work in different positions in different locations, which was excited as I was in my twenty's.","5.0"
"356",41,"learn indices and risk models. quite useful.","3.0"
"357",41,"I like work culture at MSCI","5.0"
"358",41,"Good work/life balance
Great atmosphere/coworkers
Access to upper management","5.0"
"359",41,"Learning about portfolio risk management and indices.","2.0"
"360",41,"casual work environment, very relaxed, free games, coffee, fun events","2.0"
"361",42,"The NYC location is pretty good","3.0"
"362",42,"Excellent team; possibility to explore various areas of finance; competitive salary (on the Hungarian job market);","2.0"
"363",42,"Flexibility is there, Work Life balance is there, Good Salary.","3.0"
"364",42,"Hard to find anymore.  Can maybe get to work with new resources every now and then.  Management doesn't like to buy anything new.  Especially in California offices.
Some of the severely abusive and untrained managers have migrated to other fields. Of sorts.","2.0"
"365",42,"renommée à exploiter dans le monde de la finance","5.0"
"366",42,"Strong franchise
Large research team
Good parts to make a great company
Employees
Teamwork","3.0"
"367",42,"Nice office, interesting work, good salary","5.0"
"368",42,"A company that cares about employees","5.0"
"369",42,"Caring employer. Decent work life balance. Good work environment. Work content is also good if you like investment strategy research. Well respected name","2.0"
"370",42,"Great learning particularly with regards to markets ( Risk , Portfolio Analytics , Index). Merit based culture , overseas travel , transparent culture and good work home balance","2.0"
"371",44,"Flexible work time
Free drinks
Free fruits
Team building events
Xbox
International Environment
Lot to learn","3.0"
"372",44,"Working hours are decent, office views in NY are excellent","2.0"
"373",44,"As an employee of MSCI for over three years, I think the best thing about the firm is the varied experiences our environment offers. I have been given the opportunities to own projects from start to finish and to work in areas/functions I had not previously had experience. I feel my opinion is valued and matters because I am converse with senior leaders every day as a NY employee.

I also appreciate the... opportunity I have to interact with peers around the global who are leading minds in the index and analytics space. Our products win awards and are valued by our clients and I am proud to continue to play a part in this.","3.0"
"374",44,"It has some intelligent people working for it.","2.0"
"375",44,"Not many anymore.

Sometimes great sales meetings.","5.0"
"376",44,"It is a very established firm and has many mature products. The client base is huge. There are a lot of opportunities to learn and to grow.","3.0"
"377",44,"Interesting work tasks, high calibre of people.","5.0"
"378",44,"Strong Index business. 
Good client list. 
Dedicated people. 
Good office location and environs (London)
Good benefits package (London)
Here and there, some talented people.","5.0"
"379",44,"Learning is good for freshers.
Can pay well ONLY when joining.
Internal career mobility is there, but it comes only as a cost arbitrage opportunity for company.
Good HR practice/engagement level.","2.0"
"380",44,"Smart motivated people and solid mtmgt team","2.0"
"381",45,"great working experience
good pay
friendly staff","3.0"
"382",45,"Established Brand
Highly recurring subscription business
Well known data and analytics
Some smart people
Some innovation
Engagement surveys","2.0"
"383",45,"Some really good people working there, trying to corral the mess that needs to be straightened out after most of the original talent got chased off by corporate culture changes.
If you're good, you could become a rock star. Beware the dangers that come with that.","3.0"
"384",45,"Great company if you are the share holder or if you are the client.","2.0"
"385",45,"Robust Training procedures
Global Team culture","5.0"
"386",45,"A perfect Work and Life balance. Employees are well paid (above national average) and motivated. Working atmosphere is really friendly. 

Also selection procedure is very proper so that good quality talent is extracted.","3.0"
"387",45,"As a member of the training team, I have seen firsthand the effort and emphasis MSCI puts forth on developing the talent of it's people.","5.0"
"388",45,"Global experience. Opportunity to develop your skills, abilities and knowledge. Great work environment. Great benefits (based on Mexican labor market)","5.0"
"389",45,"Professional
Fun place to work at
Amazing office
Good People","2.0"
"390",45,"Had a good leadership which encouraged learning and development of employees. You get to learn Pure politics, learn soft skills to survive in tough environment. If you work in Norman OK then you get all kinds of video games, good restaurants. Nothing much at your desk.","2.0"
"391",46,"- Working at MSCI  offer some flexibility to work from home.
- The work is interesting and you will get the chance to learn a lot about the finance industry","3.0"
"392",46,"Good work environment, all manager are easily accessible, Good work life balance","2.0"
"393",46,"A company which always thinks for its employees first -  be it the benefits,  facilities, culture or compassion for the people.","3.0"
"394",46,"Good exposure & lots to learn.","2.0"
"395",46,"Good work environment and nice colleagues
Opportunity to get exposed to advanced industry innovations
Opportunity to growth career","5.0"
"396",46,"Work Life Balance
Good Pay 
Working Conditions","3.0"
"397",46,"Great People and place - very international feeling and opportunity to work in different offices","5.0"
"398",46,"Very little when change is severe and not managed.  Occasional high moments when helping a client really solve a problem","5.0"
"399",46,"Good work-life balance. Pretty flexible about working from home, or taking time-off. 

Office camaraderie is pretty good at most locations.

Firm dips their toe into different areas of finance from Regulation, Factor Investing, Risk Management, etc. which may be good for someone who is just beginning their career.","2.0"
"400",46,"casual work atmosphere, good location","2.0"
"401",47,"- Very good work environment, with friendly people.
- Competitive compensation for the city and industry.","3.0"
"402",47,"Not a huge firm, most people are friendly, interesting product range","2.0"
"403",47,"Nice benefits
Nice people to work with
Ok salary","3.0"
"404",47,"company is employee friendly
and pay is also good","2.0"
"405",47,"The salary and benefits are within industry standards. Flexible work schedule within department. The people are generally friendly.","5.0"
"406",47,"- Many learning opportunities
- Fine-tune numerical analysis skills
- Exhaustive data mining","3.0"
"407",47,"It is a great work-life balance. You are able to leave work at a reasonable time and have commitments after works.","5.0"
"408",47,"1. MSCI's index business is subscription based and MSCI has been one of the leaders in this industry for a very long time. Due to this long standing creditability and stability in the industry, MSCI Clients continue to choose MSCI year after year. For employees, this often means high level of job security. Salaries are great and generally on the higher side. The salary structure is awesome with a very high basic... salary component (almost 60% of your total salary). This means the PF contributions are big and company matches what you contribute to your PF accounts. Yearly Bonus are over and above salaries and often range between 5-20% of your yearly salary, depending on which team you are on and how critical the contribution of the team is to the overall companies objective and strategic goals. Work life balance is excellent. I have seen people choosing their own flexible work hours depending on which location onsite they are supporting.","5.0"
"409",47,"Good atmosphere; good colleagues; not so many formalities, but still professional; one of the best financial software providers in the world","2.0"
"410",47,"Fair and good treatment of employees
Highly skilled and professional workforce
Strong, caring, motivated and passionate local management
Beautiful office","2.0"
"411",48,"Work culture is fantastic. You've plenty of team events and activities all round the year. You get to learn pretty new things with different projects.","3.0"
"412",48,"awesome environment, great food at low price , great pay scale","2.0"
"413",48,"Multinational working environment;
Working with people from the other side of the world;","3.0"
"414",48,"good work life balance, used to provide good benefits","2.0"
"415",48,"Great colleagues and team mates.  Smart people too.  
Feel like a diverse international firm.  
Global team work and collaborate closely together.    Fun too.","5.0"
"416",48,"good name, ppl are smart","3.0"
"417",48,"Solid pay, good health coverage.  Financial/Risk models are quite good in some spaces.  Company benefits from the high margins of the Index side of the business.","5.0"
"418",48,"Colleagues here are very nice and we do have work and life balance","5.0"
"419",48,"Good work life balance. Flexible working culture.","2.0"
"420",48,"Great possibilities to build and achieve individual and corporate goals in a super-active environment. Fast pace projects with professional coworkers and available tools.","2.0"
"421",49,"Good work/life balance
Just do your job and you will be fine","3.0"
"422",49,"Best to work, good environment , competitive salary, good culture","2.0"
"423",49,"The organisation is fabulous place to work in and the culture is based on meritocracy. It has an open door policy and an employee friendly culture. Your performance will definitely earn you rewards","3.0"
"424",49,"Flexible timings, good pay, smart people","2.0"
"425",49,"Superior and differentiated products.  Lots of opportunity to contribute.  Surrounded by smart and energetic people.  Excellent management team who seeks to innovate and deliver high-quality results.","5.0"
"426",49,"Exposure to global teams; good HR benefits","3.0"
"427",49,"Salary,
Not much work pressure
Good for people intrested in monotonous work without applying logic","5.0"
"428",49,"Vacaciones 20 dias, algunos jefes son flexibles, hay 10 días de enfermedad que no requieres justificar, 30 días de aguinaldo, 50% prima vacacional.","5.0"
"429",49,"Global teams, Flexible timings, ok","2.0"
"430",49,"MSCI  was a great company to work for. Over my 10 years here, MSCI gave me several opportunities that fuelled my passion and potential.  Careers develop at MSCI as long as one is a strong contributor and flexible. MSCI is also placing a huge emphasis on employee engagement and career development which will only make it an even better place to work in future.","2.0"
"431",50,"good pay, good work culture","3.0"
"432",50,"There are a lot of opportunities for growth and transfer in different office locations worldwide, flexible schedule, great environment and culture","2.0"
"433",50,"Great company to work with!","3.0"
"434",50,"The Company is of no use. So there is no Pros in this company.","2.0"
"435",50,"Average salary with some flexibility for family life, only if you are on the ""favorite"" list.","5.0"
"436",50,"Relaxed working environment. Good work life balance","3.0"
"437",50,"Flexibility in the company, you can change from office around the world for a couple of weeks if you want, a lot of home office is possible","5.0"
"438",50,"good culture and work life","5.0"
"439",50,"Decent pay.  Flat organization.  Nice NY office space.","2.0"
"440",50,"Only good thing about it is once upon a time it was part of a good company Morgan Stanley Now all the good people have left and comapny is left with mediocre people where the manager believes there main part is playing politics","2.0"
"441",51,"This is a very reputed firm and for good reasons.
Compensation is among the best.
Most people are very smart.","3.0"
"442",51,"- Benefits
- Great environment
- Multinational environment","2.0"
"443",51,"-Culture is very open, inclusive and vibrant.
-Seniors are approachable.
-Goals of Business are clear and shared to with us every year to align our department goals.
-No Ratings/ No Bell Curve in performance appraisal- Which is fantastic!","3.0"
"444",51,"company culture, benefits,compensation, office, flexible work schedule, good atmosphere","2.0"
"445",51,"Global finance exposure, develop finance and IT knowledge, good agile team, well known brand globally, stable place for a long term career.","5.0"
"446",51,"Was great team dynamics 10 years ago.
New management slowly killed jobs, morale and innovation.

Interns can be helpful, before they move on and don't look back","3.0"
"447",51,"Good culture and decent benefits","5.0"
"448",51,"Very professional organization, good benefits","5.0"
"449",51,"Growing company, stable job. My colleagues were generally very pleasant to work with.","2.0"
"450",51,"Great Process, work life balance and good culture
I didn't find politics in teams
Professional and good people
HR are great","2.0"
"451",53,"Great company to work in. There is a great working environment.","3.0"
"452",53,"Flexibility of timings,  Good hike on joining, Nice office space","2.0"
"453",53,"the compensation is good and they give a yearly bonus however total compensation is not so great.","3.0"
"454",53,"Employee friendly. Good compensation. Talented colleagues.","2.0"
"455",53,"Flexible
Full of opportunity and learning
Work life balance","5.0"
"456",53,"They had good culture and good health Benefits","3.0"
"457",53,"Management spends very little on initiatives so they can put this money into bonuses. People are well compensated but there is no work life balance so this compensation comes at a big personal price.","5.0"
"458",53,"Far pay, fair hours, good work","5.0"
"459",53,"Strong Index business unit with good client list and dedicated people in various business units.","2.0"
"460",53,"Great office facilities and time convenience","2.0"
"461",55,"I worked with MSCI for almost a year. Flexible work hours, Work life balance, Learning opportunities.","3.0"
"462",55,"Work from home option,
Pleasant environment,
Competitive salary,
Opportunities to move to the developed markets.","2.0"
"463",55,"10% pension scheme, can't think of anything else. Private Dental, Bupa, private GP service, cycle to work scheme. Nice building.","3.0"
"464",55,"Great personality amongst employees. Great opportunity to get experience, with lovely people. Basic perks included","2.0"
"465",55,"My team is great, I have a good life/work balance","5.0"
"466",55,"Like most places, there are some really talented and intelligent people working here.  You can escape the long hours and high stress of the investment banking world.  MSCI pays well.

Great benefits including gym membership discounts, backup daycare and 16 weeks of maternity leave.","3.0"
"467",55,"Great Working culture you can grow","5.0"
"468",55,"Good hours fair pay. Lots of talented people in the research department. Corporate culture is slightly better than some other rat race financial institutions.","5.0"
"469",55,"Good work environment
Acceptable work-life balance
Opportunities to transfer abroad
Leading company in its industry","2.0"
"470",55,"Decent work life balance, flexible hours, salary and benefits, able hr team up to 2014","2.0"
"471",56,"Pay is good, Benefits were good","3.0"
"472",56,"Good life and work balance ; Compensation is good for fresh graduates","2.0"
"473",56,"Very employee friendly and lots of events organized. Good benefits for employees","3.0"
"474",56,"Ok work environment. Good work/life balance","2.0"
"475",56,"Good basic pay and flexible work schedule","5.0"
"476",56,"Excellent research team and market leader in global indexing.","3.0"
"477",56,"International, Innovative, Client-Focused, Future-Facing, Corporate","5.0"
"478",56,"20 day vacation each year, great packages","5.0"
"479",56,"Great senior management
Great work life balance","2.0"
"480",56,"Good work life balance.
Good salary and benefits packages.","2.0"
"481",57,"Le persone sono carine, sanno cosa stanno facendo. Buon equilibrio lavoro-vita","3.0"
"482",57,"flexible work time, good pension plan and extra business insurance benefit","2.0"
"483",57,"Amazing team and work culture. Good performance of the business.","3.0"
"484",57,"Good Pay
Work life balance
Good brand name to work for","2.0"
"485",57,"No useless politics. Good Work. Flexible timing.","5.0"
"486",57,"Working with high ranks employees, executive directors, VPs and sometimes managing directors. The people we work with are all professionals.","3.0"
"487",57,"Good hike from previous employer, good salary and benefits like home drops and home pickups during odd hours, nice office, 24×7×365 canteen, good culture, well educated and decent colleagues, bonuses once a year, decent hikes, opportunity for internal job postings and to front-end roles, less politics","5.0"
"488",57,"Exposure to global financial industry, possibilities to grow and change positions within the firm","5.0"
"489",57,"Good Infrastructure
Friendly Environment
Work is Recognized","2.0"
"490",57,"1. Good employee benefits
2. Manageable work load
3. Good payscale","2.0"
"491",58,"Awesome work culture, No micromanagement, helpful people","3.0"
"492",58,"Some  really  smart  people and interesting work","2.0"
"493",58,"Compensated well
Interesting work
Intelligent co-workers
Non-political environment","3.0"
"494",58,"Competitive salary, nice benefits and great paid time off","2.0"
"495",58,"Good offices and benefits. Excellent work life balance.","5.0"
"496",58,"Very well positioned in the market. Generous vacation and comp structure","3.0"
"497",58,"MSCI as a company has great and employee friendly policies. Good co-workers and stakeholders. Pay higher than market and great exposure.","5.0"
"498",58,"-variety of work.
-good people to work with.
-good benefits.","5.0"
"499",58,"Flexible hours, can work from home if needed. Good health medical. Not a lot OT. Good stable place.","2.0"
"500",58,"Has a decent culture for a company of it's size. You are not locked into a specific domain technology wise - there is as much room to grow as you have the desire and capacity for.","2.0"
"501",59,"Lenient management, Work is less, Party is more. Culture is good. Management Consists of people from Diverse background and Upper management consists people from IIMs.","3.0"
"502",59,"Have to opportunity to work from home if in the development space.","2.0"
"503",59,"Good work culture and work life balance","3.0"
"504",59,"Knowledgeable coworkers.  The organization is loaded with top quality talent.","2.0"
"505",59,"Great work culture
Friendly environment
Opportunity to learn","5.0"
"506",59,"Great benefits, good perks, nice people to work with","3.0"
"507",59,"Best team mates. Everyone was so welcoming","5.0"
"508",59,"Good work life balance. Good learning if self driven in the field of financial risk. Opportunities to move abroad if you’re in the right team.","5.0"
"509",59,"Great company to work for","2.0"
"510",59,"They paid good compensation for the positions.","2.0"
"511",60,"Some really smart people and interesting work","3.0"
"512",60,"Work life balance is good","2.0"
"513",60,"nice office, good salary, pro colls","3.0"
"514",60,"A friendly place to work for.","2.0"
"515",60,"Benefit is good, and most of the groups have very collegiate and dynamic work environment","5.0"
"516",60,"Good work life balance presence","3.0"
"517",60,"nice building in the middle of the financial district","5.0"
"518",60,"Pay,  work-life balance, smart people, industry standing","5.0"
"519",60,"Great office, work environment, great team, agile, education for personal and professional growth, management transparency, benefits, HR resources.","2.0"
"520",60,"Innovation is a priority, compensation and leave are competitive. Interesting business problems to solve. Opportunities to advance are plentiful.","2.0"
"521",61,"good benefits , good pay and all","3.0"
"522",61,"Pays well, has lots of passionate employees who go the extra mile, dynamic environment, diverse and multi-cultural teams, growing business with diverse set of products (i.e. offers broad range of learning opportunities and exposure to interesting types of problems to solve and clients), good and well known brand.","2.0"
"523",61,"1. Good Place to Work.
2. Work Life Balance in most of the Teams.
3. Talented People.","3.0"
"524",61,"- Empowerment
- Transparency from Senior Managment on down
- Work with smart research and technology colleagues
- Results driven organization
- Extreme focus on shareholder value
- An experienced and demanding management team","2.0"
"525",61,"good salary as market standard.","5.0"
"526",61,"Smart Employees, will make great friends there","3.0"
"527",61,"Nice Increments
Better Salary than Market
Flexible timings
Work From Home facility
CFA and FRM Exam fees sponsored","5.0"
"528",61,"Cute office. Relatively high salary.","5.0"
"529",61,"Multi-cultural and very friendly environment","2.0"
"530",61,"- Work/personal life balance
- Mobility and career path
- Market leader on index and analytic solutions","2.0"
"531",62,"Cool boss
Unique culture
Fun (challenging) work
Amazing benefits","3.0"
"532",62,"work and life balance, nice people","2.0"
"533",62,"Many teams in the office","3.0"
"534",62,"Global culture, people in different offices and departments really support each other. Work with very knowledgeable colleagues and can learn a lot.","2.0"
"535",62,"Excellent pay, informal environment, friendly management.","5.0"
"536",62,"Work and life balanced and reasonable support.","3.0"
"537",62,"Brand in Finance
Analytics legacy
Top quality client list
Global presence
Cash flow business
Comprehensive cyber security","5.0"
"538",62,"salary and benefits, work-life balance, office quality","5.0"
"539",62,"Well paid, infrastructure,good place for a job not career","2.0"
"540",62,"- Great opportunities for growth and development
- Friendly environment
- Great diversity of use cases, investment problems and areas of expertise","2.0"
"541",63,"Good culture and opportunity for freshers","3.0"
