,Unnamed: 0,X1,pros_page1,pros_page_rating_value,answer_re,answer_re_oth,answer_re_n
0,1,1,"Good vacation: 4 full weeks. If you are a diligent worker, should feel secure in your position. Commute is easy with BART. Name recognition within the industry, looks good on the resume. Company does sponsor CFA studies and test taking. Work hours are reasonable. Good place if your background is physics or financial analysis. If you are a researcher, it is a really good place.",3,"Good vacation: full weeks. If you are a diligent worker, should feel secure in your position. Commute is easy with BART. Name recognition within the industry, looks good on the resume. Company does sponsor CFA studies and test taking. Work hours are reasonable. Good place if your background is physics or financial analysis. If you are a researcher, it is a really good place.",good vacation full weeks if you are a diligent worker should feel secure in your position commute is easy with bart name recognition within the industry looks good on the resume company does sponsor cfa studies and test taking work hours are reasonable good place if your background is physics or financial analysis if you are a researcher it is a really good place ,"hours, place"
1,2,1,The cooperative environment with colleagues.,2,The cooperative environment with colleagues.,the cooperative environment with colleagues ,environment
2,3,1,"OK compensation, good benefits, 4 weeks paid vacation, flexibility with telecommuting if desired, consistent 9 to 5 schedule, no long hors outside of proxy season, relaxed work atmosphere.",3,"OK compensation, good benefits, weeks paid vacation, flexibility with telecommuting if desired, consistent to schedule, no long hors outside of proxy season, relaxed work atmosphere.",ok compensation good benefits weeks paid vacation flexibility with telecommuting if desired consistent to schedule no long hors outside of proxy season relaxed work atmosphere ,work
3,4,1,"The company offers a tremendous opportunity to learn about the investment management business, especially on the analytics side (the old Barra). If you're in an outward-facing role, you'll also get excellent access to money manager clients (i.e., future employers). On the day to day level, you get to work with smart people and do interesting work, often in a collegial atmosphere.",2,"The company offers a tremendous opportunity to learn about the investment management business, especially on the analytics side (the old Barra). If you're in an outward-facing role, you'll also get excellent access to money manager clients (i.e., future employers). On the day to day level, you get to work with smart people and do interesting work, often in a collegial atmosphere.",the company offers a tremendous opportunity to learn about the investment management business especially on the analytics side the old barra if you re in an outward facing role you ll also get excellent access to money manager clients i e future employers on the day to day level you get to work with smart people and do interesting work often in a collegial atmosphere ,"company, people, smart, management, work"
4,5,1,"RiskMetrics is a place where everyone's opinion is valued, and everyone has the opportunity to make a contribution. There is also the opportunity to learn new things and work on exciting and interesting technologies. And, everyone has the ability to define their own career path, such as it is.",5,"RiskMetrics is a place where everyone's opinion is valued, and everyone has the opportunity to make a contribution. There is also the opportunity to learn new things and work on exciting and interesting technologies. And, everyone has the ability to define their own career path, such as it is.",riskmetrics is a place where everyone s opinion is valued and everyone has the opportunity to make a contribution there is also the opportunity to learn new things and work on exciting and interesting technologies and everyone has the ability to define their own career path such as it is ,"work, place"
5,6,1,"Formerly Barra, this was once a place that had a grad school atmosphere and was a market leader of institutional analytics. The brainpower and product knowledge and support was unrivaled then, but a lack of leadership in management and inability to harness and support talent lead to a steady bleed of talented individuals to its competitors. However some talent remains, especially on the research side, where a few... from old Barra remain, so there is still some niche opportunity for learning. Its sunny downtown Berkeley location is ideal for commuters and the atmosphere remains somewhat relaxed. Consideration for work/life balance can vary greatly with your department and supervisor.",3,"Formerly Barra, this was once a place that had a grad school atmosphere and was a market leader of institutional analytics. The brainpower and product knowledge and support was unrivaled then, but a lack of leadership in management and inability to harness and support talent lead to a steady bleed of talented individuals to its competitors. However some talent remains, especially on the research side, where a few... from old Barra remain, so there is still some niche opportunity for learning. Its sunny downtown Berkeley location is ideal for commuters and the atmosphere remains somewhat relaxed. Consideration for work/life balance can vary greatly with your department and supervisor.",formerly barra this was once a place that had a grad school atmosphere and was a market leader of institutional analytics the brainpower and product knowledge and support was unrivaled then but a lack of leadership in management and inability to harness and support talent lead to a steady bleed of talented individuals to its competitors however some talent remains especially on the research side where a few from old barra remain so there is still some niche opportunity for learning its sunny downtown berkeley location is ideal for commuters and the atmosphere remains somewhat relaxed consideration for work life balance can vary greatly with your department and supervisor ,"balance, management, talented, place"
6,7,1,"good team, atmosphere, competent people",5,"good team, atmosphere, competent people",good team atmosphere competent people,people
7,8,1,"Everybody's opinion matters, new ways of thinking are strongly encouraged.",5,"Everybody's opinion matters, new ways of thinking are strongly encouraged.",everybody s opinion matters new ways of thinking are strongly encouraged ,
8,9,1,"They offer decent pay and good benefits for fairly easy work. The employees are generally young and friendly, and the Rockville office is easily accessible.",2,"They offer decent pay and good benefits for fairly easy work. The employees are generally young and friendly, and the Rockville office is easily accessible.",they offer decent pay and good benefits for fairly easy work the employees are generally young and friendly and the rockville office is easily accessible ,"pay, benefits"
9,10,1,Relatively relaxing atmosphere. Fairly flexible working hours.,2,Relatively relaxing atmosphere. Fairly flexible working hours.,relatively relaxing atmosphere fairly flexible working hours ,"flexible, working"
10,11,2,"Great colleagues Good opportunities for growth and career advancement Warm corporate culture High-level support for entrepreneurial initiatives, new ideas Good benefits package",3,"Great colleagues Good opportunities for growth and career advancement Warm corporate culture High-level support for entrepreneurial initiatives, new ideas Good benefits package",great colleagues good opportunities for growth and career advancement warm corporate culture high level support for entrepreneurial initiatives new ideas good benefits package,"culture, benefits"
11,12,2,Flexible times and work-life balance.,2,Flexible times and work-life balance.,flexible times and work life balance ,
12,13,2,Great work life balance. You can quickly get new responsibilities since teams are small and talent is appreciated.,3,Great work life balance. You can quickly get new responsibilities since teams are small and talent is appreciated.,great work life balance you can quickly get new responsibilities since teams are small and talent is appreciated ,work
13,14,2,Good for a very short-term early career move. Moving most support jobs to low-cost employment countries so no reason to stay.,2,Good for a very short-term early career move. Moving most support jobs to low-cost employment countries so no reason to stay.,good for a very short term early career move moving most support jobs to low cost employment countries so no reason to stay ,
14,15,2,"Great coworkers Flexible schedule Fun environment, very informal",5,"Great coworkers Flexible schedule Fun environment, very informal",great coworkers flexible schedule fun environment very informal,
15,16,2,Casual atmosphere - jeans and t-shirts are permitted. Very intelligent co-workers. Interesting work.,3,Casual atmosphere - jeans and t-shirts are permitted. Very intelligent co-workers. Interesting work.,casual atmosphere jeans and t shirts are permitted very intelligent co workers interesting work ,
16,17,2,- 4 weeks paid vacation plus 10 sick days - very smart people,5,- weeks paid vacation plus sick days - very smart people, weeks paid vacation plus sick days very smart people,"smart, people"
17,18,2,Great structure and a high amount of communication between all levels.,5,Great structure and a high amount of communication between all levels.,great structure and a high amount of communication between all levels ,
18,19,2,"* Learn directly how the backoffice IT systems of financial companies work. * Learn indirectly how financial risk management software works. * Work with people from around the world, in your office as well as the other offices around the world. * Decent salary and benefits.",2,"* Learn directly how the backoffice IT systems of financial companies work. * Learn indirectly how financial risk management software works. * Work with people from around the world, in your office as well as the other offices around the world. * Decent salary and benefits.", learn directly how the backoffice it systems of financial companies work learn indirectly how financial risk management software works work with people from around the world in your office as well as the other offices around the world decent salary and benefits ,"salary, management, people"
19,20,2,"- Great equity index business. Index products are highly respected in the investment management industry and MSCI generates impressive margins. Check out their investor relations site and you know what I mean. A very profitable business means that, in pri",2,"- Great equity index business. Index products are highly respected in the investment management industry and MSCI generates impressive margins. Check out their investor relations site and you know what I mean. A very profitable business means that, in pri", great equity index business index products are highly respected in the investment management industry and msci generates impressive margins check out their investor relations site and you know what i mean a very profitable business means that in pri,management
20,21,3,Riskmetrics Group has a very laid back atmosphere yet everyone is productive and takes responsibility for their work. I have never worked at a company that was so interested in my success as an individual and so willing to recognized me for my accomplishments.,3,Riskmetrics Group has a very laid back atmosphere yet everyone is productive and takes responsibility for their work. I have never worked at a company that was so interested in my success as an individual and so willing to recognized me for my accomplishments.,riskmetrics group has a very laid back atmosphere yet everyone is productive and takes responsibility for their work i have never worked at a company that was so interested in my success as an individual and so willing to recognized me for my accomplishments ,company
21,22,3,"Senior management is keen on cost cutting. If you are working in emerging markets, e.g. india, china. The center you are working at still have opportunity to grow. Your promotion ladder is still there. In general, Work/Life balance is good. However, it also depends on which team you join, and which leader you report to.",2,"Senior management is keen on cost cutting. If you are working in emerging markets, e.g. india, china. The center you are working at still have opportunity to grow. Your promotion ladder is still there. In general, Work/Life balance is good. However, it also depends on which team you join, and which leader you report to.",senior management is keen on cost cutting if you are working in emerging markets e g india china the center you are working at still have opportunity to grow your promotion ladder is still there in general work life balance is good however it also depends on which team you join and which leader you report to ,"balance, management, working"
22,23,3,"Intelligent people. Collegiate, challenging environment. Interesting client base.",3,"Intelligent people. Collegiate, challenging environment. Interesting client base.",intelligent people collegiate challenging environment interesting client base ,
23,24,3,- Relaxed and open atmosphere - Smart and motivated colleagues - Great for software developers wanting to build ambitious systems,2,- Relaxed and open atmosphere - Smart and motivated colleagues - Great for software developers wanting to build ambitious systems, relaxed and open atmosphere smart and motivated colleagues great for software developers wanting to build ambitious systems,
24,25,3,access to senior management growth opportunities if in it for the long run fast growing company morgan stanley background,5,access to senior management growth opportunities if in it for the long run fast growing company morgan stanley background,access to senior management growth opportunities if in it for the long run fast growing company morgan stanley background,"senior, management, company, fast"
25,26,3,- casual dress code; - ability to telecommute; - app. 20 days of annual leave;,3,- casual dress code; - ability to telecommute; - app. days of annual leave;, casual dress code ability to telecommute app days of annual leave ,
26,27,3,The opp to interact with very smart people,5,The opp to interact with very smart people,the opp to interact with very smart people,"smart, people"
27,28,3,"MSCI Barra has wonderful products, talented people, and a great client list. You will learn a lot.",5,"MSCI Barra has wonderful products, talented people, and a great client list. You will learn a lot.",msci barra has wonderful products talented people and a great client list you will learn a lot ,"talented, great"
28,29,3,Great global footprint. Smart people in all departments and at all levels. Strong strategic focus. People who know how to deliver strong results.,2,Great global footprint. Smart people in all departments and at all levels. Strong strategic focus. People who know how to deliver strong results.,great global footprint smart people in all departments and at all levels strong strategic focus people who know how to deliver strong results ,people
29,30,3,Network with clients (potential employesrs) Simple business model (either Risk or Indices) Good office locations Basic salary is competitive (but bonus poor),2,Network with clients (potential employesrs) Simple business model (either Risk or Indices) Good office locations Basic salary is competitive (but bonus poor),network with clients potential employesrs simple business model either risk or indices good office locations basic salary is competitive but bonus poor ,salary
30,31,4,"Small company environment, with opportunities to excel with hardwork.",3,"Small company environment, with opportunities to excel with hardwork.",small company environment with opportunities to excel with hardwork ,company
31,32,4,"good work life balance, friendly people, good reputation in the risk management industry, pretty good pay and compensation, good management, relaxed culture",2,"good work life balance, friendly people, good reputation in the risk management industry, pretty good pay and compensation, good management, relaxed culture",good work life balance friendly people good reputation in the risk management industry pretty good pay and compensation good management relaxed culture,"friendly, culture, management, pay, work"
32,33,4,"Great Culture, Smart people who are approachable, mutual respect. Not Bureaucratic.",3,"Great Culture, Smart people who are approachable, mutual respect. Not Bureaucratic.",great culture smart people who are approachable mutual respect not bureaucratic ,people
33,34,4,"I work at RMG because of the people, culture, growth (personal & professional) and opportunities. I know I could make more money elsewhere but I'm doing what I love with people I really like. One of the cool things is that RiskMetrics encourages us to focus on our strengths to guide our careers.",2,"I work at RMG because of the people, culture, growth (personal & professional) and opportunities. I know I could make more money elsewhere but I'm doing what I love with people I really like. One of the cool things is that RiskMetrics encourages us to focus on our strengths to guide our careers.",i work at rmg because of the people culture growth personal professional and opportunities i know i could make more money elsewhere but i m doing what i love with people i really like one of the cool things is that riskmetrics encourages us to focus on our strengths to guide our careers ,"work, people"
34,35,4,"challenging environment; friendly, intellectually curious and knowledgable coworkers; family-friendly company; feedback is respected by management",5,"challenging environment; friendly, intellectually curious and knowledgable coworkers; family-friendly company; feedback is respected by management",challenging environment friendly intellectually curious and knowledgable coworkers family friendly company feedback is respected by management,management
35,36,4,Relaxed environment. Good hours Family-centric Non-manager are nice people,3,Relaxed environment. Good hours Family-centric Non-manager are nice people,relaxed environment good hours family centric non manager are nice people,"hours, people"
36,37,4,Great people and the chance to work with global offices Decent pay and decent benefit Opportunities for transferring to different locations,5,Great people and the chance to work with global offices Decent pay and decent benefit Opportunities for transferring to different locations,great people and the chance to work with global offices decent pay and decent benefit opportunities for transferring to different locations,"work, pay, people"
37,38,4,"There's flexibility at work, people are smart, projects are challenging, Work place and environment is fun, overall comensation is satisfactory",5,"There's flexibility at work, people are smart, projects are challenging, Work place and environment is fun, overall comensation is satisfactory",there s flexibility at work people are smart projects are challenging work place and environment is fun overall comensation is satisfactory,"environment, place, people"
38,39,4,(true)RiskMetrics people is probably the biggest reason you would work for RiskMetrics. You will learn a lot from lots of smart people who are willing to share what they know.,2,(true)RiskMetrics people is probably the biggest reason you would work for RiskMetrics. You will learn a lot from lots of smart people who are willing to share what they know., true riskmetrics people is probably the biggest reason you would work for riskmetrics you will learn a lot from lots of smart people who are willing to share what they know ,"smart, work, people"
39,40,4,It's good to learn the Barra models if you are interested in the risk management analytics since the Barra methodology and products are industry leaders; good flexibility in term of days off and personal leaves; most people are hard working and competent,2,It's good to learn the Barra models if you are interested in the risk management analytics since the Barra methodology and products are industry leaders; good flexibility in term of days off and personal leaves; most people are hard working and competent,it s good to learn the barra models if you are interested in the risk management analytics since the barra methodology and products are industry leaders good flexibility in term of days off and personal leaves most people are hard working and competent,"management, people, working"
40,41,5,Good work and life balance Nice people,3,Good work and life balance Nice people,good work and life balance nice people,"work, balance, people"
41,42,5,Fairness and kindness atmosphere as well as open working space. People here respect each other no matter they are senior or entry level.,2,Fairness and kindness atmosphere as well as open working space. People here respect each other no matter they are senior or entry level.,fairness and kindness atmosphere as well as open working space people here respect each other no matter they are senior or entry level ,"senior, working"
42,43,5,Dirección buena y competente en general. Buen equilibrio entre el trabajo y la vida privada. Buena comunicación en la empresa. La presión no es tan alta como la de sus compañeros. Ambiente divertido y en general un lugar relajado para trabajar. Bajo índice de rotación de personal,3,Dirección buena y competente en general. Buen equilibrio entre el trabajo y la vida privada. Buena comunicación en la empresa. La presión no es tan alta como la de sus compañeros. Ambiente divertido y en general un lugar relajado para trabajar. Bajo índice de rotación de personal,dirección buena y competente en general buen equilibrio entre el trabajo y la vida privada buena comunicación en la empresa la presión no es tan alta como la de sus compañeros ambiente divertido y en general un lugar relajado para trabajar bajo índice de rotación de personal,
43,44,5,"RiskMetrics culture is one that allows employees to develop through collaboration with other teams. There is no division between groups, but more of a group effort to deliver a product. All offices have an open office layout, making management of all levels completely accessible.",2,"RiskMetrics culture is one that allows employees to develop through collaboration with other teams. There is no division between groups, but more of a group effort to deliver a product. All offices have an open office layout, making management of all levels completely accessible.",riskmetrics culture is one that allows employees to develop through collaboration with other teams there is no division between groups but more of a group effort to deliver a product all offices have an open office layout making management of all levels completely accessible ,"culture, management"
44,45,5,"Good benefits, fairly base salary. Good environment.",5,"Good benefits, fairly base salary. Good environment.",good benefits fairly base salary good environment ,
45,46,5,"Great people, great atmosphere (for now), ability to work on projects not related to your area of expertise.",3,"Great people, great atmosphere (for now), ability to work on projects not related to your area of expertise.",great people great atmosphere for now ability to work on projects not related to your area of expertise ,"work, great"
46,47,5,"RiskMetrics was a fun place to work. Open collaboration between groups from the CEO to Fianance to Managers to Sales, etc. Everyone has a say and managers listen.",5,"RiskMetrics was a fun place to work. Open collaboration between groups from the CEO to Fianance to Managers to Sales, etc. Everyone has a say and managers listen.",riskmetrics was a fun place to work open collaboration between groups from the ceo to fianance to managers to sales etc everyone has a say and managers listen ,place
47,48,5,"Name Recognition Big Footprint The work is sometimes interesting, challenging, and engaging. Lower level staff is intelligent, generous, and kind.",5,"Name Recognition Big Footprint The work is sometimes interesting, challenging, and engaging. Lower level staff is intelligent, generous, and kind.",name recognition big footprint the work is sometimes interesting challenging and engaging lower level staff is intelligent generous and kind ,work
48,49,5,"The people are extremely smart, dedicated, curious, and humble and relaxed. That is changing with MSCI merger, but that legacy won't die too easily. You are given the opportunity to run with your ideas. Th culture is flat, and fun and relaxed, even thought it's Wall St.",2,"The people are extremely smart, dedicated, curious, and humble and relaxed. That is changing with MSCI merger, but that legacy won't die too easily. You are given the opportunity to run with your ideas. Th culture is flat, and fun and relaxed, even thought it's Wall St.",the people are extremely smart dedicated curious and humble and relaxed that is changing with msci merger but that legacy won t die too easily you are given the opportunity to run with your ideas th culture is flat and fun and relaxed even thought it s wall st ,"culture, people"
49,50,5,RiskMetrics has a very diverse group of employees from different cultural and professional background which makes for interesting conversations and interactions.,2,RiskMetrics has a very diverse group of employees from different cultural and professional background which makes for interesting conversations and interactions.,riskmetrics has a very diverse group of employees from different cultural and professional background which makes for interesting conversations and interactions ,
