"","x"
"1","Management is weak and very fickle minded, decision making is not strategic"
"2","good environment and growth opportunity"
"3","Not much to say here"
"4","I've only been here for a year and some months but have seen the culture deteriorate significantly in this time. This is due to cost cutting due to ""poor"" results (double digit growth, but missed target...) They sold/rented out a floor and moved people around, fired some, no budget for anything at all. Senior employees with company stock probably don't care, but junior people are leaving in droves. But this seems to... be a part of the plan. The company seldom fires, it just pushes people out. Which leads me to the main issue, this organisation is the direct opposite of a meritocracy. There's tons of politics and they would rather promote someone attending Diversity & Inclusion events (or fitting a minority) than people actually performing well. This is a good place to land after you're too tired to work hard and just want to take it easy with pretty smart people with a nice salary and you're willing to accept nonsense politics."
"5","A 3rd class company dont deserve even a single star.. Please be careful before joining double check your JD with them... They are biggest liars ..they will brief you a different JD and once you join they will trap you some 3 rd  class work... There are some person in US who will take your interveiw and tell you the false JD.. And wait for your last day that you confirmed.. Once your last day at previous organisation... oassed they will call you for change in your JD... There HR are really sucks... No orientation nothing.. Very unprofessional and 3rd class organisation... Sooo much negitivity in the work place i cant tell you... Really a very bad experience i had and my collegue who has joined recently along with me... They will pay you above your level and then you will trap... Soo guys be careful with such kind of 3rd class organisation and don't ruin your career..."
"6","Poor management, HR disfuntional, lack of career oath"
"7","Salary, Learning, Growth, Management, Opportunities"
"8","The business will succeed with or without you."
"9","no advice as such"
"10","Muchos servicios en Estados Unidos"
"11","Pay is lower than most financial service firms"
"12","No onsite opportunity , no HR policy in place , can be fired anytime"
"13","Politics, global teams micro management"
"14","Salary, mediocrity at times and cost cutting"
"15","If you want to make a change....you CANT."
"16","The management people don't care about you at all, and promotion is a black box. Hard-working won't get you promoted"
"17","Uninspiring managers who dont really care about employees. You do not develop any hard skills"
"18","Promotion progression difficult as Senior staff tend not to leave"
"19","Pay compensation and advancement opportunity"
"20","Poor management, no career advancement for junior analysts, no work-life balance, full of politics"
"21","The salary could be better, but its comparable to other companies."
"22","Going under some transformation from past several years off course for efficiency improvement and technology implementation. These may cause some flutter for some departments"
"23","Sales quotas were always rising making it difficult to be successful consistently"
"24","It can get stressful when conflicts of interest arise between different departments but nothing out of the ordinary"
"25","Limited upwards growth for Associate Analyst if working in a regional office like Toronto. Better career prospects if Associate analysts move to New York."
"26","The consistency of the work load is not the greatest so at times it can be very slow and unmotivating."
"27","Salary not great
Progress very limited"
"28","Most hostile work environment ever experience (and note that I was a trader in an hedge fund prior). Management completely nonexistent, only present when needed to complain on performance. Embarrassing salary, no bonuses. No career opportunities due to shortage of employees in the bottom of the chain, so Moody's will keep you there until you quit. Work life balance nonexistent if you actually want to perform all... your daily tasks. Nonexistent opportunities of growth. Offshore team in India is more relevant that employees in London, and possibly will be replaced once the India team is properly instructed. No room for mistakes. Constant state of fear of making mistakes which will not be overseen."
"29","Bad systems, worklife integration, human resource challenges"
"30","Deficient internal communication. Failed attempts at transformation suggest lack of adequate commitment to change and waste of resources. Drain of institutional knowledge with multiple recent retirements."
"31","low pay, low growth, bad management"
"32","Low growth, repetitive work, internal politics"
"33","zu wenig Geld, 50-60 Stunden Woche ist Minimum, junge Mitarbeiter werden ausgenutzt für stupide Arbeit welcher auch bis zu 35k im Jahr nur bezahlt wird, Betriebsrat wird permanent versucht zu sabotieren , wohl gesteuert aus den USA über MArionetten aus UK und Deutschland, System stürzen immer wieder ab, da alles veraltet ist, Mitarbeiter Zusammenhalt würde ich einfach als Haifischbecken bezeichnen, man wird zu... Veranstaltungen gezwungen für das sogenannte dritte Geschlecht und andere und sollte man sich weigern spiegelt sich das im Bonus aus. Sobald die Unternehmensziele nicht erreicht werden auch wenn mehr Gewinn als vorher erzielt wurden , wurden 100 Mitarbeiter weltweit fristlos entlassen.... ACHTUNG vor der Personalabteilung die direkten Kontakt mit der Geschäftsführung eng pflegt, alles was ihr berichtet wird gelangt direkt an deinem Vorgesetzten und selbst wenn du dich über diesen beschwerst..... im Jahr 2018 gab es ein Skandal von grobem Rassismus , welches meiner Meinung nach versucht wurde zu vertuschen bis der Betriebsrat sich hier eingemischt hatte und dafür sorgte das dieser Kollege das Unternehmen verlassen musste...."
"34","they need to more pay"
"35","Poor management, lack of processes"
"36","Maybe that there is no parking for now."
"37","Contrato corto y sin expectativas"
"38","Puts analytics over process which can create back office challenges"
"39","* Work often gets bogged down in process"
"40","Slow career progression and technology is not so great"
"41","Decidedly less upside potential than I-banking.
Conflicts of interest."
"42","high work pressure and ling working hours"
"43","Procesos muy burocráticos dentro de la compañía. Existen posibilidades de crecimiento pero las promotions son lentas. No brindan muchos beneficios"
"44","Not much really if you have great bosses like I did"
"45","Could have more benefits for its employees"
"46","Management is sometimes not interested in the career development of associates.

Managers do not account with enough knowledge or experience, and this undermines the trust of associates in the company’s objectives.

Favoritism is observed on a daily basis. 

Lack of vision or plan career for matured associates. 

Any deviation (with a rationale behind) from the methodologies is prohibited."
"47","Too far away from heart of business for advancement if you’re not in NYC but company is supportive of relocation"
"48","Some management level staff are riding the wave until retirement and not bringing any value to the company. Let them go!"
"49","Lack of career coaching and guidance."
"50","- Some teams and managers are better than others when it comes to promoting from within, almost to an absurd degree.
- Compensation might be on the low end for financial services but I think the company makes up for that in other ways. The make it really hard to want to leave."
"51","Crescimento na carreira é um pouco lento, o plano de carreira é bem enxuto então os funcionários acabam trabalhando mais de anos na mesma função/cargo. A carga de trabalho é bastante intensa."
"52","Corporate politics become inevitable as you climb the corporate ladder.
Too many meetings/odd hour calls."
"53","Frequent travelling, increasing regulatory and compliance hurdles."
"54","Lots of external hiring and lack of internal promotions."
"55","Multinacional com alta burocracia. Muitos sistemas que engessam o processo criativo, porém asseguram a qualidade e padronização de projetos."
"56","Limited progression on promotion or into lead analyst"
"57","Limited visibility to senior management"
"58","Enormous level of compliance and low value added activities. Performance judged on adherence to processes and not creativity or solid work"
"59","- Compensation could be improved
- Talent retention policy weak"
"60","Communication from management is poor 
Slow decisions 
Not much career progression"
"61","Not enough women in leadership roles or in middle management.  Bureaucratic, old systems, and “a dinosaur” as the other reviews say. Some people have been here very long time so the culture is stuck. Communication is poor within and across departments. This impacts US but also when trying to work with global workforce and offshore teams.  Managers can be unnecessarily tough on staff (as others commented). There is... more than average amount of petty complaining and office politics."
"62","Building is small
Senior Management not good
New team not stream lined
Adopted copal amba culture
Salary hike is not good"
"63","They separated moody's rating team into rating research and rating support. And rating support think of themselves as separate entity and want to keep junior analysts there as long as possible after they are trained- while the ideal path for those analysts are to move into rating teams. Those analysts need to ""look for new jobs"" instead of being promoted into rating team. Lots of talents left because this system is... ridiculous."
"64","Work is so so...."
"65","Not much to learn, No clear career path"
"66","Desire of wishful role could be a dilemma."
"67","Upward movement is extremely limited, promotions are not earned and given they are applied for. Communication from superiors is very fragmented and it seems the position is either getting left behind or replaced. You will pigeon-hole yourself if you take a role as an FDA. Skills are not very transferable and management is not very motivating. Superiors do not have the highest level of educational background either.... Moody's is the little brother of the financial services industry that banks are forced to play with due to the government. 401k Matching program is weak as is the Stock Purchase plan...does not compete with other similar firms."
"68","Management can be ruthless and overwork staff. Very stringent structure"
"69","Management, the promote poor people in to management positions"
"70","- Bureaucratic
- Toxic and blaming culture
- Lip service is paid to mentoring between senior and junior colleagues but never practiced
- Unsociable environment. Social interaction outside the office doesn't exist
- Extremely slow career progression (if any) in the absence of a sponsor
- Salary progression is very close to zero, even after a promotion
- Employee management inexistent, so best employees with... good opportunities elsehwere will just walk away as soon as they can
- Exit opportunities are very limited. Having ""Moody's"" written on one's CV is not always looked at favourably by recruiters at other financial institutions 
- Link between newly-hired employees and their job title is absolutely random. I've seen people with very different work experience (say, 2yrs vs. 7yrs) being hired with the same job title and seniority
- The poor management skills of low and middle-level managers are a scandal in broad daylight
- Ridiculously high number of completely useless petty projects created by low/middle managers with the only goal to gain visibility to the eyes of senior managers
- High turnover (not a surprise given the above points)
- Endless number of endless weekly meetings serving very little purpose
- Inclusive culture is very good but is translating into ignoring the professional preparation of newly-hired employees"
"71","Good work atmosphere here in the company"
"72","No professional development, and management are very interested in tick box exercises"
"73","no cons as of now"
"74","There is too much politics in the organisation. Manager centric company. Long working hours"
"75","office politics, bureaucracy, out of date technology, excessive compliance rules that's detrimental in just being able to be productive"
"76","Decision making can be slow at times"
"77","Depends on which group you work in... Shared Services area is managed by senior management  only interested in empire building... if you are working in Transformation project area, forget about work-life balance... project mismanagement will ensure you work like a dog... if you work in Operations area, you will not have enough resources to deliver quality product or service..."
"78","No program or product strategy on any key transformation projects. Senior managers only like yes men. The work environment is very toxic"
"79","Changing corporate culture as company grows."
"80","Toxic environment, blame culture, poor leadership. Everyone has to opine on things, even when they know nothing about it, and in the end, everyone does whatever the Legal Department says."
"81","Days can get pretty boring (depending on who/what team one is supporting), not a lot of career mobility. There are a few admins here who have gone on to other roles within the company, but for the most part this is the perfect job for those who just want a stable job that pays for their lives outside the office - family, vacation, hobbies, etc. Not the place to make tons of money and work your way up the ladder."
"82","Middle-office does not work with the front-office at all
Tasks are repetitive and no new projects
External training not provided to the middle-office"
"83","You’re just a number not a person"
"84","Bad Work culture,  Stressful company policies , Excessive workload and High Attrition"
"85","O meu cargo envolvia muita pressão por parte dos meus superiores, pelo fato de as atividades apresentarem urgência para serem concluídas. Há pouco espaço para erros."
"86","Management is not cooperative for your career growth"
"87","A lot of meetings because we want everyone to have a say."
"88","some politics to manage at headquarters"
"89","Like most large places, very political to move up. The company used to have the people you actually work with have more say in your advancement, but recently, the company introduced middle managers who don't see/understand your work as much, but have a large say in your advancement, so sucking up matters way more than performance.
Also, due to poor management of handling regulatory compliance, there are teams of... people who exist to try and catch you not checking the right box so you can get your bonus taken away. It never happened to me, but it did to people I know and living in fear of the compliance cops isn't fun. Also, lots of lifers work here, so get used to unintentional caps lock and constant whining about how they don't understand the electric typing box."
"90","Low salaries and very low bonuses, especially for most junior staff. Work is very similar to investment banking junior roles, but for less pay. Poor career progression. Some people don't make it to VP after 10 years and retire before they become MDs.

Extreme forced diversity campaigns - you will be forced to attend 2 diversity events a year and you will be spammed with forced diversity e-mails without the option... to unsubscribe.

MDs couldn't care less about junior staff and more focus on how to be friends with other MDs.

Juniors are not respected and are under constant threat of replacement with India offshoring or/and job automation."
"91","No work life balance , but I realize that depends on the department you work in. Being in a shared service environment you would think we wouldn’t work long hours and unnecessary hours at that."
"92","The work is transaction driven, so often requires working long hours. It can also become slightly repetitive after a few years."
"93","Learning opportunities are strictly limited"
"94","Upward mobility takes extensive time"
"95","HR transformation 2014 was a disaster, high turnover and poor, non-transparent leaders who did not understand the value of retaining HR talent. Politics at play, nobody was told why people were being “let go”, toxic individuals — extremely bad environment that made good people leave. I’ve heard things didn’t exactly get better after."
"96","-Slow promotions 
-Political upper management"
"97","- Processes need imorovement 
- No flexible worktime arragements"
"98","Poor work life balance, organizationally in Flux, many male immigrant employees who do not respect women in the workplace."
"99","As any data analytics company, jobs are good candidates for automation, hence future job growth is probably limited."
"100","Working hours depend on your team and boss"
"101","Work tends to stretch which in turn leads to long working hours. Seems to lack transparency in the current set up"
"102","If you stay in your position for longer than a few years without a promotion, your chances of promotion or being interviewed for other positions within the company are non existent 
New RRS team setup brings in more management and less transparency
Technology is more of a hindrance than a help in day to day work life"
"103","A bit political
Low salary
Low bonuses"
"104","Pay. Wide skill range in coworkers at the associate analyst level- a lot of dead weight."
"105","Trend of deterioration in people quality, very hierarchical structures, little investments in technology."
"106","lack of learning technical skills"
"107","na"
"108","Do better"
"109","Difficult to get promoted from associate to senior analyst level"
"110","Successful businesses leads to slow decision making out of fear of hurting current business."
"111","Remuneration and benefits are not great (though not terrible either)
Office and facilities are a bit shabby and cramped
Slow progression
Tough regulatory environment"
"112","While I like what Ray and the board are doing, some members in higher positions, i am not a fan of and question how they got there (or why they are still there).  A con for me but if you are friends with the right person or liked by the right person, you will have a much easier time moving up or going anywhere in the company. On the flip side, if you are not friends with the right person, it can be an arduous... journey. While not necessarily in silos, it seems like every team has a different set of rules on how they can or cannot move up the corporate ladder.

While most of the people here are very talented, sometimes, it can be a real struggle to get anything accomplished. Meetings for days. What do you think about (fill in the blank)?, lets have a 30 minute meeting to discuss."
"113","Slow career development, not much too learn, if in GMO team."
"114","The number of sharks are increasing"
"115","- Limited parking space
- Notice period prior to leaving the company is too long"
"116","Some people take the compliance and regulatory issues too seriously 
Depending on your security clearance you will have to sell all of your industry specific stocks
As with any job that is market based, can be overwhelming at times and underwhelming at other times"
"117","There is no room for internal mobility nor professional development. Compensation is on the lower end. High turnover rate."
"118","Horrible IT, albeit improving
Regulatory burden"
"119","give your employees more autonomy - stop micro managing."
"120","Upgrade systems to improve efficiency and reduce errors. Improve HR and health plan (HR stops insurance coverage when employees take unpaid leaves to take care of sick dependents)"
"121","Not much room for growth or advancement"
"122","Promotions are tough to come by"
"123","Depends on teams. It varies greatly team to team and I am fortunate to be working in a great one"
"124","Poucas oportunidades de efetivação, ambiente pode ser estressante dependendo da área, pouca meritocracia em muitos casos."
"125","It takes a very long time to go up the ladder.  People seem to get promoted based on personal preferences of mangers."
"126","Below average employee benefits scheme (e.g. pension)"
"127","Management is worst and HR too"
"128","Technologically behind most.  High margins means failure is often rewarded, or at the very least with little consequence."
"129","Where to begin...lack of growth and development. Lack of meaningful opportunities. Diversity exists on paper, but not in management or day to day work. Miserable place for women, who get layered under lazy and unproductive male managers, who in turn take credit for work performed by others. A technological dinosaur, which pours money into ""innovation"" that never materializes. And so on..."
"130","The business model is strange. It’s a conflict of ethics. You are paid by those you rate. Yet for some reason the market accepts your ratings. I can’t explain it.

They pay lip service to ethics but believe me they know on which side their bread is buttered. You simply cannot expect a billion dollar company with 20% profit margins to be angelic. If you do, I have a bridge just right for you.

If it’s not working... out they will drop you like a hot potato and literally throw you out of the door. What happened to loyalty?

Pay is small relative to Wall Street."
"131","No learning process
No incentives
inefficient managers with no stand of their own"
"132","Zero work life balance for employee"
"133","Senior IT management sets a negative example by being very political. Senior level MDs are quick to through juniors under the bus. No sense of ownership of the bad, only the good."
"134","Low salary and not a lot of opportunities for advancement"
"135","There is nothing “Technical” about this role. Its basic 1st line/hardware support/customer service. Nothing much to learn, lots of monitor deployments to waste your time with. The systems engineering team have no presence outside of NY and don’t provide anything helpful anyway in terms of technology or tools. 

Several third party vendors that carry out tasks at a very granular level so difficult to find the right... person. Support from most of those vendors is terrible, they simply don’t care. They have finally decided to streamline and bring in one to take over at least three of those companies so maybe things will improve. 

People will ignore your emails, including senior management. You have to CC in someone important if you need support from people or for them to simply do their actual job.

I suggested many improvements but kept getting  knock-backs. Senior people came up with excuses probably because they were protecting their highly paid positions. 

The only projects you are asked to get involved with are the ones that nobody else wants to do. You’re not asked what you’d like to do. Many broken processes which can create chaos for users.  

In term of progression it is non-existent unless you are already in a senior role or if you are very young and seen to have potential. You can’t be in your thirties and have potential or existing talent. 

Also how about some regular department drinks once in a while rather then only if a senior person from the US comes over with their credit card. Not much team bonding."
"136","Career growth  which is very less"
"137","- bad salary progression and even worse bonus. The entry level salary for an associate analyst is decent in London but the bonus is very low (I'm talking 1.8k after taxes kind of bonus). Salary progression is really bad. It doesn't really get better unless you get promoted
- career progression is terrible. They have tried to change this by introducing a different organisational structure in 2017, but nothing really... has changed. Going from AA3 to Analyst takes on average 5 years. Way too long considering you pretty much do the exact same type of work as an Analyst!
- Boring work. This is subjective of course but I don't think that anyone finds putting numbers into Scorecards to get a rating to be exciting. Basically, a lot of the people here pretend that they do real finance work (and sometimes also stay until midnight to prove they are like bankers) but at the end of the day the product is mostly putting financial metrics into a Scorecards and then write a report about the outcome."
"138","Salary compensation, hierarchy, L3 Certification"
"139","Bureaucratic and subject to Dodd-Frank rules"
"140","Hours can be long 
Low bonus and benefits
Niche industry and skills
IT system could be better
More transparent promotion process"
"141","Under utilised, lots of restructuring, changes to management"
"142","Salary and bonus is not as good as the market. Slow for promotions. Technology is not great but improving. Lots of administrative work"
"143","High turnover sometimes can be difficult to manage portfolios reallocations"
"144","No / limited parking facility
Small operation in Gurgaon"
"145","Promotions can be too slow.  Raises hard to come by."
"146","- low salary
- poor IT infrastructure"
"147","Compensation, but it is being currently being reviewed by management"
