"","x"
"148","To help people with career progression, not just at the junior levels but at senior levels. I would have liked to stay the company, doing something slightly different in an another department. Stopping people moving internally does not make sense. I left the company. The small team I was in had to hire someone new anyway."
"149","not that many i can think of"
"150","there is no con at this time"
"151","Some spaces are a little archaic but the are making a lot of investments to transform."
"152","The salaries are not great and there is not much mobility. Should promote more people, more often. Many low value activities in all levels."
"153","Benefits and bonuses could be better.  Can be a sweat shop during peak times but you won't necessarily be rewarded for it with a pat on the back or financially."
"154","Limited growth opportunities for anyone looking to enter front end in finance"
"155","Work profile is monotonous"
"156","Pay is not great, career opportunities are very hard to come by, management is always looking to cut corners and outsource."
"157","Slow career progression
Compensation and benefits could be better"
"158","many demands on analyst, systems not up to snuff"
"159","Old technology, outdated management and systems"
"160","Poor Infrastructure and facilities
Lacks Transparency 
Unfriendly Employee policies"
"161","long hours, pressure and animosity"
"162","sometimes on call after hours
some travel required"
"163","Work life balance could be better"
"164","No problems. Didn't have a negative experience"
"165","Too many consultants
Some managers are not effective.
Depending on dept/project, hours may be very long."
"166","A little rigid and not as empowering to employees and flexible as it could be."
"167","slow in progress of adoption due to high regulations."
"168","Will take 5 times as long to progress and pay is terrible relative to length of service.  They like to hire senior level candidates and place them at graduate level ranks.   Consequently there is lots of turnover.   Most people who still are here are so because they have yet to find an escape."
"169","Very clicky culture where a few ""chosen ones"" will invariably move up
Incredibly unfriendly for newcomers, no guidance, you're on your on
Never had a set of goals, so you will never achieve such goals
Bonuses are a joke."
"170","Not challenging work across the projects"
"171","Moody's has to do a better job of developing and retaining junior talent. Too often, junior talent is leaving for better positions, including managerial ones, at banks and other peer firms. Moody's also needs to improve on total compensation for junior/mid-level talent."
"172","Too consensus driven an organization."
"173","While management and lead analysts always helped me and supported me, associate analysts are treated as disposable workforce and pressed hard, with long hours and few promotions. Always keep an eye on the job market to put yourself in a stronger position regarding promotions, and do not hesitate to pressure management through ultimatums for promotions."
"174","Promotions are biased.  When promotion criteria wasn't meet,  promotions were are still granted.  While other staff having meet the promotion criteria are left behind.   

Very confusing and frustrating to get the outstanding staff in front at the right time."
"175","Salary is not the best."
"176","lack of career advancement opportunities, have to deal with office politics"
"177","Little room for fast growth overall"
"178","Can get very stressful at times. Very bureaucratic structure with lots of regulation"
"179","A bit sleepy, bureaucratic and stuffy. It takes a while to get established and navigate the hierarchy. Not very agile and stuck in its ways"
"180","Moody's investor services canteen which is called Foody's investor services is not the best but is better than some other food places around the area."
"181","There is not so much career development opportunities."
"182","Junior level promotions are slow"
"183","When mid-level managers are brought in to run the PMO (even though they have never run a project) and start hiring consultants and former associates from Deutsche Bank (where they came from) and paying them crazy money, it leaves a very sour taste in everyone's mouth.  Especially when PMO lead gets his former associates to write and rate his performance.  Makes you wonder....do you really want to work in the PMO... office......??  Cloud strategy is off the rails, going in the absolute wrong direction as new SVP's who work remotely tend to regurgitate others presentations."
"184","Long working hours, poor benefits"
"185","+slow career growth trajectory
+low salary relative to roles that require the same skill set"
"186","difficult to promote as there a lot of seniors"
"187","Salaries average to industry standards"
"188","Very bureaucratic; promotions often unrelated to performance; politically charged workplace; NY/HQ-centric; poor/incompetent micromanagement; depending on the group/manager you work for, poor work-life balance / workplace atmosphere."
"189","Very hierarchical
Small raises
Uses old technology"
"190","Very ""corporate"" atmosphere. Compensation is lower than what you would be paid elsewhere on wall street, but I think it is worth it because the culture and work/life balance is much better."
"191","Slow to promote, typically raises are limited to cost of living, bonuses aren't ordinarily paid out at 100% at the associate analyst level"
"192","lots of process and compartmentalization which can slow down progress"
"193","Is a very global company, your personal achievements are usually diluted in global basis, hence promotions and growth always depend on the support from your direct manager instead your results."
"194","Increase mobility for employees. Overall I am very satisfied with the company and would like the management to keep up the good work."
"195","Low efficiency in getting access."
"196","Selfish Management"
"197","No advice as such"
"198","All cons which comes in a new setup. Nothing much which u can't ignore."
"199","Legacy issues
Some teams lack diversity"
"200","lackluster salaries and dysfunctional systems"
"201","Mid range pay. If you are not a minority or women forget promotion"
"202","Negative culture; poor senior management"
"203","Work at times can be tedious and repetitive."
"204","Most examples of senior advancement and large scale initiatives are driven almost entirely by politics"
"205","Promotions only happen if you are well-known by a senior leader or if your manager likes you."
"206","Working hours can get extended sometimes"
"207","No cons if you are ready to learn and grow"
"208","hard to move up the hierachy"
"209","no cons so far into my career to note. I couldn't think of a better place to be in the early stages of my career..."
"210","More diversification needed"
"211","It is very difficult to get work done, particularly in EMEA, away from the major decision makers. The same issues that existed when I started 5 years ago still existed on the day that I left, despite them being discussed on a regular basis. 

Flexible working is limited to working from home or very rarely given. Moody's is a very cautious company, and this extends to flexible working, there is a lack of... imagination to see how flexible working can work better."
"212","Poorly managed. Lack of recognition and reward. Lack of upward mobility."
"213","Career progression takes forever thus turnover rate at the junior levels very high, organization structure very complicated thus one often has numerous types of tasks to do beyond job scope, too many people in positions that should have long been removed to make way for current and necessary positions or to use the money/benefits towards retaining relevant talent."
"214","Slow career advancement and salary growth"
"215","Weak management impervious to what employees think."
"216","- Company is too large, hard to coordinate as different regions and timing"
"217","Not enough budget for staff and activities"
"218","To do staff which to add money into th wallet company where you work."
"219","Going public has created unwanted pressure"
"220","Open-door policy: close to non-existent (maybe it's just in my case)"
"221","No worklife balance, monotonous work at times, Low pay"
"222","The HR leadership team in New York are a disaster. Having embarked on an HR transformation, they are now unwinding it due to poor execution.

Complete lack of transparency around how decisions are made, and incompetent people in NY are consistently promoted in to senior positions because they are part of the 'clique'."
"223","Extremly poor work environment with long working hours. ( AC is switched off at specified time even if lot of people are working, this remains switched off even on weekends when unfortunate employees come to work). Depending on the project employees are expected to work for 15 16 hours every day.
Top heavy company with useless managers with no skillset handling a team of only 4 -5 people.
Erradic appraisal system,... ur growth is not dependent on performance but managers whimps.
Management is only concerned with the profitability of project, they are least bothered about the employee."
"224","there, are no ,cons,at Moodys"
"225","Lack of Goals
Lack of Orientation
Lack of Direction (You will be lost in your position) 
Dedicate 99% of your time to flow in slow-motion"
"226","Management forces unnecessary and unhelpful changes
Comp is the number one reason people leave; if comp were better turnover would shrink immediately"
"227","No development opportunities. People get promoted based on how long they are at the company, not how good they perform."
"228","Only way to succeed is to suck up and get in with the right people"
"229","Limited opportunities to grow or be promoted"
"230","-Pay is terrible
-This job is extremely boring"
"231","Too much bureaucracy. Poor management. Poor vision. Poor strategy. Too responsive and reactive. Not forward thinking. Really is only saved by being in a protected industry that has low barriers to entry by competition"
"232","Not the best pay
Not too much innovation in areas
People get do the minimum to get by in a lot of areas"
"233","Some departments with a lot of junior positions have a lot of turnover. Once someone gets experience and there's no room for growth, they'll leave for another opportunity. I've seen it happen time and again."
"234","Flat structure with no opportunity for analysts to join management ranks.  Shallow management skills in some LOBs like securitization."
"235","Not easy for junior employees to advance careers. So it's common that some newly grads join the firm for a year or two and then leave to pursue other opportunities."
"236","increase the package"
"237","Compensation not competitive.  Little growth. Impregnable glass ceiling for women."
"238","Intellectual lazyness  and negative spirit of most of the senior managers and senior analysts"
"239","bonus is kind of low"
"240","Gotten more political over the years, the culture is changing"
"241","Are terrible at managing employees, stuff work onto you regardless of your time. Work overtime almost everyday."
"242","Extremely poor development of leaders, horrible management of entrenched, impossible to work for managers.
Quietly reducing staff, treat those impacts like criminals. Package includes stipulation to never work for Moody's again."
"243","Poor Career advancement, 
Slightly below average salary"
"244","- career progression is painfully slow and random, with a ceiling after 1 or 2 promotions;
- salary is below industry average and does not correspond to the type and intensity of work - analysts there do more meaningful research than in investment banks, can work just as much (or close to it), but only get a fraction of the pay"
"245","Reliant on financial markets for good times."
"246","Contracts can be layed off"
"247","Lack of appreciation from upper management until people are out the door."
"248","Is an entry level position so you will need to spend at least 1.5 years or so to move to the line of business and the opportunities are really tight."
"249","Pay freezes/cuts seem to affect all teams regardless of their actual performance"
"250","Compensation is not competitive with other NYC financial industry firms; cautious, bureaucratic processes to implement any new projects or engagements;"
"251","Given the transactional nature of the work, the hours can be very tricky.  In addition, there isn't a clear delineation between titles as people with very different titles often do the same work making salary negotiations difficult."
"252","Salaries can be much more competitive."
"253","very traditional, slow innovators, very little career opportunities unless you work in New York office."
"254","far from business
lot of low value activities
slow career progression
low bonus"
"255","-Executive management only cares about two things - buying back as many shares as possible and keeping the regulators off their backs.  They don't care about extremely high turnover and poor morale that exists among the staff.
-Every year they find a new way to squeeze employees  such as no raises for senior analysts in 2016, reduced vacation carry over days (they all expire by April anyways), and the most recent... announcement of no holiday party for staff in 2016"
"256","Very Slow to innovate 
Very Hierarchical
Very dynamic people tend to leave after 2 years on average
Analysts don't have a lot of autonomy 
Bad calls are not sanctioned"
"257","You'll see plenty of people who've been at the firm 15 years+, on some very handsome packages that one cannot achieve anymore those days. Such people have little incentive to move elsewhere. Adding to that the fact that the growth of the company has come to standstill (once you rate the whole world, there isn't much foreseeable growth). Without growth, and turnover at middle and higher management levels, the juniors... have no chance but to leave if they are seeking career progression. Junior level turnover is already high."
"258","The management needs to pay more attention to new technologies."
"259","Company is going throug ha transformation. Many people dislike it and mood among AAs is down. Everybody cares what they get out of it without seeing the big picture who gets affected the most and how."
"260","Incentive structure needs to be better"
"261","- For satellite offices, there is somewhat of a ceiling on upward mobility to more senior positions and even lateral moves to other teams. If you really want to move up in the ranks in the company, you'd be better off moving to New York. 
-Promotion track is pretty inconsistent and depends a lot on timing. 
-Data systems are pretty antiquated and difficult to leverage for research. 
-Lately, the company has not... been meeting its revenue targets and this is definitely being felt in terms of salary, promotions and perks which is affecting morale and retention. Even little things like the annual holiday party in NYC have been axed as well as the holiday lunch events for the smaller regional offices, and this is all occurring in a year where we have a billion dollar stock buyback."
"262","No growth platforms as you will not know what will be your next level."
"263","Unmeritocratic or heavy political environment for promotions especially as you climb to the top; harder to move to other jobs if you stay too long so best to only spend a few years and move on to sell side or buyside for better career prospects; bonus structure is bad but fixed salary is decent"
"264","RH inexistente, baixa remuneração, não pensam em reter funcionários. Pessoas desmotivadas. Pessoal sênior sem habilidades de management. Altamente burocrático/"
"265","-Lots of red tape
-Bureaucracy slows down processes
-Inconsistent promotion system and pay across the firm"
"266","-Relatively low pay comparing to the industry"
"267","lacks of growth for people who want to move up, salary is on the lower end for financial services"
"268","Needs more innovation, Strategic Thinking"
"269","Weak management structure, unreasonable job expectations as most colleagues are available 24/7, lack of career path for those in regional offices"
"270","Work ebs and flows with the market. Some weeks are inundated with new sales, others are slow. The slow weeks allow you to focus more on research. Pros outweigh the cons."
"271","Little more sales aggression needed"
"272","Mercurial management - HR in EMEA is terrible. Misaligned, conflicts, back-biting, no leadership. Rudderless, and going nowhere fast. Overall HR leadership from the US isn't much better - recent HR transformation efforts were so terribly implemented and communicated."
"273","The degree of skill enhancing responsibilities for junior analysts vary greatly depending on department. Mobility across departments not difficult but not necessarily encouraged either."
"274","Managers lack leadership and only care about their own career progression."
"275","Slow decision making. No clear career pathing and limited opportunities for junior analysts; Well below average pay as compared to other Wall St. firms (but hey, they don't trade or bank...); current focus on cost cutting had led to longer hours, high turnover in particular for junior employees."
"276","Senior management lacks objectivity and tends toward herd-mentality"
"277","good project management"
"278","too much deliberation, does not always lead to the most effective decisions"
"279","Lower compensation and promotions could be arbitrary"
"280","none really, love my job and the workplace"
"281","upper management is terrible at relaying information to teams and has no clue what individuals do. they expect everything to be done with little to no care of employee morale."
"282","- advancement is 90% driven by politics or changing circumstances
- no room for non-conformity
- a lot of analysis and paralysis 
- overbearing rules & regulations"
"283","Management is near clueless and scrambled around way more than they should have"
"284","Middle-management has a love of poorly developed/shortsighted solutions.  Lots of overcomplicating processes, many of which result in ""hurry up and wait"" situations (but there is still a dearth of necessary processes...).  Little penalization for not meeting deadlines many arbitrarily set deadlines but no reward for meeting such deadlines.  As a result, progress is highly superficial.  Middle-management likes to... make it look as though there has been change when little no none has actually taken place.
It feels as though this job is a means to an end for most management... some padding of the resume so that they can move on to the next company."
"285","Even as little as 5 years ago there were better leaders but all pushed out by other managers who were threatened
Constantly hiring people who bring no value 
Never cutting loose of people who bring no value which causes more work and long hours for some
No value added people typically get promoted since managers have favorites 
Budgets have been tightened with smaller bonuses Moving employees into picnic style... tables in a building where no one wants to go
Evaluation forms are changed by managers 
Don't tell management the truth about what they don't want to hear or you will be pushed out"
"286","under a lot of pressure during work"
"287","low salary compared to banks, slow career progression"
"288","conservative ways and slow motion for innovation"
"289","staid, slow moving and political. Senior connections were important. Junior staff had trouble with dealing with senior staff at times."
"290","Low pay, pay rises are minuscule, awful maternity pay which is not in line with other employers. They have a huge focus on offshoring roles & it just doesn't seem to be working. Hardly any study leave"
"291","Management is not transparent and the company departments are very political.  Managers are not sufficiently trained to supervise or manage a team."
"292","A lot of fire drills.  Meet the fate mentality over quality at times."
"293","Salaries in certain departments does not match the amount of work you do; some teams understaffed leaving a few to do the work of many"
"294","Your 9-5, are often times not a 9-5.
Stress is a word heard too often.
Can't think of any other cons wotlrth mentioning."
"295","The Bad: Then there is the HR Department. In a company that employees are genuinely proud to be a part of, the morale in this group is abysmal. These are the people who run the employee engagement survey and spend a lot of manpower to find ways to retain the best talent, while their own employees leave in droves for better jobs. There have been several occasions when employees have left without another job waiting... for them.

 The Ugly:  the Leadership & Organizational Development group, since there is no leadership or organization at the top of the department. In the past few years there has been a nearly 100% turnover. That is unacceptable.

I single out L&OD because the senior leaders, who are the key drivers of the Employee Value Proposition, seem to live by the mantra, ""Our views matter. Yours do when they mirror ours."" The senior leadership is rewarded for implementing early 21st Century ideas to enhance L&OD, meanwhile sucking up valuable resources by taking leadership training instead of providing that training to someone who could actually benefit from it. Incompetence and lack of communication skills are rewarded, hence the turnover.

Overall, Moody's is a great place to work as long as you are not an HR Professional."
"296","Long working hours; Short projects"
"297","Long working hours
Culture of sycophancy
Copy paste work with little analysis
Employees micro managed by seniors"
"298","growth is slow, bureaucratic culture"
"299","-difficult for junior analysts to get promoted"
"300","Nothing much to say about cons at this time."
"301","Very few opportunities to get promoted"
"302","Depending on your role at Moody's, may not have as much exposure to all Lines of Business within the company."
"303","A lot of workload time to time and you will run out of things to learn after a couple of months"
"304","Being in this highly regulated industry does not allow one to be business opportunity minded, agility and innovation not considered pros"
"305","High pressure. Difficult to do work life balance. Too much reliance on outsourcing partners. They need to start hiring in-house talent."
"306","Too many changes in an effort to streamline, with little input from those doing the work."
"307","Not always possible tp keep acceptable work-life balance;
Perceived Excessive Regulatory Burden in the Rating Line of Business;"
"308","Pay is low for the industry - could be more transparency"
"309","Focus more on employees to retain talent rather than solely managing earnings to please shareholders"
"310","Non-commission sales, 401k matching is low and the work force maybe reaching retirement ages anytime soon."
"311","Reactive industry, the management is BAD; no focus on career development"
"312","Company thinks it's a growth company but becoming very European and government like"
"313","pay is not commensurate with value-add"
"314","Inherent conflict of interest in business model. Sloppy work, lack of integrity by some analysts. Backward looking analysis -- few working there have real-time market experience so ratings behind the curve."
"315","My advice to management would be that the company needs to invest more in its associate analyst pool and change the way in which it compensates. There needs to be more incentive for strong performance."
"316","Non commercial environment where rewards are by no means linked to performance or analytical contribution.
 The status quo (promoted by management) is the message to follow for progression. Associates are rewarded for agreeing with the consensus. After all, management's subjectively rewards without any performance measure being considered"
"317","Moody's is conservative. If you are looking for competitive pay this may or may not be the best place for you as other companies offer much more. However, when the economy is in a bad place Moody's might be the place for you!"
"318","as the technology guy, the technology  is not so important here, I mean, not the first priority, maybe moodys is a finance or rating company, not sure,"
"319","Integrate GMO in strategic planning"
"320","no negative experience, great company."
"321","Senior mgt has no faith in it's direct reports, constantly calls in ""consultants"" costing hundreds of thousands of dollars that over and over have missed crucial information in their recommendations.  The best way to describe Moody's IT is the following:  A mid sized IT shop, that takes actions as though it were a world class IT organization but then at the same time manages like a mom and pop grocery store."
"322","There really aren't any cons to speak of"
"323","Has become least employee oriented company in the last three years.
Cheats employees of its bonuses by giving naive excuses.
Top heavy management structure. Too many managers handling 4-5 member projects. Hence difficult to promote employees.
Management introduced internal certifications based on promotions are made. If you fail to clear these certifications, management will defer your promotion.
Managers are... interested in improving their own margins and hence don't mind stealing employee bonuses to make up their margins"
"324","Falta de recursos por ser uma empresa pequena aqui no Brasil e o escritória depende muito da sede em NYC."
