"","x"
"474","-being promised career development but never keep it
-no reward for hard work, instead internal politics are benchmark for promotions (not expertise or experience)
-expectation from Management to staff far above the actual job description and skills required
-no clear annual objectives to keep personal development and progression chances as unclear and in-transparent as possible/KPO's vaguely formulated
-no... internal system to record work activity resulting in no visibility of work-load or measurement/reporting of achievements  
-high micromanagement culture
-staff is not given any credibility and not trusted to do anything by themselves
-hierarchy structure made complex for MD to avoid direct conversations with anyone below staff with management/supervisor function
-no clear training given at the start of your career
-no incentives for overachieving expectations (as no objectives communicated!)"
"475","Nothing...every work adds something to your knowledge"
"476","accelerate the speed of training new generation."
"477","Promotions.  Compensation. Name value."
"478","None. All good about copal partners"
"479","Same recognition across associates who work hard and those that come in at 11am
Terrible technology
Sometimes can get bogged down with too many low value add work"
"480","Its is too busy most of the time. Leaving in time and leaves are a big issue. HR is week in terms of employee engagement."
"481","Die Bezahlung ist für die Branche ein bisschen niedrig. Sehr niedriger Bonus. Es wird wenig für die Motivation der Mitarbeiter getan."
"482","Bonuses are relatively small. Some regular tasks are more cumbersome due to increased regulation. Processes vary across departments and across groups, which creates inefficiencies and makes some tasks more difficult than they need to be. It seems that sometimes projects are created just for the sake of it, when time could be better spent on core business like ratings and research."
"483","Horrible IT infrastructure. Really poor reliance on external consultants"
"484","management needs to be improved"
"485","Pay is not great especially as working hours can be demanding and job has high responsibility"
"486","poor work-life balance and work culture, they go for a toss"
"487","the technology isn't that good"
"488","the pay is extremely low
for associate analysts your development depends greatly on your analyst
promotions are hard to come by, and you need to be working at the next level for some time before even being considered
lots of people just coast and it hurts morale (along with below market pay)
hard work does not mean more pay or promotion it merely puts you in the conversation
at the lower levels if you stay too... long, you will get stuck here
management is very unclear about promotion process (will mislead you to keep you chasing the carrot)
associate analysts get stuck doing a lot of legwork due to increased regulation
lots of senior people who collect big checks just coasting, noticed by younger hard workers
very little turnover at the senior levels
very poor technology"
"489","The technology is a little out of date and this can cause delays in getting things done, however they are starting to improve this now."
"490","Stop getting involved in influencing rating outcomes and rating assignments - your job is to manage people and create teams of individuals who can handle it (hiring in the banking department those who failed in structured finance after the crisis is NOT the way to go)."
"491","From working hours to politics everything is against you."
"492","no work life balance, long hours stretch"
"493","I feel like sometimes the left hand doesnt know what the right hand is doing in my department which can be frustrating.  Also,  there isnt alot of accountability.  Kind of a stale environment and a bit boring.  Also,  if you work for the wrong team,  you will hate your job.  Some teams at Moody's pull 80 hour weeks and expect you to work nights,  weekends and even holidays as the default (work life balance for these... people is non-existent) so be careful who you work for.   Dental is pretty bad.  I dont really like the WTC location either."
"494","Extremely long working hours. Unreasonable deadlines because each person is assigned jobs large enough to be done by two. Very miserly pay. Bad work environment. Depressing office. That probably explains the high attrition rate."
"495","- long! really long hours. its ok, if its once in a week or twice, but it can really screw your life if its continuously for months
-  one project after another, so basically you will not have that feeling when you are completing your work and relaxing with satifaction
- quality of work in a team very different depending on a different people, so even if you are doing outstanding job, its anyways valued in a same... way with work, which is really looks awkward and lousy."
"496","bad leave policy, bad transport department,long working hours"
"497","A very lackadaisical atmosphere and sometimes get overwhelmingly busy."
"498","political environment all around, need to watch your back."
"499","No advice"
"500","The work load can be a bit much sometimes. Some managers are not as smart as they think"
"501","Compensation could be better reflected on performance"
"502","Not so much room for promotion"
"503","Limited career opportunities, limited number of possible employers outside Rating Agencies after being in the company for too many years"
"504","High level of Bureaucracy accross the firm"
"505","You have to stay on your current position for many years before you have promotion."
"506","- The old boys club model seems to have survived at Moody's. 
- Provide a developmental career path for analysts to be promoted.
- Management at the group level do not keep analysts informed.
- Promote from within for the higher paying jobs."
"507","BORING! Bizarro World promotion policy. Poor pay. You'll probably go brain dead here. Given all the regulatory changes, agency employees' time has become mostly about administrative CYA rather than focused more on in depth analysis."
"508","Hard to balance work life"
"509","But that increased salary will take you to the loss........................ that depends on individuals thinking, those who work only for money welcome to copal and those who wants to improve skills then please don't come to copal.
No festivals off
only two saturdays off
long working hours daily aprrox 12 hours
kills personal/social life
take you away from your family 
The only friend on copal emplyees is... Alcohol 
only upper management is happy
for language people its really hell i don't know why they don't think about it"
"510","long working hours
working condition not good"
"511","- Long hours
- Horrible pay
- No recognition
- Everyone in team is treated like a replaceable product"
"512","Deceptive HR practices, poor review system"
"513","Unprofessional attitude of Top management who are only interested in improving bottom line, inadequate archaic infrastructure (dual core desktops with 1 GB ram still in use).. Management rules like an autocracy with little leeway or freedom given to employees. Workplace politics and favouritism make it a disgusting place to work"
"514","Very poor management, Lots of unprofessional people, Inappropriate compliance level"
"515","pays some of the lowest salaries in the market
too many layers making career growth very slow process
corporate visibility non-existent
excessive bureaucracy 
place is abound with mediocrity, hard to get by really smart people
pompous managers with poor soft and management skills
HR unprofessional and employment process takes too long"
"516","Some teams are glorified, paying better than other teams."
"517","Pay is mediocre for financial industry; career advancement is stalled."
"518","Very political atmosphere, a lot of nepotism and  face time expected from management"
"519","Within CFG, extremely consensus driven organization, no room for creativity or original thinking.  You get ahead via ""special projects"" without that, you'll need to work 2-3x as much or and your promotions will take 2-3x as long.  It doesn't matter if the companies you cover are high volume, busy companies, you won't get any points for staying on top of them without the ""special projects"""
"520","limited growth opportunities and continued professional training"
"521","Senior analysts have been around forever and aren't going anywhere, leading to stale thinking in some cases. Nearly impossible to be promoted from AA1 to Analyst, especially in FIG and CFG, where managers work you to death and keep changing goalposts. Stay away from FIG. Seriously."
"522","Somewhat low energy / enthusiasm environment
Bureaucracy
Questionable IT system
As an intern, possible to slip through the cracks and get forgotten"
"523","Keep it up!"
"524","Operating Environment:  The office layout (at least at Headquarters - 7 WTC in NYC) does not facilitate interaction.  People call each other on the phone in neighboring offices rather than meet with them face to face.  Does not feel like a collaborative, innovative youthful company so be aware of this is you are coming from management consulting or technology.  The internal technology (mobile devices, data systems,... workflow systems, personal computers, remote work technologies etc.) are all probably 10 years behind.  I was surprised when I started at how antiquated the technology was.  There does not appear to be a lot of appetite for updating technologies so the outlook going forward remains negative. 

Culture: Moody's seems to have a very conservative business culture.  Decisions can take a long time to get made and can result in ""analysis paralysis"".  The firm feels and looks older from the design of the office to the people filling them, not a great place for a recent entrant from a top tier program looking to develop. Very limited training and development offerings.  There do not seem to be a lot of team building events. 

Overall this experience has not met up to expectations compared to previous top 25 best places to work firms."
"525","Money, regulation, could become stuck"
"526","LOW LOW LOW LOW pay"
"527","Pathetic compensation
Long working hours
Very poor management support"
"528","Work Life balance
Rest All good"
"529","Very Bad work culture at work"
"530","Senior Management (too old in its way and doesnt understand the changing environment), Long working hours, no work-life balance, unsympathetic TLs, no learning after a few years"
"531","Work/life balance sometimes goes for a toss due to long working hours"
"532","Management always try to keep you more in office
They doesn't care about your work life balance
HR people never react to the employees problems
Higher authorities even count how many breaks you have taken in a day"
"533","Long Working Hours.
Cab facilities.
Repetitive work."
"534","The main downside of Moody's is its ongoing lack of sufficient internal investment, in particular the IT infrastructure, its cutting corners when in comes to giving people the right tools to do their job properly."
"535","Low starting level package, offer to freshers is way below market
Obviously, stretched office hours is a biggest bane of working in Copal"
"536","People form comfort zone here and make monetary benefits their shield of protection"
"537","Senior management is not up front"
"538","More room needed to grow"
"539","At times there are long working hours"
"540","Long working hours and high pressure"
"541","Time Consuming Time Consuming Time Consuming"
"542","No social life at all"
"543","no upward career progression at Moodys, middle management very average, no particular guidance from mid-senior mgmt, focus of senior management on everything but Credit"
"544","Limited upside in terms of promotion (no one leaves as people are comfortable). Therefore, management are dinosaurs and lack adaptive thinking and innovation. Tends to create a reactionary atmosphere. There is A LOT of fat to be cut i.e. many people coast, numerous positions that perform the same job functions, impact compensation. Compensation literally sucks (+40-50% margins are you kidding me? and that money is... spent on worthless acquisitions)."
"545","too much politics in executive management"
"546","Food, Cab Service, IT Services"
"547","The occasional bad apple is tolerated and sometimes spoils the whole bunch.  There are unethical people just as everywhere who only care about hearing their own voice, and advancing their own careers."
"548","No career growth. 
Internal politics
Rude
Higher management including HR are least bothered for your concerns
Poor pay rate
Harassment at work place"
"549","compensation
slow decision making
slow promotion process"
"550","Laid back, a little too comfortable at an early stage in one's career"
"551","Poor work life balance. No learning, and no knowledge enhancement. Extremely unfavourable leave policy towards employees. High level of politics and sucking up to the management"
"552","Highly hierarchical, managers are often hired from outside rather than promoted from within, strict pecking order means responsibilities are limited based on seniority rather than ability, weak company culture--groups are segmented and teams are highly independent."
"553","low pay, work long hours"
"554","1. Very long working hours
2. Work is of limited variety
3. Cabs are chargeable"
"555","Bad work life balance
Very bad work life balance
Extremel bad work life balance"
"556","your growth depends on how your relationship is with your seniors"
"557","Heavy regulation need to comply. Sometimes work hour is crazy."
"558","salary, incompetent managers, low professional development"
"559","Lower Salaries
Slow promotion schedule
non-merit based bonuses
There was very little education compensation
Alot of people coast while working 
plateau in experience level"
"560","- Horrible pay
- Lacking transparancy as to how promotions are obtained
- Hard to get in contact with managers"
"561","The pay is not so great at all"
"562","Pay is lower than most companies"
"563","Among entry level positions, not very well paid. Otherwise, great work-life balance, really respectful and nice people, though somewhat dull work (Data-enty)"
"564","Very disorganized HR and programming for interns, may be a function of recruiters being new to their roles
Some people love their jobs there, and others don't --hinders overall productivity in some groups
Receiving feedback depended on group and manager's schedules
Groups are highly separated
Little vertical movement seen for the future, more outside hires come in at higher levels and promotions are hard to get... and occur once a year"
"565","People do not adhere to policies and procedures.  They will recognize, reward  and promote only those who the managers like while others that have dedication and high PE ratings year after year will get any recognision or reward."
"566","Expect to work long hours."
"567","Bad management, unfair/intransparent promotions and hiring"
"568","Pay is not as competitive as other financial companies."
"569","Horrible management that has no rhyme or reason for promotions, bonuses, report writing or assignments"
"570","Credit crisis aftermath continues to challenge"
"571","Garbage-can management style where everything from the most important to the most mundane decisions are done on a consensus basis.  As a result, nothing is ever decided or concluded.  Managers don't take action or responsibility when they ought to do so."
"572","Management is non transparent, irrational, and inconsistent."
"573","can become boring due to the repetitive nature of the job
limited client contact
low pay in comparison to pay in other financial institutions"
"574","It has a very strange HR policy when it comes to firing people, some people are taking advantage of it."
"575","pays are in the medium in bay area comparing to other IT companies.  It's a finance company, don't expect too much about cutting edge technologys.  Too much restrictions in using the internet."
"576","limited career advancement; times have changed--too much regulatory requirements"
"577","Technology and processes are not the most advanced, and there are many areas that are less efficient compared to many other organizations."
"578","Slower pace, 9-5 workers, technology bit behind"
"579","There is no hustle at Moodys and the compensation and growth opportunities are widely known as a joke - they do not exist and this is widely known on the Street.  This is an old company meaning that you must get on a long line to get true promotions leading to great growth, like 10+ years.  Most of the people here are so comfortable it has eroded many parts of the company.  Also, the IT infrastructure of the company... is beyond a joke.  Ratings analysts run this company and therefore there is an operational and company wide promotions lack of focus."
"580","Promotions are not based upon merit, but favortism.  Management has no understanding of what their staff does.  The company's overall atmosphere is a big boy's club.  Minorities are very unlikely to ever obtain senior management poistions.  Working longs hours are expected and not rewarded."
"581","lack of communication between upper management and the rest of the company
lack of management responses when issues are made known - middle management under pressure to hid/voiced their own opinion
High turnover and low morale
highly intelligent middle managers but not empower to make changes. 
Unwilling to pay or recognize team for their effort"
"582","The pay is sub-par to other rating agencies. Senior analysts tend to stay long-term, and therefore, there is less chance of upward movement unless portfolios of credits get reshuffled around internally."
"583","~Management either doesn't know what it is managing, or is overwhelmed with duties
~Young graduates with honor degrees are as disposable and McDonald's workers
~Difficult to trust upper management to have your welfare in mind when making deals and decisions
~Upper management avoiding direct communication with junior/new employees"
"584","People are not very competitive. People are not very knowledgeable and people don't know market very well."
"585","It is kind of boring. i wished more dynamic atmosphere. given the nature of the job, it could not be that exciting"
"586","-get boring--you do the same thing every day, even if you try to work on other projects or with other teams
-there is no incentive to work really hard-- everybody moves at the same pace. Great workers promoted six months before incompetent workers."
"587","Compensation has to increase to retain employees."
"588","Some/often long hours.  Usually not enough, or very little in the way of training.  Bonuses were not always fairly distributed, and stock options were more for the chosen few.  The culture of some managers were that they were hands-on micromanagers, protective of their own jobs, and not willing to hire talent greater than their own.  This led to middle management getting top-heavy due to tenure rather than skill set....  As a result, a lot of good people (at and below middle management level) were let go."
"589","compensation
difficult to be promoted
need to focus more on employee engagement
Groups that report into inexperienced/weak managers tend to have poor morale.  Unfortunately, Moody's does not focus on developing the interpersonal skills of their managers. There are no consequences for being a poor manager."
"590","- Poor compensation compared to similar work performed at the i-banks
- Promotions and advancements require a lot of time particularly for junior analysts
- Technology at the firm is below par"
"591","Compensation is much less than competitors. If you work in a non-NYC office, you need to put in extra effort to ensure that your achievements and efforts are mentioned by those in NY, who are ultimately making the decisions on bonus and promotions. Communication by senior management leaves something to be desired, especially with important things that are related to regulatory and mandatory processes."
"592","The work environment is not very good. Too much levels. Bonus is not dependent on the performance. Boring work now."
"593","- Can take many months or even years to go from temporary to permanent employee
- They like to hire lots of temporary employees"
"594","Work load is barely manageable with very tight expense control on replacing departing staff.  Top mngt staffed by analysts (natch) and value group think rather than independent thinkers. Easy to see this in Moody's current aimlessness with new normal biz environment.  Mngt lacks varied and mkt-based business experiences to be effect and pro-active in an environment more competitive than an oligopoly."
"595","Bad Payment for internship or tem staff, no healthcare and benifit, some politics that you have to learn every day."
"596","-Salary
-Lack of structured training for recent employees
-Managers can be hands-off"
"597","Management has unlimited power. No democracy."
"598","salary is low compared to others."
"599","The main downside of Moody's is its ongoing lack of sufficient internal investment, in particular the IT infrastructure, its cutting corners when in comes to giving people the right tools to do their job properly. Much of this is down to the company's continued aggressive focus on shareholder value."
"600","compensation is below market average. not good for those who like to work in fast paced environment. the company's name is unfortunately all over the news since hte crisis began."
"601","- Poor managers are the norm, because the smarter ones already got bigger, better opportunities elsewhere
- Join the company either early on your career or late. Dont join this if you have organic growth in mind within the company
- Promotion policies are anything but fair"
"602","- An unusually high number of managers, many of whom seem to be doing duplicate jobs;
- Managers can be poor examples when it comes to work ethic and analysis, which is creating a lot of resentment, particularly because the workload has increased substantially (for the analysts) since the credit crisis.  Because the standards were so low when the managers were analysts themselves, they have a hard time... understanding what investors or issuers want and end up giving direction that is often reversed later.  As a result, we've had to bring in more managers to figure out what investors want and how to produce better research.  
- Having Moody's on your resume could hurt you rather than help you, but it depends on the individual and what his/her career goals are."
"603","Compensation is not competitive among Wall St firms. Because we are not really a Wall St firm.
When I first joined the culture was very old school very laid back. Over the past 6 yrs it has changed into a faster pace, profit driven company.
Most professionals have offices and this makes the atmosphere feel very isolated."
"604","Not paying respect to (junior) staffs
Extremely low salary and bonus
Too many administrative works and internal reports
Too many time-wasting training
Ever-changing procedures
Poor promotion/ career prospect
Incompetence of senior management with most are previously analyst"
"605","1. Management culture is meandering at the moment. 
2. Senior management has not been able to root out a lot of managers who should have been shown the door post crisis. Most of upper management probably does not know the meaning of real work, as they are used to see business running on its own."
"606","from the time i have been here so far, there isn't a lot to say.
Moody's is not the right place for people who don't have enough autonomy, you should go towards the other and show that you are there"
"607","Develop more programs to promote from within"
"608","Work-life balance is difficult to achieve.  The more you do the more is expected."
"609","- very stressful environment
- little leverage vs. an incompetent superior (hr not helpful)
- lack of diversity in senior or mid-level positions"
"610","Pay is lacking compared to the work you do. Management is very stingy when it comes to handing out pay raises and bonuses."
"611","It's difficult to get appropriate compensation as your title and/or responsibilities grow - must fight
Luck of pressure may mean less chances for growth or need for self-education, but it depends on position"
"612","Promotions are very hard to come by and are often awarded based on popularity rather than the person actually deserving it.  It seems you build all of the experience and skills that you need to progress, but have to fight for a promotion."
"613","not very exciting. don't promote talent from within. it's a great place to work if you're a seasoned veteran: you get great hours, geat pay, and it's not too stressful. however, if you're a recent grad i would steer clear. they tend to use entry level analysts and associates without any intention of promoting them."
"614","Very manual work, not as automated as one would think"
"615","Very hard to get promoted. The work life balance is poor. Pay is very low compared to other similar industries."
"616","Lack of promotion availabilities.
Preferntial treatment  of certain employees when it came to promoting.
Lack of growth opportunities."
"617","- Promotion is not really related to perfomance
- Compensation is not great and pay increase rarely happens
- Actual work does not change with the job title
- Not interested in retaining high performers"
