"","x"
"184","Good benefits and really great education benefits."
"185","Great people to work with. Real tech minds are here."
"186","For those interested in financial services and with a lot intellectual curiosity, this company provides many opportunities to satisfy the need to learn. In-house training is abundant, and the derivatives industry in general is dynamic and evolving.

Bonuses are usually paid out in full. Merit increases are standard."
"187","Helpfulness 
Learn a lot through just paying attention"
"188","Paid Time Off (PTO) is good (i have 5 weeks now). Pension. Medical benefits are still better than most although that seems to get worse year after year. Office space and kitchens are nice and clean. Work from home is available for many positions. PC hardware is up to date and iphone is the standard phone."
"189","They have excellent benefits work-life balance"
"190","The brand name is good, exposure on Hedging and Speculation."
"191","The company has a lot of intelligent, hard-working people.  Interesting and challenging work."
"192","the culture was great
the people are well educated and really awesome
there is room to grow but only if you make commitment of staying in the same desk"
"193","Competitive pay, leading edge technology."
"194","Good hours, depending what you do"
"195","Great pay and work life balance"
"196","Interesting technology & good projects. Exciting to see what you do make a difference in the global economy. Compensation and benefits are good relative to most companies, although not always competitive with trading firms."
"197","Benefits are good. Potential for great bonuses"
"198","The work I like, New equiptment."
"199","Friendly employees who want to help and strive to do good work."
"200","Pto, bonus and wfh. Salary is industry standard.  It was a happy place once. Close to metra."
"201","Good benefits, smart people and hard working people"
"202","Brilliant people helping each other succeed. Diverse culture, great working environment, good benefits and good environment to grow skills. Opportunities still exist for new employees."
"203","Your efforts have an impact on the world economy."
"204","Great benefits I think it will be hard to find comparable"
"205","all the basics were covered, blue cross, blue shield, dental, eye care, etc. the copays and deductibles were very reasonable, as well, without too much of a hit on the paycheck."
"206","Good benefits, good pay, tuition reimbursment, good technology, interesting projects, they invest in their employees. Management is aware of structural/cultural problems and working to change them."
"207","Very good work-life balance, for the most part"
"208","- Great people to work with
- Corporate Structure
- standard hours, flexible work schedule
- good benefits"
"209","There are good people in the organization."
"210","Good culture, care about the employees"
"211","Large scale infrastructure with plenty of technical challenges to solve."
"212","great people to work with"
"213","You get to work on high throughput low latency systems.  High horsepower technology.  Mostly cutting edge but concept to production times are long."
"214","Great firm that has many smart people working for them.  Management is also very approachable."
"215","Market leader, opportunity to impact or influence in many roles, pay is decent"
"216","Great flexibility on the job"
"217","You learn a lot about internal control procedures that are mandated by Regulatory compliance requirement. Changes to production systems are heavily scrutinized to ensure existing systems are not impacted negatively and are tested fully. Network, database, server and code and configuration changes are reviewed by production change committee. Be prepared to attend weekly change meting to justify changes to production... systems."
"218","Good pay and relaxed hours. Pension scheme is the best in the financial services industry. Pay is generous considering the hours employee work."
"219","Awesome benefits, great employees, decent salary, training available and tuition reimbursement"
"220","gain some start up experience"
"221","Smart people, tough problems, industry leader"
"222","great fast pace environment great hours and pay"
"223","Flexible work schedule
Good office location being close to public transportation and great lunch spots"
"224","Lots of IT opportunity, good management."
"225","Always has the latest technologies. They paid well at the time."
"226","Used to be decent - some really good people to work with but always had problems with senior leadership. Great pay if you still have a job at the end of the day."
"227","Lots of technology one can use"
"228","great people, teams are small and focused
technical work
fast paced"
"229","Despite some challenges, still the best in the space."
"230","Good opportunity career wise. The office is located in the heart of downtown and good for commuting to the suburbs too."
"231","Global marketplace covering all asset classes: fixed income, equities, foreign exchange, commodities, energy and metals. Incredible opportunity to learn about the markets. World class clearing house. Great benefits and competitive compensation."
"232","good money, good people, new things"
"233","Great company very profitable. Mostly good people who know how to run a business and make a profit. Excellent growth opportunities in foreign markets. Diverse product portfolio and keen interest investing in growth startups."
"234","The best part of CME is the welcoming culture and support for the learning process. If you are a 'learner', this is the best place for you in London!!"
"235","Really good place to learn the industry, people are willing to help, flexible working time"
"236","Great people that are willing to help you. Atmosphere in the office is  upbeat."
"237","technology driven company with great benefits"
"238","worldwide known firm, long tradition, attention to employees, working conditions, career growth opportunities, innovative stance"
"239","Well paid, Lots of things to learn, most people are great to work with"
"240","Generous benefits, salary, bonus, good people if you are lucky not to end up with a bad boss."
"241","Benefits, benefits, benefits.   Work/life balance."
"242","Good learning Environment
Exposure to new Technologies
Good people to work with
Good financial services experience"
"243","great benefits and pto time"
"244","Great benefits and a nice relaxed atmosphere to work in. It is a well respected company and will be good for the cv."
"245","Great pay, benefits, bonuses, PTO days, learning opportunities. A great place to advance your career, whether you are just starting out or are a seasoned veteran. I had many good years at CME. I don't regret a second of it."
"246","Opportunity to work on a variety of technology and surrounded by smart people"
"247","Good learning opportunities if you seek them out."
"248","Being new to the corporate world, I had a great opportunity to learn various technologies and the work culture is very good. One will definitely enjoy working at CME."
"249","The exchange is esteemed in Chicago. Great bonuses."
"250","Great work life balance. Hands off management style to encourage self motivation and creations."
"251","Team collaboration, work life balance, and activities and fun with team spirit."
"252","Good Salary, friendly colleagues, nice office."
"253","Smart group of core employees"
"254","nice environment.. friendly people. you can play ping pong at any time."
"255","Standard 9-5
Good benefits
Lateral opportunities in a large organization
International colleagues and projects"
"256","Pay scale is good
Stock options
Good people to work with"
"257","Nice coworkers; Good working hours, life and work balance; Enough instruction from manager"
"258","Amazing benefits, work/life balance, caring culture."
"259","Fast-paced, and occasionally intense.  A lot of exposure to many different departments within the company.  Very smart people working with you that you can learn a lot from.  People are usually easy to get along with here."
"260","Salary, stock options, bonus, location, work/life balance (for the most part) challenging environment, knowledgeable colleagues, technology, industry, global economy importance"
"261","Good salary, benefits and bonuses"
"262","Learn a lot as an intern"
"263","Company has great compensation package."
"264","good benefits and salary compensation"
"265","The pay is highly competitive and the benefits are excellent. They hire smart people. They are innovative. They try to stay ahead of the competition."
"266","Compensation is competitive. 
Name brand will help you with your next job. 
Some very smart and thoughtful people still work there."
"267","Good benefits - flexibliltiy 
I had a good work life balance but limited upward mobility.
If you are in products or operations there is more opportunity"
"268","Great environment to work. Smart ppl."
"269","Good benefits, decent salary, work with great technologies.  The company seems to be moving in the right direction and has cut down on a lot of the bureaucracy.  Poised for long term growth."
"270","Pockets of good opportunities
Strong compensation"
"271","The bonus's are good. you get to work with really smart people and they have a commitment to the job"
"272","You are involved in important decisions that will influence financial industry"
"273","Great company culture; senior management is friendly and open to new ideas; work/life balance is promoted"
"274","Great work environment, great people"
"275","Great  reputable company  to work,learn and grow as an individual. Would not stay long term. Get out after a 1-2 years."
"276","1. Knowledgeable staff
2. Flexible hours
3. Good pay
4. Broad exposure to the markets and the world of derivatives"
"277","great people to work with"
"278","Good benefit, flexible working hours, fast pace work place."
"279","lots to learn, great company, resume builder"
"280","They are leading the next gen commodities trading platform and also offer high hourly rate. They have branches all over the world and people share a good working ambience"
"281","work/life balance is very good. benefits are very good"
"282","Benefits, Good work-life balance, competitive salary"
"283","Stable company with good compensation"
"284","Decent stability and hard to get fired"
"285","The working environment is excellent. I gained lot of knowledge working in this company."
"286","Endless opportunity if you are willing to risk."
"287","Good tech stack, interesting business"
"288","great place to work until it went public, great hard working people many ways to advance. fun place to go monday thru friday ,no weekends"
"289","Good people, good pay, decent advancement"
"290","Good compensation, stable industry, a pension, generous paid time off if you can afford to take it, great location. Big-company technology in a small company forces staff to have multiple skills. After the multiple rounds of cuts, IT is getting more efficient in many areas. Management in some areas are excellent."
"291","If you manage to get Full time employment vs contract the benefits are solid and compensation is good."
"292","Fast and easy to use"
"293","Decent pay 
A lot to learn about futures and options trade
Helpful and motivating senior leaders"
"294","Total Compensation Package, resources, on-site fitness centers, pension plan, opportunities, etc."
"295","There are great opportunities to work with some of the best and brightest utilizing cutting technology."
"296","Working as a Selenium Automation QA in Polaris"
"297","Great benefits and room to grow within the company"
"298","Very fast paced environment. You are presented new challenges daily, and work with some of the best in the industry."
"299","Great benefits, competitive salary, good opportunity for growth."
"300","I worked with a lot of really talented people.  Since the business is very dynamic and always changing, I was always challenged and learned a lot about the derivatives industry."
"301","was a great place for brokers"
"302","Great Experience. I mostly did project management work, assisting team members with excel work and other softwares, and sat in on meetings which was great to be apart of . I felt that I was contributing to the team and company."
"303","- Travel for work
- variety of projects
- benefits are at market level"
"304","Lots to do and learn
Good salary"
"305","benefits, salary is near market rates with benefits making it a little better than some companies, they invest in training and education, great technology"
"306","They paid well with good benefits compared to others.  They are not afraid to spend money on technology.  They had a good, at least in my position, tried to have a good work/life balance."
"307","Great commraderie between co-works and traders.  not having to work weekends. flexible breaks. fast paced day."
"308","Quite a good company to work for. The people are lovely and the company is definitely going places."
"309","Fast paced energetic environment. Loved my coworkers and management was fair and generous."
"310","Good salary, smart people, fairly flexible."
"311","Smart people - Good work/life balance-nice benefits"
"312","World renowned organization that is vital to the economic infrastructure of our country."
"313","Decent compensation and good benefits, used to be very decent work-life balance but changed dramatically in the wrong direction over last couple of years"
"314","ability to make decisions in lower or middle management, fairly relaxed work atmosphere, like the chicago location, lot of young people"
"315","-Stable, routine, easy to coast
-Bonus package and time off is nice 
-Good quality environment if you just want to come in a down a job"
"316","Fast paced company and industry which challenges everyone to deliver and create new solutions in order to sustain our powerful market share."
"317","Learn much from series talks, great atmosphere to learn for yourself and think for yourself."
"318","Good pay, benefits, work life balance"
"319","It was amazing! People, culture, projects. We had fun coming in to work."
"320","IT salaries were better than market but it comes with 24/7 support and many weekends.  Benefits were above average and the location is between the train stations."
"321","Smart People for the most part."
"322","CME Group is the best place to work as intern . It makes a student learn many new technologies over the intern period . It helps student with the software development methodologies and procedures . I worked with Risk and Pricing Systems .It is the good team  and i learned alot . :)"
"323","You have to be strongly motivated and have to use a lot of energy to drive change and create value. The truth that is that you will not get a much higher financial reward if you work at improving things than if you spend the year ""floating""."
"324","work is exciting if you love financial industry
pay you well"
"325","Gained great exposure across the company within my role, and amongst our customer base. Was apart of exciting tasks and projects and the fast pace kept me on my toes. Worked with a great team and felt appreciated for my work and effort that I put in."
"326","Super flexible, good pay, great people. I learned a lot during my time at CME and made connections that will help me move forward in my career as a Software Engineer."
"327","- Work/life balance.
- Commute from suburbs.
- Benefits."
"328","Working environment can be decent. 
Compensation is good.
Developers are very hard working.
Some hard-working folks around here."
"329","Great people to work with and good culture."
"330","Most modern Technology, Fast paced & high frequency trading environment, Great benefits"
"331","The pay and the benefits."
"332","Benefits are great. Work/life balance is there. The ability to work on new technologies is there without the silo type of environment that is present in larger financial firms."
"333","Convenient to transportation, very close to both major Metra stations."
"334","Great Workplace
Great Working Environment 
Great People
Good Learning Opportunities
Great Location"
"335","Good work life balance, flexible schedule, most people are nice."
"336","- Competitive Pay & Benefits
- Coworkers (the few that remain)"
"337","I worked for CME as JavaScript developer for 2 years and 3 months.  The project was interesting and I was well treated by CME Group employees."
"338","good workplace culture and young progressive atmosphere"
"339","You get a lot of exposure to the tech/IT/software side.  Work-life balance is very good.  Office is casual (you can wear jeans).  You can get models patented, which is different from anywhere else and looks good on a resume."
"340","At one point there was a collaborative team environment."
"341","Some of the greatest people to work around, friendly atmosphere. al the greatest workers to be down on the trading floor at the cbot"
"342","Scope to work with good technologies"
"343","Good hours for enjoying the summer months"
"344","Great pay, benefits, training, CME brand looks great on resume"
"345","Great benefits.  Great company to work for."
"346","Compensation and benefits (needs to be at least 5 words and that's a stretch for pros)."
"347","Good opportunity to learn the basics or wait for retirement"
"348","Standard Industry Benefits, Above Industry Pay, Tuition Reimbursement Pension, and Work Life Balance"
"349","Stable company; promotes work life balance; always looking into improving"
"350","Fast pace environment, challenging work, great PTO & benefits."
"351","Money, travel. There are no other real pluses. It's a difficult and political place to work. The list goes on and on."
"352","Great corporate culture, work in a small team that helps you succeed"
"353","- CME employee benefits are impressive, if you can match that with your equal and valuable input to the business you will be rewarded.

- As a freelancer for 7 years, I had hesitations due to worry of bureaucracy and process overload,  however individuals are given ownership of their relevant part(s) of the business, your voice will be heard.

- You will learn a huge amount due to the level of expertise amongst... colleagues.  Especially if coming from a non-fintech background."
"354","Exposure to various markets. client interaction"
"355","People I work with and the talent here."
"356","Stable Company, Generous PTO, Great Social Events, Strong Brand"
"357","good benefits, hours,  and decent pay."
"358","Freedom to trade my own ideas."
"359","Growing business in a changing and challenging industry. Exciting industry learning opportunities. The company has many very smart and devoted employees."
"360","benefits, pto, former management , work from home arrangements, insurance plans

All these cannot cover obnoxious way they treated loyal people."
"361","I thought the pay was very fair"
"362","good people to work with"
"363","Exciting place to work with many opportunities.  Filled with extremely talented people to learn from.  Awesome benefits"
"364","Large company, Events, Nice offices, Great Location, Many intern roles"
"365","Nice people, good benefits and normal hours."
"366","boss was caring, other people were great"
"367","The quality of work is good. You work with some good people. The benefits are great. Major medical and dental are second to none. The profit sharing is and added value. Pensions don't exist these days. The teamwork with NY is generally very good."
"368","Stable, large business with low turnover rate & interesting things to work on"
"369","CME Group was a tremendous place to have an internship and an incredible learning experience. They were very concerned with making sure I had a positive experience"
"370","I like the company culture."
"371","Very laid back and casual work environment, in the clearinghouse at least."
"372","Low Pressure in the working environment"
"373","Competitive salary, possibility of stock options, talented co-workers, and a culture that promotes a Growth Mindset."
"374","Flexible working hours, work remotely is possible, good supply of resources, well known brand name so there's not much of any sell"
"375","Professional environment with people very nice and eager to help out. 
Flexible schedule and detailed orientation. Robust team working and knowledge sharing"
"376","Globex cash cow, great people, good benefits"
"377","An ever-changing culture of dynamic intellectuals with a true understanding of appreciating and celebrating its diverse workforce while delivering on its business objectives cosistently."
"378","Excellent opportunity and great hours"
"379","Wonderful. Internship shows you all different areas of the company and you feel apart of the team."
"380","It has been a pleasure working here. There are days where the activity is low, but there are days where you are consistently learning something new."
"381","The people are wonderful, and very family orientated."
"382","good reputation. Can have access to different financial markets and practice programming"
"383","Excellent work life balance and benefits.  Pension plan is a plus. Competitive compensation and friendly work environment.  Fast paced environment with bright individuals.  Plenty of in house complimentary training opportunities."
"384","I was the Team Leader of a 5-student Capstone Project for CME Group, the stuff in CME, NYC are very kind and willing to help with our problems."
"385","The benefits are very generous and flexible. The office is relatively laid back. Most work can be completed easily during the day"
"386","Good environment, everyone has a chance to move up. Amazing coffee."
"387","Nice, helpful people
Occasionally exciting projects"
"388","Work Life Balance.
Very easy interview process.
CPA Review & Exam Fees Reimbursements.
Up-to 8 days off in addition to standard PTO for taking your exams.
Base Pay.
Benefits.
Not too many pros in the department it self, however the company as a whole is really great."
"389","The culture of the company is great."
"390","Good working hours. Nice office"
"391","Beautiful modern offices
Free tea and coffee
Some very proffesional and knowledge staff."
"392","Good benefits and learning and tools being made available to employees. Location allows easy access to gym and food places."
"393","Fair pay and good benefits"
"394","Senior management is very much approachlable for any issues. Very Transparent and employee friendly organization"
"395","Great employer, great benefits, great pay"
"396","Some people are great, but the best leave
Management have no concept of international growth
Work life is good"
"397","Challenging and interesting work/projects. Lots of room to learn new skills. Strongly encourages work/life balance.  Very flexible, allows team members to work remotely. Strong benefits, PTO and bonus package."
"398","Exciting, face paced, sometimes stressful environment, but there is always something interesting happening and something new to learn"
"399","great people, highly intelligent, excellent office space"
"400","Great health and dental coverage. No overtime."
"401","Great business model that is highly profitable - hard for the under-performers (and there are many of them) to screw things up"
"402","Nobody bothers you. A lot of vacation days."
"403","Benefits. Overall exposure for networking."
"404","There are decent benefits. Flex time and work from home are possibilities.  Some coworkers do want to help each other and care about the job they do."
"405","Awesome place to be.  Lots of opportunity,  Salary, Benefits."
"406","Large room for growth and huge leaarning curve."
"407","Small company that feels big but in all the good ways. Comp is outstanding - Competitive salaries, equity, bonus and  a pension!"
"408","Fostering a spirit of innovation is something that CME Group excels in; I have been here for several years, and it is exciting and fulfilling to see new strategies and activities launched for employees to help them bring new ideas to life. 

The collaborative nature of the organization, as well as the ability to take ownership of projects without any micro-management, are two key attributes that keep me at CME... Group. I feel that I can grow my career here because I am enabled to run with ideas or projects, but can leverage teamwork and collaborating with smart people to help set me up for success. 

Last year, I told my boss that I needed more collaboration and strategy in my day to day work to feel engaged, and he was able to put me on projects with visibility across divisions - I finished the year with a restored energy for my job."
"409","History, reputation, business impacts on a global scale"
"410","Out of all the companies I have worked for, CME Group offers the best overall benefits package.  They have a Wellness Program that allows us to receive a discount on their insurance plus earn gift cards.  Free health screening every year.  They pay for your membership with an immediate care provider that is near work and extremely flexible to your schedule.  They also now offer 12 weeks of full-paid maternity and 4... weeks paternity leave.   There is a gym in the building and they pay for a majority of your membership.  I also take advantage of the tuition reimbursement program.  I wouldn’t be able to afford graduate school without their help.  The work/life balance is great for most employees.  I also enjoy the volunteer opportunities CME has available.  Overall, it is an enjoyable place to work with great people."
