"","x"
"1","The room for advancement is really good. From the trading floors you can make it right up the corporate ladder, The CEO used to report the market."
"2","There are some very talented individuals at CME Group.   Lots of fun and cool technology to work with if you are placed on a large project."
"3","Any other department outside of trading floor operations."
"4","Benefits are great:health, dental, 401ks and pension plan, vacation time is good also-goes according to your years of service."
"5","Diversified group of individuals allows the sharing of ideas. Professional attitude and respect is coached throughout the business."
"6","good environment, best exchange, largest exchange, pays well, lots of products, grown well, good stock price, smart people, very deadicated people"
"7","Great opportunity for growth.  Smart people on staff.  Good direction of the company.  Very strong upper management.  The overall ability of this company is astounding.  There should be a significant amount of growth with this company and it should continue to be strong.  Large impact projects move very quickly."
"8","Industry leader, lots of opportunities exist. The pay is competitive and the benefits are also pretty good.  The people are generally nice.  There is more of a buerocratic feel than at some other companies I've worked for."
"9","Great opportunity for career advancement. Great people to work with and overall a good company. Being an intern I didn't receive any true benefits from the company. The compensation was very fair and there is a great balance of work and life within the organization.

Everyone working there seems to be very driven and technology oriented. Chicago Mercantile Exchange Group has a very large IT department and is very... fast paced. The company is ranked by Computerworld's magazine as one of the best companies to work in IT.

CME Group also has great growth potential and is one that can offer a good variety of job opportunities."
"10","CME is an industry leader in the futures industry.  They have an excellent benefits and compensation package and have a large number of very talented people working for them.  Transferring between groups is allowed after each year.  Their goal is to retain good people."
"11","Pay.  Benefits. Casual work environment -- nobody cares what you wear.    Can be a pretty sweet gig when you're not worked to the bone.  I don't feel like a work for an evil corporation that's trying to take advantage of helpless customers i.e. Credit Card companies etc."
"12","reasonable growth path in this company"
"13","Working with cutting edge technology on challenging projects. Never being complacent and always being on your toes. Customers Mean Everything!"
"14","* Strong IT shop
* Willing to invest in IT Infrastructure
* Getting better on providing good working facilities and amenities
* Good chance to learn about the trading environment
* Only minimal travel required
* Good ability to move around laterally (sometimes even vertically)
* Not many staff reductions / layoffs 
* Solid Senior Management
* On-site fitness facility"
"15","Competitive salary
good benefits
pension package
employee stock purchase plan"
"16","Great benefits package even though only working part-time

Hours are good for people that are not looking for the typical 9-5 job

Decent pay for part-time job"
"17","The internship was short term and the company made sure that I was compensated for the extra expenditures imposed by that.  I had useful discourse with my fellow employees and they were extraordinarily helpful when I encountered unfamiliar technology.  The work was challenging and demanding, which is incredible for an internship and I felt that I learned a great deal."
"18","Great benefits. Comp salary. Very, very fast pace. Very family like atmosphere. Your check will never bounce! Very deep pockets."
"19","CME Group is a financially successful company. 
It is one of the main actors in the international derivatives financial markets industry.
It is growing in several dimensions: Futures and Options on Futures trading, Electronic Trading, OTC markets clearing, Globalization through exchange partnerships, which should bring interesting projects for coming years."
"20","This employer provides excellent benefits, work is fast paced and stimulating, and many exceptional individuals are employed in this industry overall."
"21","very few, benefits are pretty much the only thing nice about this company. Even vacation time is not too great."
"22","It's really a great place to work."
"23","they pay over the top and some of the low level people you work with are pretty nice and you may make some friendships. 

The benefits are amazing including the health insurance and pay. Also they reimburse a lot of your expenses and give you training."
"24","Lots of projects
Smart people to work with
Great location
Extremely convenient commute
Great supervisor"
"25","Very smart people working at CME group. The company atmosphere is really friendly as well as hopeful. I would recommend anyone that gets the opportunity to work here to take it."
"26","benefits are covered at a decent rate"
"27","Good experience and interaction with member firms."
"28","Management is very intelligent. Very Professional."
"29","Financially sound company.  Rewards adequately based on performance.  Promotional opportunities are available.  Opportunities to work with the management right away."
"30","Friendly work environment
Very collaborative
Successful employees treated well - opportunity for increasing responsibility
Co-workers are respectful of others opinions
Differing opinions are encouraged"
"31","Good application of modern technology to achieve business goals and business is willing to adapt to it. We don’t have fight to bring in a new suitable technology."
"32","Great Projects, people are really smart, and you get extensive knowledge of the financial industry."
"33","diversity, career advancement, leadership, worldwide presence"
"34","The best reasons to work at CME Group include the training that they offer, the technology that we have access to, and the resources that the company provides."
"35","Benefits are OK, you have the ability to work from home if necessary. The work week is not too long, however you will probably be working weekends if you are in IT. There are some very talented people at CME group."
"36","Good place to work. Dept. where I worked is very laid back. Seem more willing than usual to embrace new technology and encourage software engineering best practices. Compensation seems competitive. QA is a pleasure to work with."
"37","great work life balance, pay is excellent, lots of networking opportunities"
"38","CME Group is a great place to work.  We have fantastic benefits, excellent work-life balance programs and tuition reimbursement."
"39","-growing company
-industry leader
-comparable benefits/compensation
-autonomy in work"
"40","Smart people, great benefits overall a fine place to work
."
"41","Great people and good life"
"42","Easy entry for non-technical associates into technical positions"
"43","It's become a huge force in commodities trading since NYMEX merged with the CME to form CME Group... especially with energies and precious metals so big in the news. Traders don't act like they own the employees. Better employee benefits."
"44","Benefits are good.  Lots of learning every day.  There are also a lot of really good people working at CME."
"45","The compensation and benefits package makes this company a tolerable place to work.  The everyday people who actually make the Exchange function made my time there enjoyable."
"46","There are some bright people but they are leaving at a fast rate."
"47","One has the opportunity to work with hard-working and smart individuals. The nature of CME's business dictates exposure to many different aspects of the financial industry."
"48","Lots of vacations & okay benefit"
"49","Good place to learn technology and business (IT side)."
"50","Cutting edge technology in the electronic trading arena. 
The high level of professionalism exposes one to many trading opportunities in Futures and Options trading"
"51","Good work/life balance most of the time
Good compensation
Interesting work, good opprotunity to learn about financial derivatives and how an exchange/clearing house business model works."
"52","Excellent benefits package
Secure building
Interesting and intelligent people working there
Laid-back departments (at least mine is)
Big part of a great industry; CME is constantly doing new things."
"53","Great fast moving environment that is suited for high energy people. No day is ever the same which is desirable"
"54","good benefits and competitive salaries"
"55","Large and innovative organization with a lot of history.
Offers multi range of diverse products.
Technologically advanced.
Profitable and growing.
Great Leadership.
Excellent Benefits."
"56","CME Group compensates its employees well and provides interesting work. at times it is difficult to keep up with all the work but it keeps the job challenging and engaging."
"57","there has always been a very good work/life balance at this company (known to most as ""Dow Jones Indexes"").  they also support flexible hours for many teams.  benefits are extremely good, even with the reduction or elimination of certain programs in recent years.

there is a generally laid back atmosphere, which is nice as well.

good place to start off.

almost everyone there is nice and easy to get along... with in a work environment.  the team spirit aspect is definitely very strong in most departments.  from my experience, there is no backstabbing or throwing people under buses from almost all employees.  overall, a very honest, straightforward group that works well together."
"58","We get a chance to interact with people who have been in the finance industry for over a decade and there is a lot that we an learn from them. The IT systems are complex and always keeps you busy. You walk out of the office with a sense of achievement."
"59","The work place supports a cozy work environment in addition to a good work/life balance.  In addition, it provides a window of opportunity to network with clients."
"60","Good work life balance, job security"
"61","High energy enviroment,  very competitve place to work with good opportunities for self starters."
"62","Work life balance/PTO.  S&P bought unit so we are beginning to see the light at the end of the tunnel."
"63","good people, compensation, benefits and work life balance"
"64","Overall compensation and benefits are generous
Management generally open to any ideas you may have"
"65","This company has a good benefits packages, good vacation package, and a good tuition reimbursement package. The only benefit for that is that they pay for your education, which benefits you at your next job destination."
"66","Good vacation time and health benefits. Well-known name. Good internship experience as you will learn how to read/understand U.S. public company financial statements."
"67","benefits packages are generous.  good work life balance"
"68","Best manager I have ever worked for; intelligent, proactive and exceptionally qualified teams managed and implemented large projects with aggressive timelines with ease.  Exceptionally helpful and willing to teach."
"69","its okay to work not happy"
"70","Most employees are well educated.
Industry Leader
Great Facilities"
"71","-Resume builder
-Benefits (tuition reimbursement, decent insurance)"
"72","Excellent work/life balance.  Fantastic salaries - definitely within market range.  Continually evolving technology - we are definitely using the latest/best practices, tools and techniques.  Great location within the city, perfect for commuting."
"73","good leadership by the CEO in London"
"74","An industry thats discussed in news everyday, industry leader
A lot of smart people working around you
Tuition reimbursement without any catch
challenging work environment/gets lots of support to complete target
Excellent Pay/Cash Bonus/Stock Bonus
Day off/Cash for extra hours put"
"75","Interesting IT projects and technologies"
"76","above avg salary and benefits. One can assume a low profile here and survive a long time, assuming a high profile or speaking truth can be dangerous to one's longevity. Assume the lemming position and thrive on the monopolistic income stream."
"77","Fantastic benefits and a very competitive salary."
"78","Very open and easy to approach people and management. Lots of internal hiring and potential to move up the ladder"
"79","Diverse challenges, numerous opportunities, friendly environment, fantastic work/life balance."
"80","I believe I am getting paide well."
"81","There is a lot of freedom to do what you want. the hours are not very long.  you get to live anywhere potentially."
"82","Good compensation, fair work/life balance, intelligent co-workers, great workplace, easy routes to transit"
"83","You have the opportunity to work with talented individuals. You can learn a lot abot all different aspects of exchange futures trading."
"84","Great work-life balance; quality coworkers; relatively low-pressure working environment"
"85","it is an easy job"
"86","Salary is pretty good.Most are happy with the payment that they don't leave the company for several years."
"87","Tuition reimbursement and work life balance"
"88","Good pay for the work. Flexible schedules available after one year. Great health care benefits. Descent communication and feedback. A few bad apples, but overall I liked the people and enjoyed working here."
"89","Great company, good culture. Great leadership team."
"90","Great working environment with brilliant people"
"91","Leading futures and options exchange located close to transportation. Good benefits and salary.with further education possibilities that provides an overview of the financial and commodities markets."
"92","Teamwork among co-employees  and the management"
"93","Interesting work
Good benefits
Good work/life balance"
"94","pay and benefit not much else"
"95","1.  Tuition Reimbursement
2.  Work-life balance; Good amount of vacation days
3.  Good pay if you are fortunate enough to be in ""preferred"" circle
4.  Opportunity to work with an inadequate number of talented individuals for a brief period
5.  Tons of training opportunities
6.  A highly useful portal/training ground to learn about futures, commodities, and even equities"
"96","Most down to earth, relatable and competent CEO I've ever met.
Great work / life balance (if you're in the right department)
Access to as much professional development as you want.
Tuition reimbursement
Part of a 150+ year institution"
"97","Market leader -- for now
Reasonable pay"
"98","Give you space to grow"
"99","good work life balance here"
"100","Good to experience working on the floor before everything goes upstairs."
"101","Very knowledgeable staff, good work life balance, I learned a lot and very understanding when I need off for school. Very pleased with this internship!"
"102","The company spends money to solve problems"
"103","Good benefits, technology is always a priority"
"104","Some really great people work here."
"105","great work / life balance, great health benefits, opportunities to work in different fields and locations. competitive salary"
"106","great place to work at"
"107","Great Salary
Great Management style
Great Location near trains"
"108","There is a wealth of knowledge from current employees. Senior management is willing to listen if you actively approach them with questions. Great educational assistance program and health benefits."
"109","nice office and good location"
"110","Very flexible work hours and work load, learned a lot"
"111","Empresa de tecnología en el fondo, con un liderazgo que ofrece a los trabajadores libertad para innovar y flexibilidad para probar cosas nuevas, fracasa rápidamente y aprende de esos errores para lanzar productos de calidad en un ambiente dinámico.  Compañeros muy listos que en su gran mayoría trabajan mucho. Muchas oportunidades para progresar profesionalmente."
"112","Great location, ok pay, great benefits"
"113","Great pay, great benefits, 401K match, great place to learn and grow.  You get what you put into the experience.  If you are innovative, hardworking, and collaborative, you will have much success here."
"114","Exciting, Varying, Fast Paced, Lots to Learn"
"115","Professional environment, highly intelligent workforce, and opportunities for those with an innovative mindset.  The organization is becoming more open to global mobility and cross-functional job moves."
"116","Good work culture. Work and personal life balance. Excellent benefits. Open culture. People are generally motivated to their work."
"117","Working with the latest technology tools."
"118","Team environment, work hard, play hard"
"119","Nice place to work, Lively environment. Helpful teammates."
"120","the people who work on the trading floor are fun to around and good people."
"121","Very dynamic. Growth company with lots of change and lots to learn. Great collaborative people."
"122","Huge bonus, Competitive Salary, and Great Benefits!"
"123","good compensation, benefits and vacation
Challenging environment with good work / life balance for the most part
You can learn a lot
Great on resume"
"124","If you do not like results, but process. Chicago Mercantile Exchange is more as Chicago Meeting Exchange. a meeting is as a result. Very heavy hierarchy and your extreme dependence on your manager character. Its not enough just to be professional at CME. You have to be a player, you always have to please your manager extra. It is annoying. If they put you on a black list - you going to be fired."
"125","(1) Paid time off 
(2) Very low quality standards make working quite easy
(3) Education reimbursement benefits
(4) They have a virtual monopoly on parts of the futures and options markets"
"126","Good environment to work - modern offices. Latest software and computers. Healthcare and perks are good"
"127","Great benefits. Some of the best in a large company
Easy work. The bar is set very low because of all the incompetence
Great work-life balance
You have to mess up very badly to get fired"
"128","The company is a clear industry leader and many groups at the CME are a pleasure to work with. It's also a very interesting business to learn and there are a lot of opportunities if you go after them."
"129","Great Freedom and Earning Potential"
"130","Nice atmosphere with all diverse cultures, energetic team"
"131","There is talent here, and the people seem genuinely acting in the best interest of company, however this fluctuates from department to department."
"132","Great benefits (insurance, PTO, 401k matching, work from home)"
"133","good work life balance great"
"134","own boss, great hours, ability to make good income"
"135","Good benefits, good oportunities. Many training opportunities."
"136","Great people, interesting problems, good benefits & pay package"
"137","Pay is good, work is fun in the beginning."
"138","Best benefits and you get to work with very smart people!"
"139","Good bonus and decent work life balance"
"140","Great company to work for if you're accepted by middle management team."
"141","This is a great place to work, learn and grow"
"142","Nice people work here; company culture of focusing of work life balance; new projects going on. A good place to start your career or do internship."
"143","Tuition reimbursement policy, smart / innovative people"
"144","Only pro to this company is having their name on your resume."
"145","Super focus on employee engagement.  Incredible benefits. Competitive pay. Access to senior leaders who hear what you have to say."
"146","Small company feeling with big company resources. Great benefits, training, and competitive compensation. Business is globalizing, which is providing new opportunities for career growth."
"147","Great benefits, work life balance depending on the position you hold."
"148","Amazing work/life balance and great office camaraderie."
"149","Career progression, and relaxing working environment with games room. Management very approachable and socialable. Will receive exposure the latest technologies and multiple opportunities for growth."
"150","Excellent company if you look like the majority of people in management. 
Recommend company if they looked like majority management."
"151","A lot of great people to work with, in my field you day is done between 3 and 4."
"152","Absolutely the best benefits package I've ever heard of...even better than the military or police and fire departments!  Lot's of opportunities to have a solid work/life balance.  Outstanding salary ranges.  People are awesome yet most people are fairly sheltered due to constant turn-over."
"153","Strong industry position with leading products across asset classes.  Recent growth driven by international and expectation of interest rate changes."
"154","You ca start your career here after your college. Still good for resume."
"155","Good work life balance, utilizes technology well, relaxed atmosphere, nice people, decent pay and benefits"
"156","Fast paced company with complex issues to solve. Opportunity to work with many smart and dedicated colleagues. Small company feel with big company challenges - perfect place to get great experience and build your career. Great compensation and benefits."
"157","Great benefits and competitive salaries.  Some employees can telecommute which is a plus.  Chicago and New York are exciting cities."
"158","Work culture! Friendly people, fixed working hours."
"159","Relaxed environment, great benefits, bonuses are good not great"
"160","They are an industry leader
Utilize pretty good technology
Demand a lot from its employees
They allow working from home"
"161","Great location, great technology to work"
"162","I haven't dealt with much drama among employees. Projects are well managed. People are nice. They have a good code base, which is not bad to work in. They have good benefits, plenty of PTO, and a generous work from home policy. They keep up to date with technology."
"163","Talented employees, great place to work"
"164","The people can be really great"
"165","Exposure to experts from various financial industries
Opportunity to work with employees in different countries"
"166","good place to work in Chicago and flexible work schedule"
"167","good work life balance, great people to work with, flexibility, company has strong values and is working to become a more efficient work place"
"168","For me this place is awesome, first time in my life it does not feel like crapy corporate environment. Quite environment yet full of responsibilities to take care of. My team is awesome and I enjoy being part of it.

Personal growth and education.
Work-life balance.
Benefits.
Wellness Program.
People."
"169","This is a great place to learn the financial IT ropes. Its a big organization but people are friendly and helpful. I've never seen the backstabbing here that is rumored to be at other orgs. Good benefits with subsidized gym on site. Budgets for IT are usually approved."
"170","Smart people (mostly), industry is evolving and challenging, have great products and services, the largest exchange but still has growth mentality, and always new things to learn (products, customers, technology, etc.)"
"171","employee benefit is good, encourage employees to learn and use new technologies. not very strict working hours. encourage employees on healthy activities, exercise."
"172","Interns able to do real hands on work, and Chicago students can intern during the semester."
"173","A Pension, not going to find many private corps with those"
"174","Fast paced work that is intellectually stimulating. Opportunities are limited at the moment but hasn't been the case before."
"175","Great work life balance, relaxed atmosphere, good benefits and pay, strict 8-5: staying late is unheard of. The job is easy to relax in and collect a paycheck without doing much work"
"176","Some very capable and intelligent people. Very interesting work if you're dedicated in having a career in commodities."
"177","Very good compensation, especially in good years. Clear communications about corporate goals, ethics, and corporate-wide responsibilities. Excellent opportunities for learning many current topics at the survey level. Consistently hired competent people that were a pleasure to work with. Some managers really did value employees."
"178","Great atmosphere, great benefits, great people. All around a great company that is in a transition from new to old. Multiple locations and a wide array of people."
"179","essentially self employed, determine own work schedule, profit potential unlimited, must align yourself with trading firm, securing a membership helps reduce overhead costs if medium + size trader"
"180","Good career experience that will prepare you for later.
At the forefront of its field, so you will be engaged with the most cutting-edge material."
"181","Most co-workers and peers are pleasant to work with, very cooperative, extremely helpful and very knowledgeable. The company has decent medical, dental and 401K benefits."
"182","Work with generally intelligent people. Company is very supportive if you want to improve yourself. They pay for your tuition 100%. Work is not super stressful. Benefits above average."
"183","Decent work environment,  as of the location,  the building,   some people are very friendly."
